id,rating,date_time,user_name,title,body,response
106,5,2019-08-27T14:45:44.000Z,kushagrapandey284,Amazing!,"Workout for me worse than drug addiction. I am literally addicted to cult fit. I go there every day, sometimes twice. Cool knowledgeable trainers, amazing programs.  First you go to cult to burn calories, then order from eat fit to consume them. They already have body checks and clothing line. Bright future ahead",
107,3,2019-12-30T14:07:02.000Z,TanMalHot,Videos for each session don't open in full mode,"On my iPhone XR, whenever I try switching to full screen mode for individual exercises, it jumps to the summary video and doesn't play the selected one. To see these exercise related videos, I have to watch them in normal smaller window.",Thanks for reporting this to us. We'll take a look.
108,1,2019-11-26T04:43:12.000Z,pratthi,Food review,"I had ordered food from zomato, the delivery was all fine. But guyz please never do a mistake of ordering from this app! Here, i ordered at 9am and it says my food would be delivered at 12 noon!! Who does that!!! Also, there is no customer care number on the app whom you can contact nor can you find any number on google! Also, when you call the number available on justdial, it’s still useless as they won’t pick up anyway! Long and short, waste your money by ordering on this app! Pathetic support!!",
109,5,2021-06-25T17:30:45.000Z,aditya3535,Best company to come out of India,"You guys are the best, seameless app, great gyms, conglomeration of food, medicine, gym equipment has just made it more better. Kudos to you guys, the cultlive free subscription has helped me a lot since last year, I will definitely renew my gym black pass once it expires this year end. Just keep going!",
110,5,2020-04-26T06:02:48.000Z,Vivek Dangi,Such a great app,The app is so amazing and the features cult offers is so good. I really liked it a lot cult . The meditation section is just awesome and it helps me everyday. Also the live sessions you have been offering free of cost is a saviour and treat for us during this lockdown. Kudos to the co founders and creators . Thank you so much,
111,1,2019-09-20T06:53:28.000Z,palqnvdozbavrklamcx,No entry in class after 5 mins,"If you are coming from far, you just CANNOT meet traffic jam or any other 5-10 mins emergency, if you do, better go back. Because they'll not allow you. They'll not hear a single thing, they'll just not let you attend the class. They'll allow you to mark your attendance but no class. I totally understand the discipline thing but one emergency?? One genuine reason? I felt very waste when I had to cover 12 kms back to home without even attending class.",
112,1,2019-09-27T19:37:36.000Z,Rrahul A,Stop minting Money and start providing service,"Guys what can’t you have multiple centres at one place when your classes are always full. Wanted to book Yoga for Monday at Indirapuram and what I see on a Friday night it is already at a waiting list of 11 . Absolutely pathetic. Just because of this ,I am not able to attend any class from the past 2-3 weeks because the desired classes are always full.","We'd like to address your concerns, Rahul. Please email us or get in touch with us via Facebook/Twitter."
113,5,2019-06-13T08:38:21.000Z,arjita saxena,Tofu keema paratha,"Just awesome ,,,, i like the way they are taking care of health of there customers and the best was the complimentary date cake its sooo yummmm.... i like the price which they deliver me in my first order i wish the price continue later on. The most important point is please segregate food and gym its become mess in app.","Thanks for sharing your feedback, Arjita."
114,1,2019-09-16T12:25:23.000Z,Pr Dang,Extremely Slow Conplaint Response,"Whenever you raise a complaint with them, whether this is regarding food delivery issues or other reasons, they will take days to reply. And sometimes they just choose to ignore and never reply. Despite they claiming that they will respond within 48 hours. I keep on sending the multiple emails for the same but absolutely 0 response.",
115,5,2021-06-26T02:25:45.000Z,diniz zac,Excellent fitness coach,I have been using this app for online classes during the lockdown and I found it as effective as any class at the cult centre. Excellent job by the team to help me keep motivated and running with my fitness goals. Thank you and keep up the good work.,"Thank you for giving us this virtual pat on the back, you made our day!"
116,5,2021-03-18T14:45:12.000Z,vidhit tulshan,Wow!,"What an app A month ago I was about 75 kgs now after a month off cult food and workouts every day I don’t wanna lie so I must have cheated a few days and had junk but still, today I weigh about 55 Kgs I have lost 20 kgs in the past 1 month it’s great pls try this app it’s fab?","This is absolutely amazing to see, Vidhit! We're super happy to see that we were able to help you in your fitness journey!"
117,5,2020-02-23T07:46:03.000Z,Aaritha,Good but need more,Hey app developer everything is good and fine with app so why cant add a new option like calorie count so the we can know how much excess amount throwing in our belly 🙄. If you add such option I feel really happy 😃 not only me may be few more too !!,Thanks for suggesting this :)
118,3,2020-04-01T05:50:40.000Z,awesome.. no ads..,Internal error message when selecting any live classes,"Hi Team,",
119,1,2021-05-15T12:33:44.000Z,guneetkaurrandhawa,Hate the new update,I have been trying to open the app for half an hour and it keeps shutting down. After the new update the app is very confusing to use and it is not beginner friendly anymore. I cannot find the beginner’s workout I was doing. It mostly just shows dance and yoga options which I do not prefer. The app is confusing to the extent that a beginner cannot understand where to begin. I feel like my money is wasted after the new update.,"Hey Guneet, if you are still facing the issue with the app crashing, please write to us at hello@cult.fit and we will look into it. Also, we have revamped the Live page and we now have a section where the sessions are now divided by intensity. You can also find your session by using the search bar. Thank you for sharing your feedback."
120,5,2018-09-28T15:05:31.000Z,Moseen Najam,Bug in the Update waist hip ratio,I am unable to log the waist hip ratio.  The widget “+” button to increment a number isn’t working. It updates after widget dismiss a value of 0 only with current date.,Thanks for reporting this. Can you also share these details with us on hello@cure.fit along with your contact details? We'd like to reach out.
121,5,2018-10-11T11:04:32.000Z,smithrawanda,Unable to open app,What kind of app have u made it has a lot of bugs plus unable to open the app it get automatically closed what’s wrong with u all,"Hey, there was bug in app v7.14. We've taken care of it now. Please update the app to v7.15 for a glitch free experience :)"
122,5,2018-11-27T07:27:02.000Z,ARK53,Awesome!,The trainers are well trained and every day we get new workouts to do it. It’s suitable for beginner and also advanced people. I am so much happy to be part of cult and on a prime location at Hyderabad. Thanks cult for making me lose my fats and making me better each day.,And we are so happy to read this review! Thanks for making our day :)
123,3,2019-05-31T01:51:29.000Z,anu1326,Unable to cancel pause,Hi,That's right. Please update the app to the latest version to cancel your pause.
124,4,2019-06-03T12:46:14.000Z,Divya196,Dance fitness classes are less and difficult to book,Its very difficult to book class specially dance fitness. Dance fitness is hardly available. Everytime we have to wait till midnight till it open the bookings to book the dance class. Also you have very less number of dance fitness classes.,"Hey Divya, Glad you enjoy Dance Fitness. We will be increasing the number of Dance Fitness classes soon. Meanwhile, check out Prowl or try out some of our other formats."
125,5,2021-06-27T04:31:47.000Z,SheetalHG,Best Fitness app ever,"I really love this app. It has helped me be on track for my fitness. The content, quality, variety is amazing. It keeps evolving and coming up with new fitness regimes. It would not be wrong to say Cult Fit has changed people’s mindset towards fitness. We are Cult!!","Thank you so much for choosing us for your fitness journey, Sheetal! We are really glad that we are able to help you be consistent with your fitness! 💪"
126,5,2021-03-04T16:42:52.000Z,Jannath Hussain,Love u Hrithik and love cult for such amazing fitness,"I am very much happy that i have joined cult family, today was my first day and i am super excited and it was like achieving something  as a foundational base for your health,",We are super happy to have you as a part of our family! Thank you for the amazing review! ❤
127,1,2019-08-21T15:42:26.000Z,Anutam Rai,Regimental and inflexible; no support for customers,"They will bar you from attending a class if you’re five minutes late (traffic or weather notwithstanding. You can’t cancel a class if you’re running late, but if you don’t show up, they penalise you by reducing your membership days. Also, there’s no way you can contact the facility if you want to (no contact numbers provided). Some of the staff I encountered were rather rude and cocky. All in all, a disappointing experience.",
128,5,2020-06-22T08:02:40.000Z,Arijit_fitness_bamboozelle,How to subscribe or even pay ?,"Guys how am I suppose to pay and get a subscription on my iphone app . It ran for the free period and now when I want to buy it , it doesnt go anywhere ?",
129,4,2020-06-15T13:27:30.000Z,Shii95,Unable to purchase the online classes package,There might be some bug on the app which is preventing me from buying the online pack. Whenever I click on the pack it never takes me to the payment page. Please fix this immediately,
130,5,2018-05-21T07:34:16.000Z,aayoustic,Checkout page doesn’t load,"Internet is working good enough, but the checkout page doesn’t load, inspite of trying more than 10 times. Please fix the bug.",Sorry to hear this. Do drop us an email to hello@cure.fit with your details. We will have someone from our team check on this on priority.
131,1,2018-08-06T06:27:05.000Z,new cult member,Bad work out regime.,Most of their workouts are a one size fit all. Also the trainers hardly check your form. Don’t also go to the strength work outs blindly. Just broke my back twice as a result. Have to spend money on a physio now. Popular sessions like Zumba are mostly overcrowded.,"Hi there,"
132,5,2018-10-11T10:20:30.000Z,SiriKP,Latest Update is not working,"Hi Team,",
133,3,2018-12-25T09:23:22.000Z,sourabh167,Complicated UI designs,"Hello cult team,",Thanks for your candid feedback. Can you please share your contact details on hello@cure.fit so we can discuss this in depth? Would love to get more detailed feedback so we can be better everyday!
134,2,2019-04-10T08:08:35.000Z,Nikhil1071992,Slots is the biggest issue,Been a member for 2+ months but I spend more time trying to book a slot than working out. The gym is nice and workout intensities are good but the slot booking algorithm is pathetic. You’ll never find a class of your choice however in advance you try to book. There must be a better way to get around this. The waitlist feature doesn’t seem to fix it.,"Hi Nikhil, appreciate your honest feedback. The waitlist feature is just one of the initiatives we have taken to fix this problem. We will soon be introducing more features and initiatives that will address this concern."
135,4,2019-09-14T13:34:42.000Z,nishantjain2088,Issue with Wifi,App interface is good and chat option with doctor is really a innovative.,"Nishant, we'd love to investigate further. Would be great if you can email this over to us at hello@cure.fit"
136,5,2020-08-04T01:54:04.000Z,PNSSA,App is great except..,App is great except the landscape rotation is stuck on just one side which is creating problem when I try to place it on the kick stand. Please allow the orientation on either sides during the live sessions.,
137,5,2019-12-26T05:02:20.000Z,M.G Titu,Add Volt Fitness in your app,I wanted to be a member of Volt Fitness Club which also happens to be part of Cult. Kindly add that in the app as well. It would be better if we could track our progress and buy one to one trainings in Volt from the app itself.,
138,4,2020-04-29T05:59:43.000Z,jitshah1283,Unable to setup voice- control meditation,"I have updated the app and uses the latest version of this app in my iPhone X, but still I am not able to setup voice control meditation.",
139,4,2020-04-15T10:33:01.000Z,h 27,Sleep stories should also be available im hondo,"Though the app is perfect , but to add more here i suggest to add the language options too as i have old age family members who wants to do exercise and meditation but they are comfortable with hindi language",
140,1,2018-11-28T16:52:29.000Z,disisanshu,Bad application. Technically challenged.,"The app has several issues. This startup has grown huge in near future but the tech is still bad. Fancy from top but it's bad at the core. The video buffer time is in minutes when high quality videos are buffering at very good rate at all the prominent other applications. Fitness center is fine. The good thing is the intensity at which they train. Just started, so I can't comment on their exercises and their patterns though.","Hey Anshu, Thanks for the candid feedback. We'll check on the buffering of the videos. We hope you continue to workout & be better everyday!"
141,5,2019-04-04T10:27:13.000Z,food@lover,Superb se bhi uper food and app both,"App works perfectly really kudos to developer...very handy app ..it’s my third month continues with monthly food subscription food is awesome and i love the part where u can change all aspect of food delivery address,time,food itself...:)",
142,5,2021-06-27T15:42:55.000Z,Minnehsfdjdk,I am cult!,"Cult is really helpful in keeping me abreast in exercising, dancing and practising yoga and options are so many that I can choose from whatever mood and state of body I am in! My journey with cult has been wonderful esp during lockdown ! I just love it!",Reviews like these make us want to work harder and give you a better experience everytime! #WEARECULT
143,4,2021-07-09T03:52:43.000Z,Mrs. Batra,Journey to fitness,Cult has been amazing experience for me during this period. I m moving forward step by step everyday. Thanks a lot for ur dedication And precious time. Trainers are amazing and  it’s fun doing workouts with such experienced guidance . Keep going,"We're so grateful for you and your review, thank you! 🤗"
144,5,2019-08-03T13:18:12.000Z,sdbnglr,Truly helps you unleash your potential,"I started loving myself after I could work out hard at cult and shed a lot of sweat. All trainers are fantastic. Beginner or the expert, this works well for all. Kudos to the entire team. Please keep up the great work.",Thank you for inspiring us to be better everyday!
145,1,2020-09-26T09:24:21.000Z,rj09124,Casting Issue,"This app worked fine for me the whole lockdown, it helped me to stay active n fir, the trainers, sessions, mode everything was exemplary but few days back the energy metre stopped working abruptly though that was taken care of, after some bug fixes now casting is unavailable, earlier casting to tv through iphone AirPlay was available and quite easy to do, but now the casting option is totally vanished. Look into this asap","Hey, we'd like to get this checked on priority. Can you please help us with your registered contact details at hello@cure.fit? We'll be waiting to hear from you."
146,5,2020-05-22T14:03:31.000Z,heathmissM@y,My review,This is the best workout app ever basically other app bring sweat and no reductions or fitness but cult fit is the one which realyy help in our fitness lifestyle and I am going to continue it .even they have recipes for a perfect health and this app is the best,
147,5,2020-09-17T07:41:37.000Z,aditimonga,Perfect,"The app incredibly stands out in all the workout platforms provided. As a developer I must say, the team has set a benchmark of perfection in performance and efficiency of the app.","Feedbacks like these is what keeps us going and give our best to you! Thanks a ton for this, Aditi! We'll make sure to make your experience nothing but the best with us!"
148,1,2020-05-13T09:30:00.000Z,Rashi Kale,Purchasing a pack,"This app is really good but likewise has many glitches. There was an offer till 11th May where I purchased a session pack.. recieved the receipt. But on enquiring found out that I purchased only 1 session!!! This wasnt mentioned anywhere on the receipt, mail or the app! This company is duping its customers. How is any customer supposed to know whether they purchased a 5 session pack or only 1 session! How come none noticed such a big bug!",
149,5,2020-02-06T14:20:36.000Z,rama.khandelwal,Weight loss,I lost 2 kgs in a week just by using the beginners session (30 mins)  also keeping in mind abt the diet and timings to eat and sleep. This is a great app for all those who can’t take out time to go to the gym. Just half hour and ure good to go! 🙌🤘,
150,1,2018-07-06T03:45:17.000Z,Sid Poddar,Sync with phone calendar required,"Once sessions are booked thru the app, the app needs to access the phone calendar and make entries there too along with 1-2hr prior reminder before workout timing. This will also help to see if slot booked is not overlapping with any other meetings or schedule...","Hey Sid,"
151,1,2019-03-26T22:30:08.000Z,Ntin is impossible,Need improvement!,"Most of the centers dont have sports or sports conditioning classes. The application is too complicated, please make it more user friendly, it has a lot of things in one place, it’s not at all systematic.","Hey Nitin, we'd like to get in touch and address all of your concerns and provide the right solution. Please email your contact details to us on hello@cure.fit. We'll wait to hear from you."
152,5,2020-04-09T04:41:33.000Z,Dr Kailash Patel,Pranayama session,"I have been doing yoga for last 20 years , but today’s live  session in which  I did  Surya Breda , Chandra Bh Eda , Bromary and Subodsana. It was mind blowing experience . I never felt such kind of relaxation . I got same kind of relaxation as if I have taken Balini’s massage . Truly amazing .",
153,5,2019-10-21T18:03:32.000Z,Stonecoldlove,Best place,"Only place where you can do everything, from sports to dance and yoga. In love with cult, please take unlimited cult package instead of single centre cause you may not be comfortable with staff at all locations hence I prefer unlimited centres access","Thanks for writing this review. However, your last point of comfort with our staff makes us uncomfortable. Would love to understand from you if you've had a not so pleasant experience at any of our centers. We would like to address it right away!"
154,1,2020-02-29T05:57:59.000Z,Ethan_Maverick,Pathetic set of people,"I had a terrible experience with the Malad centre. Unprofessional, indifferent and diffident from the start. The ‘dance’ studio had a bunch of disinterested, unfit af looking people who claimed to be trainers, or so said their tees. If you liked Gully Boy, you will get an immersive experience here! But if you’re serious about hygiene, health or fitness, walk yourself to a professional gym. There might be one round the corner! And hey Cult, learn to respect your customers; it’s a quality that never goes out of fashion!",Something seems to have gone wrong & we'd like to sort it out. Please email us at hello@cure.fit with more details about this and we'll fix things.
155,1,2019-11-06T20:19:51.000Z,Raj6789,"Good at causing injuries, royal high arrogance & robbing money",0)A)Over priced packages cause illusion that it’s something valuable.,"Cult is very different from a regular, conventional gym."
156,5,2020-05-14T06:47:05.000Z,Kaukau1,Awesome app,Must have for the health & fitness conscious.,
157,5,2019-06-20T18:35:08.000Z,sadiastella,One best feel to the taste buds and the tummy,Just wanted to try after seeing some ads and wow it is all worth my time and my hunger . Food was just yum with all that health stuffs in it 😜 yet so tasty . I am totally in love with what I ordered and will do it soon again .,Can't wait to serve you again!
158,4,2020-04-14T08:49:27.000Z,felcy david,Not audible,"In the latest version, There’s some audio problem and none of the training videos ads audible and there’s no no control for volume to check it out",
159,5,2021-01-31T15:10:43.000Z,Art@1018,Unable to screen mirror if using app from Iphone or ipad,Initially I was able to screen mirror on tv via Iphone but nowadays cult app is not showing screen mirror option on Iphone. Kindly look into it.,"Hey, the screen mirror option is a feature of your phone and we have no control over it. If you are referring to the Cast button, the cast button will be highlighted when your phone is connected to the same Wifi network as your TV/Chromecast. If you are not able to see the button at all, please write to us hello@curefit.com with a screenshot and we will look into it."
160,4,2017-10-20T19:02:00.000Z,Maxeyora,Let me sign in,"Please let me sign in with my email instead of just having Google and Facebook sign-ins? Also, please let me export just my calorie intake to the Health app when I order food from you (if you don’t already, I don’t know because I can’t login). Thanks.","Hey,"
161,5,2018-09-02T18:25:12.000Z,Prabz05,Best ever,So after 6 months I am posting my review. This has been the best experience in my entire fitness journey.,This review has helped us kickstart our week with a ton of motivation & enthusiasm to #BeBetterEVeryday! Thanks for this awesome review and for vouching for us so strongly.
162,5,2019-05-26T07:00:13.000Z,Swetaa Varma,CULT ROCKS👏🏻,"More power to the persons who came up with the idea of CULT and implemented it. The place, ambience, trainers are amazing. I am in love with CULT. You guys are making the world a better place to live by promoting health through CULT enriching the lives of people to make healthy choices interms of diet, fitness and lifestyle🤗👏🏻👏🏻👏🏻I RESPECT AND SALUTE CULT✊🏻",We've got goose bumps after reading this review! It's an honor to be your partner in fitness :)
163,5,2020-04-24T16:11:41.000Z,Dr Harpal,"Great experience, suddenly you realise, you are alive and kicking.","Indeed a great session, fast, involving and very crisply put forth. Loved the entire experience. Great job by the trainer and the entire team who has put up this great experience.",
164,5,2020-04-11T02:02:23.000Z,suprdailu,Wonder App!,"Hi,",
165,4,2021-08-15T14:40:59.000Z,Abhay30,Seeing issues with casting,Off late I am seeing issues while casting using chromecast of my tv. Video and audio loses sync. Audio moves far ahead of video. Please fix this . I am using iPhone 12pro and on latest IOS.,
166,5,2019-07-24T10:22:32.000Z,shibinshibz,Cult be the best,I’m experiencing the best service from cult and I’m loving it❤️,Thanks for sharing such a heart felt review :)
167,5,2020-05-04T04:35:41.000Z,pratikshadixitgujarathi1109,Vinyasa changed to power yoga?,Simply loving the app. And also getting motivated for the sessions. What is have most practiced is vinyasa yoga and I can see the change. Just wanted to ask has vinyasa yoga renamed to power yoga? As all the asanas are same.,
168,5,2020-05-02T05:00:36.000Z,Shubh@nk,Complete Fitness At it’s best,"What one needs is, Meditation, Yoga, Workout, which is available in this app with best instructors. Dance Fitness is an added advantage which boosts our energy. I find a complete fitness package at one app. Wonderful and Keeps me motivated.",
169,5,2021-06-29T02:03:59.000Z,Skelter-helter,"Great app, amazing service, excellent overall experience","The workouts are great, the app is just too good, and their customer service is simply the best. Definitely one of the top Indian brands out there. Great job guys. Thank you.",Thank you so much for your love and support! You really made our day with this incredible review! 🙌
170,5,2020-07-02T12:09:50.000Z,Sun.B,You can download it just for Olivia,She is full of energy and will keep you energised and focused through the workouts . I would suggest her workout over any other so called “celebrity” trainers .,
171,2,2021-04-24T06:16:16.000Z,SwahamB,App bug not resolved,"The Online GX or Online PT doesn’t work for some users and the support is pathetic. I have been raising a ticket since the last 7 days and all they have to say is “We have forwarded the issue to the relevant team. They will get back to you in 24-48 hrs”. Guess what, the reply is same since the last 7 days. Of course, no resolution yet.","Hey Swaham, we are very sorry for the inconvenience. We have fixed the issue with Online GX. If you are still facing the issue, please write to us at hello@curefit.com and we will assist you."
172,5,2020-05-13T03:06:31.000Z,Chaoboyster,Perfect app,I have been looking out for easy to follow training material to work out everyday. Found my peace with this app. I m gonna follow this app religiously. Just mirror it to your TV screen and there you go. Easy peasy.,
173,5,2020-02-02T20:55:40.000Z,ranveeeeeeeee,Need more sleep stories !,"Hey! The app is absolutely fantastic as well as my favourite of all apps. There's just one request, if you could add up some more Sleep stories and meditation sessions to it, that would be really appreciated!!",
174,5,2020-05-05T05:48:48.000Z,prerna mahajan,Beginners session,Did all the 6 sessions,
