id,rating,date_time,user_name,title,body,response
747,1,2020-10-10T09:08:54.000Z,Revanth mahesh,Worst support ever,"Mr. Bansal, Please sell this to a better company like how you sold my to flipkart. Will never waste my money again on this sub par services you provide","Hey Revanth, we'd like to know more about your experience to make it better and assist you further. Kindly write back to us at hello@cure.fit, we'll be waiting to hear from you."
748,1,2020-09-06T18:16:00.000Z,hydroxychloroquine,Ap UI not upto the mark,"Cure fit it’s a really nice app the feature is really cool, the life gym program in personal training diet chat really great. But app ui is bad, especially the ipad app.","Thanks for the feedback! :) However, we'd like to know more about what you think could be improved in the app to give you a better experience? Please feel free to write down your suggestions to us at hello@cure.fit"
749,1,2020-06-25T03:46:49.000Z,aJ-673512,It was awesome app. But now waste for an ordinary person,It was free access for some sessions. But now it need membership for every session. So I stopped using it 🙏🏻,
750,5,2018-09-23T04:15:26.000Z,Baljeet84,Boxing,Mr. Himanshu is amazing coach with full of energy and train at micro levels,"Thanks, Baljeet!"
751,2,2018-11-21T03:03:06.000Z,sanjay kackar,Do not like it.,Getting appointment on phone was easier,"Hey Sanjay, you can always walk in to get an appointment. But booking an appointment from the app will just save you the trouble as it is really easy to do so. Write to us at hello@cure.fit if you need help with booking appointments."
752,5,2020-05-16T09:43:03.000Z,Jagannath786,Fit with cult,It’s amazing to be a part of cult 😊,
753,5,2020-05-01T09:42:46.000Z,Rajeshcse515,Clut fit be fit,Great app for fitness,
754,5,2019-07-28T15:21:44.000Z,Maancy,Good,I’m loving the experience and the trainers are amazing.,Thanks for all that love!
755,1,2020-04-02T05:09:21.000Z,joekothari,App not opening,Cult application is not getting open after last update. 😡,
756,5,2021-07-11T14:06:13.000Z,D Digambar,Love Cult,Too Good but love to have face to face.. soon,"We are already working on reopening the centers in staggered manner, stay tuned! 😁"
757,1,2019-07-27T08:02:27.000Z,kush kapoor 66,Its all about delivery boy,I was ordering my food and he was cancel my order He was saying i m gating late  that’s why am cancel the order seriously man 😡😡😡😡,"Hey Kush, after waiting for a few minutes our crew will unfortunately have to cancel your order and move on to the next delivery location. This ensures that subsequent orders are not delayed and that other customers don't have to wait too long for their food."
758,4,2020-04-26T11:45:09.000Z,always stay energetic,Great workout apps,"I enjoy to do dance Fitness, meditation , strength exercise..👍",
759,1,2020-05-05T13:14:38.000Z,himan19812010,App just stops in between,The latest version is very bad and it throws you out - it’s very irritating,
760,1,2019-06-02T20:54:58.000Z,tejde39,No use,Worst app anytime i tries to order food not available at that time even in city of Hyderabad,"Hey there, thank  you for choosing eat.fit. Apologies for the experience. You can also go to the Order Later tab and place an order for a meal in the next few hours. We'd also like to understand where you were ordering from. Please share your details with us on hello@cure.fit"
761,5,2020-02-06T03:49:15.000Z,Sunil khajuria,We are cult,Positive waves in a very first day,
762,5,2021-03-13T01:21:38.000Z,Bharg@vv,My Mojo!!!,My only Mojo to get high and fit.,"That's what we love to hear, Bhargav! Thank you for your 5-star review! 🔥"
763,1,2019-11-22T12:49:08.000Z,u give me nick name,Improve,Classes r good .. app is bad ...even i have already deleted the app i still get some notification .,Email us at hello@cure.fit and we will help you out.
764,1,2019-06-18T15:15:29.000Z,Anonymous @4321,Pathetic food,The food tastes like its pre cooked from last 13-14 hours. Tastes pathetic. These guys are fooling you. Better use SWIGGY they anyways have a better customer services,Hey there. Something's not right. All our food is fresh and comes loaded with the goodness of health. Please share more details with us so we can help you better.
765,5,2020-07-10T03:01:04.000Z,Deepaps,Best partner during lockdown ✌️,Best partner during lockdown ✌️❤️,
766,5,2020-06-16T12:46:30.000Z,kavyug,@@@@,i have been using curefit through this lockdown period,
767,5,2020-02-25T01:30:30.000Z,Dr Abhay lotlikar,Dr abhay,Very nice centre . Wonderful beginning to the day . Beautiful & amazing.,
768,2,2020-05-16T18:56:50.000Z,gsrasr123)₹,Bad pt section,"App has become very buggy, especially the PT session booking is very bad",
769,1,2020-04-11T21:05:32.000Z,Aanchal96,App not working!!!,I am trying to sign up but nothing is working!,
770,5,2018-07-01T11:56:55.000Z,Karthikeya R.Reddy,Young,It’s a superb place for young sports men to train,
771,5,2018-10-11T13:10:00.000Z,updated version not working,new version not working,new version updated bt app not working,"Hey, there was bug in app v7.14. We've taken care of it now. Please update the app to v7.15 for a glitch free experience :)"
772,1,2018-12-13T14:35:35.000Z,1jaykishan,RUBBISH!,Absolutely rubbish app. Can’t navigate into any menu. Tried to get into the meals menu but it kept opening some 1 minute ad video. Rubbish lay out.,That doesn't sound right. Can you please share more details about this on hello@cure.fit?
773,3,2019-04-01T19:23:19.000Z,karan dandamudi,Need tips on diet.,Exercise without diet plan does not give u results.,"Thanks for sharing your feedback, Karan. The eat.fit Weight watch meals in combination with a regular workout routine will help you for sure :)"
774,3,2019-05-01T01:54:01.000Z,doc Mahadevi,Nice! Try try u ll definitely reach ur goal!,Awesome feeling! 👍fitness 100%,Happiness 100%
775,1,2020-11-12T03:18:18.000Z,asaiatin,Freezes on SE,"App repeatedly freezes on iPhone SE (2020) and recursively launches the location selection bottomsheet. Post confirming city, doesn’t scroll.","Hey, that doesn't sound right. Please write to us at hello@curefit.com so we can look into this and fix it."
776,2,2020-02-14T09:55:09.000Z,ashleyxrated,App crashing,Hey your app is crashing unable to,
777,1,2020-01-04T15:43:40.000Z,Yash Lokwani.,This App is SCAM FRAUD! Be Aware!,"I placed an order, order was never delivered and money was never refunded. There is no customer service helpline. I don’t know where to report. THIS IS FRAUD. Do not download this app.",We apologise. We've credited 100 fitcash to your account so you can place the order again.
778,1,2020-08-01T23:29:39.000Z,cjaityuu,Money minded,Initially I was listening to the sleep stories for free...now everything seems to be a subscription after14 days..very pricy...greedy ppl,
779,1,2021-05-23T17:55:43.000Z,deeqwer,Disgusting,Ordered paneer Biriyani and chef as fried house fly as well with the biryani. Please don’t make claims of hygiene cooking. Now I wonder if you people follow COVID norms during cooking. Guys please be careful before ordering.,"Hey, we are very sorry about that. Please write to us at hello@cult.fit and we will look into this issue."
780,1,2018-09-12T10:05:01.000Z,Sawan005,Worst food quality.,"Food is not at all fresh, they sent 2 days old salad. Directly i through it in dustbin",Sorry about that. Can you please share your contact details on email with us at hello@cure.fit so that we can make tings right?
781,5,2018-09-16T06:17:31.000Z,ricky kapoor,Fee,Fee is too high,
782,5,2018-12-17T10:19:48.000Z,prashant khatri,Great concept,Trainers are doing great job :),Thanks a ton Prashant! Our trainers work really hard to ensure you have the best workout experience :)
783,5,2019-05-20T15:21:00.000Z,Hacker 1197,Cult,Best mode of staying fit .. Best trainers and best of all !,#WeAreCult!
784,5,2020-05-11T04:21:34.000Z,Bhatt sana,Zumba dance session,It was very enjoyable and perfect,
785,1,2021-01-15T07:32:55.000Z,vaatsalya,I did not get my refund,"Despite following up, my refund is still not done","Hi Vaatsalya, please DM us on Twitter so we can share the refund reference ID for you to track the refund since it is successful from our end."
786,5,2021-05-27T02:09:36.000Z,Nrameshbabu.,Mr Ramesh,It’s fantastic,"Thank you so much for your encouraging words, Ramesh! 🙌"
787,3,2021-06-21T12:24:41.000Z,suks16,customer service is very bad,overall it’s good the classes are good except for few trainers and the customer service is poor it has to be improvised to great extend,"Hey, thanks for your review! Can you please write to us at hello@cult.fit with more details so we can work on improving ourselves?"
788,5,2021-05-21T03:49:32.000Z,appfajgabac,I love the guided meditations,Really a nice app,Thank you so much for your 5-star review! 😊
789,4,2019-07-15T06:41:52.000Z,tparekh,Loved cult😊😊😊,I was really impressed with punctuality and trainer of cult. Workout is so perfect and intense.,So happy to read this review! Hope to see you more often :)
790,5,2018-02-03T05:38:54.000Z,srinireddy,Yoga,Real place for yoga 👍 nice ambiance,
791,4,2018-12-19T07:28:35.000Z,Zair1,Fitness,South Mumbai needed a facility like Cult fit. The group exercises they conduct are very good.,"We're so happy to read this review! We do have Cult at Palladium at the moment, but very soon we'll be available in South Mumbai. Hang tight!"
792,5,2019-01-05T15:06:53.000Z,soumik 007,Soumik 007,One of the best food I ever eat good and testy,Yay! You made our weekend!
793,1,2019-02-20T04:19:37.000Z,deepakchandra076,Worst support,My order is not delivered and my money is also not get cash back...,
794,5,2019-04-04T02:53:12.000Z,Rishab goyyal,Best workoup app,Certainly the best exercise app,
795,5,2020-07-28T12:52:58.000Z,Rohini.k,Best app for workout and yoga,Excellent,
796,1,2020-07-22T08:21:23.000Z,ExemplaryPath19,UI,Why is the UI so bad on iPad. I can only see a small screen and the touch don’t work,
797,1,2019-08-06T08:17:45.000Z,SameerY,Late delivery.,"Their own delivery is generally late. Ordered through Zomato, and delivery timings were awesome. Eat for need to work on their delivery and tracking mechanism.",We apologise for the poor experience. We hope to serve you better next time.
798,1,2019-07-17T08:44:35.000Z,sonusantosh18,Bad experience,It was very bad experience in ordering food.,"Sorry about that, can you please share more details with us on hello@cure.fit ?"
799,1,2020-07-15T12:47:10.000Z,Dev23021876,Need iPad version,Please release an iPad version as classes don’t work properly without app and so does pt,
800,1,2018-10-11T02:57:17.000Z,pankaj.mangotra,App crash,App crashes after the latest update.,"Hey, there was bug in app v7.14. We've taken care of it now. Please update the app to v7.15 for a glitch free experience :)"
801,5,2019-03-04T17:48:39.000Z,LiveLoveLaugh0001,Fab !,Excellent App! Loved the idea behind the app.,Thanks a ton!
802,1,2019-05-12T06:44:25.000Z,soubhagya. dev,Worst service,Order is not showing after order In app.,"Hey Soubhagya, apologies for a poor experience. But we see that your last interaction with us on 12th May, was addressed in under 1 hour. As explained to you the option to track your food is available on the app. For any other queries, feel free to reach out."
803,5,2020-01-09T09:38:32.000Z,soni goel,Cult fit,Amazing experience......trainers r very co operative....so hygiene...great atmosphere,
804,5,2019-07-12T14:01:05.000Z,abhi989,Raheja vihar cult,When is Raheja vihar going to start?,
805,1,2019-06-22T06:08:21.000Z,Deepika Sahani,Disheartening Experience at Cultfit Jaipur,Worst experience ever...,
806,5,2020-04-25T01:29:34.000Z,Dr.Aarohi,Wonderful experience,L,
807,5,2020-04-25T10:44:58.000Z,vikas bundelkhandi,This app is lit,Perfect app for fitness lovers.,
808,4,2020-03-13T16:21:44.000Z,qwertyuiippafgk wbmxkhdgn,Life changer❤️❤️,I love the setup the training sessions n the discipline.,
809,5,2020-03-24T08:06:47.000Z,ankit_vij87,Excellant App,Amazing workouts,
810,5,2018-01-03T14:05:58.000Z,vvinu77,Keep us fit,❤️🌟🌟⭐️🌟🌟,
811,5,2018-10-21T17:13:15.000Z,hasan saifi,American chicken salad,Quality and taste awesome,Glad you enjoyed the salad! Hope to serve you soon again :)
812,4,2018-10-27T07:10:38.000Z,Sharmaat,Delivery issues,Not deliverable in all the areas of South Delhi :(,We'll be there soon :)
813,5,2019-01-21T17:21:48.000Z,speak2aj,Great,All is well,That's great to know!
814,4,2019-04-16T16:04:10.000Z,chalasani.chaitu,Add more,Need to add more varieties in the menu,"Hey, we're constantly revamping our menu. If there is a specific meal slot or any other suggestion for the menu, please share them with us on hello@cure.fit."
815,5,2020-03-13T12:38:41.000Z,చంద్రశేఖర్,We are cult,India’s no 1 fitnesses app,
816,1,2020-12-06T11:35:04.000Z,abhinavmahanta,App is unresponsive on IoS today on 6th dec,App is unresponsive and not allowing to select any options,"Hey, if you're still facing the issue please try uninstalling and reinstalling the app. If the issue still persists, write back to us at hello@cure.fit and we'll look into it."
817,1,2019-08-28T19:31:51.000Z,BrajeshKr,Not a iPad native app as it should be!,Kindly make iPad native version of this app. We don’t want to use the app in 2x zoom mode.,
818,4,2019-07-12T14:10:14.000Z,chethan B,Chethan,Ordered first time . Food was very good,
819,1,2020-12-07T05:19:56.000Z,arunnama,App is not working,The app is not working subscription did 1 day ago.,"Hey, we were facing some technical glitches however, the issue has been solved now. Let us know if the problem still persists and we'll look into it."
820,1,2018-10-11T02:03:39.000Z,K@vish@321,App is not working,After update app is not opening..,"Hey, there was bug in app v7.14. We've taken care of it now. Please update the app to v7.15 for a glitch free experience :)"
821,1,2018-12-10T14:41:17.000Z,genuine 1800,Marketing gimmick,Over priced without any reason . Pure marketing with little value.,
822,1,2019-03-10T12:57:19.000Z,cult_binny,Cult score at home not working,Getting stuck at warmup starting in 03 seconds,"Thanks a lot, for reporting this. We'll get this working soon and let you know as soon as it's fixed."
823,1,2019-04-17T14:49:22.000Z,ghasita,Worst customer service,Pathetic experience with them,"Hey, we'd like to understand what went wrong. Please share more details with us on hello@cure.fit"
824,5,2020-05-08T10:40:41.000Z,kavitha gopu,Cure fit,Nice! Workout,
825,4,2019-12-02T05:47:20.000Z,tiasmr,Mobility class,Please add mobility class in sector 62,We'll try to add this to our schedule.
826,5,2020-11-29T05:33:27.000Z,Fndind,One Stop Shop for Workout,"(A lengthy review though, but you will not regret reading)","Hey Vignesh, we are simply overjoyed after reading this review! You made our week with this review! Thank you so much for your amazing and detailed review! It's reviews like this that make us want to work harder and give you the best that we possibly can everyday! :D"
827,1,2019-07-04T07:57:22.000Z,qqww bhupp,Waste of time,The people at cult lack professionalism.,"Hey there, something seems to have gone wrong. We'd like to make amends. Please share more details with us on hello@cure.fit."
828,5,2020-07-09T15:30:39.000Z,Anjana HD,Cult is the best fitness app,Cult is the best fitness app,
829,5,2020-04-04T07:40:42.000Z,aarthi a,Pranayama,Loved the session,
830,3,2018-12-15T15:55:40.000Z,Jagriti4,Zumba session at sector 56 Gurgaon,Please increase the number of Zumba sessions at sector 56 Gurgaon center to atleast 4 on the weekend,"Hey Jagriti, glad to hear you're enjoying Zumba classes. We'll take your feedback into account when defining the schedule."
831,4,2019-01-05T09:04:00.000Z,premvanniar,Good moving,Thank u for a good food.,You're welcome :)
832,5,2019-02-19T07:57:23.000Z,HARISH CHOCO,Meditation,An ultimate thing for relaxation,
833,5,2019-05-13T13:34:06.000Z,sid here,Awesome,Best of its class,Thank you!
834,5,2020-05-29T05:20:51.000Z,Mitesh21jan,Good app,Useful n awesome app..,
835,1,2020-09-22T03:46:35.000Z,sravab,Can’t Cast into Tv,I was able to cast live sessions into tv earlier. Now I am unable to?,"Hey, please write to us at hello@curefit.com with screenshots of the error and we will assist you."
836,2,2020-01-18T13:39:38.000Z,hhhhbhzzzzzzzx,Rush,Classes are fully booked always too crowded,
837,1,2019-06-10T14:52:16.000Z,iamraajsa,Worst app,So many promotional sms and email send i just hate this app please don’t singup here,"Hey, we didn't mean to trouble you. Please email your registered contact details to hello@cure.fit, we will unsubscribe you from all communication."
838,5,2020-03-23T11:24:08.000Z,hydyjbfd,Best For Diet,Amazing Food,
839,1,2019-11-30T07:52:22.000Z,airter user,Very worst App,After booking I can’t see the ordered meal in the app,
840,1,2017-11-09T05:31:31.000Z,ChintalpatoxPanda,App doesn't download only,"App does not download at all, not sure whose fault it is",
841,1,2018-04-11T16:24:37.000Z,Sexy sahil,Total waste,"These guys are so horrible. They are like just like my ex, They break every promise","Hey Sahil, We can understand your disappointment. At CULT, providing the best workout experience in a fun and safe environment has been our top priority. MMA in its current form without BJJ is not doing justice to the format. Hence, we have decided to bring the curtain down on this format. We assure you that our other formats will help you move towards your fitness goals"
842,1,2018-10-11T17:11:04.000Z,Jatin91,App not working,App stopped working on my phone. How should I do the bookings ?,"Hey, there was bug in app v7.14. We've taken care of it now. Please update the app to v7.15 for a glitch free experience :)"
843,1,2019-03-20T17:58:03.000Z,Akanksha.12,Would never recommend- rigid policies. Money making monsters .,"This was the third session that I was going to attend today. I fully paid the membership for the entire year . I was late for . 7 minutes to my third class due to last minute emergency. I marked the attendance, however was simply denied access to the class by the management. In my previous two sessions, nobody from cult side explicitly told me that you can’t be even 5 minutes late to any class otherwise entry won’t be allowed. I politely asked the manager to give me this one time exception as I was not aware of the rules . Also , anyone can have last minute emergency and if that has not been a pattern of that person. Nobody listened and was humiliated in front of the whole group and was simply advised to leave . I am a working professional in the service industry and understands the importance of rules and punctuality . I respect the culture of discipline . However one time exception to that person who wasn’t even told the proper rules should have been taken into consideration as a courtesy . Top of it , I am paying for the session. Also they have a no show policy , if you don’t turn up for any class pre-booked , they would reduce the same number of days from the membership duration. A person who is coming late has to come to the class to avoid being marked as a no- show even though entry to the class will be denied . Am I studying in some school ? I understand how a customer treatment and experience can be deal breaker. In this case , it has been for me . I would never ever recommend cult to any of my friends, family members or colleagues.","Dear Akanksha, While bringing in a culture of discipline might be one of the reasons for having such a a philosophy in place. The biggest reason for denying entry to a class after 5 mins is to ensure member safety. The first 5 mins are where the bulk of your warm up happens. A good warm up prevents common workout injuries. Since you've only begun your fitness journey with us, the last thing we want is an injury to disrupt both your personal as well as fitness routine. We truly hope that you understand that our philosophy is not one that's meant to go against you but one that ensures your safety. We hope to see you soon at Cult."
844,1,2019-06-06T08:09:37.000Z,RajSahuBangalore,Missing info,Can you guys mention how many rotis in the meal?,Our meals come with 3 rotis. You can also buy extra rotis.
845,5,2020-03-17T14:55:53.000Z,sanndeep,DF,It was great to be with top notch instructors,
846,1,2021-06-13T05:33:56.000Z,tejjpal,Its sad not having iPad version,Its sad not having iPad version,"Hey, we will look into making an app for iPad. For now, you can use the app made for iPhone on your device."
847,1,2020-05-21T04:31:37.000Z,Saket2502,Too many bugs on the iOS app.,Buggy app.,
848,1,2020-02-24T13:36:51.000Z,vihari123,GPS issues,App selecting incorrect location. So irritating...,"If this is still happening, please drop us an email with details to hello@cure.fit"
849,3,2020-05-19T03:40:23.000Z,dmdndidlelels,Not getting good trainer for s &c n boxing,Pl arrange call back at earliest.       Want Garima singh for s& c,
850,1,2018-12-14T05:18:18.000Z,Anon_q,Stop spamming,"Download to get ""No excuse sale ends in 4 hours!!"" promotion message everyday 🤣","Oops, didn't mean to spam you. Share your contact number on hello@cure.fit, so we can take care of this."
851,5,2019-05-04T12:52:30.000Z,4barima,Great food,Loved the taste,Hope to serve you again!
852,5,2019-11-22T17:21:37.000Z,rvyas1,Nice app,"Nice app with a proper guide, good job.",
853,1,2019-12-24T00:03:58.000Z,rajeev123ralhan,App issues,The app is not opening,Hope this is working fine now?
854,1,2020-04-15T05:52:58.000Z,hbarve1,update application for iPad,Please update application for iPad also,
855,5,2020-05-16T11:56:04.000Z,Abhignan7,Good app,This very good app,
856,5,2021-03-19T04:44:29.000Z,Anshul Manekar,The best fitness app,👍,"Thank you so much for your 5-star review, Anshul!"
857,2,2020-03-28T06:44:01.000Z,cuemathparent,Cannot multicast LIVE video on TV,Hello why cannot I multicast LIVE Cult video onto my TV???,
858,1,2020-01-17T04:58:40.000Z,TheArtistian,Kept getting error,I am receiving an error “Invalid Interval Error....”,This issue has been fixed. Please let us know if it still persists.
859,1,2020-05-25T11:06:16.000Z,Ankitasingh,Not compatible with iPad,It says it’s compatible but it’s not! Such bad UI,
860,4,2018-09-05T14:29:34.000Z,------))))))))),Great,Great experience,Feels great to read this review!
861,1,2018-10-11T06:10:57.000Z,Mansa.k,App doesn’t work on iPhone 6s,Not working,"Hey, there was bug in app v7.14. We've taken care of it now. Please update the app to v7.15 for a glitch free experience :)"
862,5,2019-07-05T05:40:43.000Z,yendeti,Siri,Trainer Leah’s motivation is awesome.,We're so happy to read this review :)
863,5,2020-09-02T03:04:38.000Z,Savi Tayal,Excellent app 🎉🎉👌👌,Thanks,"Thank you so much for your kind words, Savi! :)"
864,1,2019-12-03T03:40:59.000Z,abhi bhardwaj,Bad food provided app,Very bad food quality useing this app,We'd like to discuss this further. Can you please email us at hello@cure.fit?
865,1,2020-12-08T13:26:42.000Z,sravnii,App,Not able to update the app,"Hey, please try uninstalling the app and reinstalling it. If that doesn't work, please write to us at hello@curefit.com and we will look into it."
866,5,2020-05-09T13:53:53.000Z,Protim86,Awesome,The sessions are very precise,
867,2,2021-02-09T02:34:28.000Z,Gaurav Bhandia,Casting not working,Casting on TV is terrible. It doesn’t connect. WHY DONT U REALEASE A TV COMPATIBLE APP.,Hey! Live classes can be cast on TVs using an external Chromecast device connected to the TV or an Android TV. Casting is not available on Smart TV.
868,1,2020-05-04T10:39:38.000Z,taran89777,Worst app,"Worst fitness app ever,complete waste of time",
869,1,2019-07-22T13:40:20.000Z,gp0393,Manipulative pricing,Manipulative pricing especially for eat fit,
870,5,2018-03-10T15:15:40.000Z,Suryansh26,Good app.,Good for MMA and hrx workout.,
871,1,2018-05-11T03:00:47.000Z,akpsingh,Worst experience,I ordered lunch scheduled time was 1:30pm and delivered at 2:45pm,"Extremely sorry for this. Please do treat this as an aberration, our meals are normally delivered within the promised timelines. Please drop us an email to hello@cure.fit and we will have this looked into immediately. We will also reach out to you to discuss on the same."
872,5,2019-04-05T21:35:00.000Z,dg1mY1993,Loving it😍,Good one,
873,5,2019-05-14T16:08:21.000Z,waghhh,Amazing,Amazing amenities and Environment,Thank you!
874,5,2021-06-22T00:18:11.000Z,soyakyal,Good apps,Loved it 🙏🙏,Thank you so much for your lovely review! 💕
875,1,2019-12-09T19:48:19.000Z,wwerttooopppeht,Food,Why Food is not delivered on my area,"We're constantly growing! If we're present in your city but don't deliver to your locality, you can always place an order via zomato"
876,5,2020-07-23T13:47:21.000Z,Bhatt Ravi,Treat to health,Good app,
877,5,2020-04-13T14:03:23.000Z,Venkat dhanyamraju,Venkat Dhanyamraju,Awesome session.,
878,5,2019-11-10T09:57:45.000Z,Addy190,Food tastes good,Tastes yummy😍,
879,4,2019-09-26T01:14:11.000Z,Bujjammaaa,super,great experience,
880,1,2019-03-04T17:30:46.000Z,mithunchandrahowlader,can't login,i think it's only for indian people,Just for now :)
881,5,2020-06-08T03:31:30.000Z,red me note,Nice,Very,
882,2,2020-09-01T14:33:48.000Z,MusaHIndustani,NOT FOR IPAD,the app is not made for iPad....please develop one,"Hey, we will certainly look into this."
883,5,2020-03-17T15:43:54.000Z,Nehagaur8,In love with this app,Im,
884,4,2020-03-10T15:41:13.000Z,treedfgvvv,Food,Delicious !,
885,5,2020-05-06T15:04:16.000Z,ut6666,Awesome app,E,
886,3,2020-05-15T06:41:30.000Z,sunita borghate,Excellent,Thanks,
887,5,2020-05-08T13:35:45.000Z,Sonia Sahni,Awesome!,Super trainer!,
