,id,rating,date_time,user_name,title,body
0,0,5,2021-04-14T15:59:01.000Z,SMKelsey,The little things are big...,"After YouFood ended, I was lost. I loved taking pics of my food to keep a journal, but at some point, I realized that habitually taking the photo just became habit and I always wished for more.  So far, it seems that “Ate” has it.  First, as simple s concept as it is, I love, love, love the on and off path option. Actively saying that I am “on path” is an motivator😇 that I did not anticipate. Likewise, who wants to admit that they’re “off path” 🤷🏽‍♀️? I also love the integration of my water and exercise efforts as well. I’ve only been doing it for three days, so I haven’t really gotten into all of the other benefits but I also like the idea of tracking why I eat, whether I eat at home or out, how the meal was prepared, how I was feeling when I ate and a big one...who I ate with 😉!  I have a feeling that in time, I’m going to see some real trends that will expose for me why I eat the way I eat and more importantly how much I eat. Aside from always saying “I just love food”, that’s a question that I don’t think I’ve truly figured out just yet.  Now, I just need to find some friends for more accountability.  I’m trying the upgrade and had marked my calendar to cancel after 14 days, planning to be unfulfilled, but I know already that I’m in.  Yearly plan paid for.  Wish me luck!  P.S.  I swear I’m not a developer or a friend or family member of theirs and I can prove it.  Just try it and see for yourself!  😂😂"
1,1,5,2019-07-17T17:11:21.000Z,foxesnoxes,Most useful and efficient food tracking,"I’ve tried myfitnesspal calorie counting, daily photo journals, and also just writing out the food but the interface of this app is aesthetically pleasing and visually appealing as well as directed. The option to chose “off path” or “on path” with the reminder of what your current goal is at the top of the screen is brilliantly simple and helps me to minimize obsessive food thoughts like “I ate so bad I’m so fat” or “i ate an apple today so that makes up for the ice cream and chips and cookies I ate the rest of the day” etc etc. It even lets you make a collage of your food pictures at the end of the day, which is a perfect way to visualize what you’re putting into your body. Oh, and you can track calories in the comments under your picture but you can also track where you ate, if you ate alone or with people, why you ate, and how it made you feel which is a genius way to help people make the lifestyle change into eating healthier (instead of forcing yourself to eat ‘healthy’ foods you despise you can focus on the healthy foods you adore). I’ve been searching for an app like this for years and I’m very happy I’ve finally come across it. I hope to use it for a while, and I really appreciate that it’s a free app with no ads. Hands down my favorite health app."
2,2,5,2020-01-12T19:37:43.000Z,Amber Waves Hello,"So far, so good!","I’ve been using ate for about a week, and there are several things I love about it:"
3,3,5,2020-10-16T00:23:49.000Z,zgrooms,Great app and great management!,"I have never reviewed an app before, so that tells you something right off the bat. I have loved the ease in this app. Meal tracking has always stressed me out. I hate measuring things. My meals are too elaborate to traditionally track. Being able to snap a picture (which I usually already do anyways😂 #foodblog) and add a description makes “tracking” so much easier! I’m able to share this app with my nutritionist and she can have an idea of what I am eating in a day without me having to track. The summary questions have allowed me to have a much better relationship with my meals, realizing trends and habits that I may not have realized before. It forces me to slow down and ask myself these important questions. I love it."
4,4,5,2020-06-09T10:07:44.000Z,❤️💛💚💙💜💎|-/ Alyssa,Great app,"I have been using this app for maybe a week or so. Before finding Ate, I tested multiple fasting apps and nothing worked well or was set up good. I don’t even think I want to fast for the reasons on other apps. This app is GREAT. I’ve always taken pictures of my food and saved them, especially when I cook a meal or fix a healthy breakfast for example. Ate allows me to see what I eat in a day and it lets me record how it made me feel (I LOVE this part of the app because I struggle with how food makes me feel). I also love that it adds options such as “who did you eat with?” and “where did you eat?” Overall this app seems perfect for me and I hope I continue to use this to track my food habits."
5,5,5,2021-06-15T02:06:44.000Z,FrauFleur,Only been using for a week and it has done wonders,I was looking for an alternative to calorie and macro counting. After listening to a podcast that focuses heavily on mental aspects of weight loss I thought to myself it would be awesome if I could just snap photos of my food for myself to stay accountable. I began searching the app store for such a thing as a “visual diary” and ran into Ate.
6,6,5,2018-05-03T16:56:47.000Z,Bet @ Bet On Dinner,Exactly what I was looking for!,"I love this app! I wanted a food diary thing, but don’t want to track calories or even type in every teaspoon of oil I use to cook my dinner. I love that I can quickly type something in, and the photo aspect is unexpectedly great! It’s quick to snap a picture and it motivates me to add things like fruit and vegetables to my plate since I’m visually more apt to notice that I’m skipping them and just eating a sandwich or a piece of toast. I also like the freedom to change what is “on path” for me - since it’s not specific to one type of eating. I really love the little arrow that encourages me to make a healthier choice for my next meal if I do go off path - it’s not judgy and unlike other things I’ve tried, I don’t tend to feel like I’ve “ruined” a day with one meal or food, so I’m more likely to just move on and eat something that is better for me at the next meal rather than derail and start again the next day (or week or whatever!). Thanks for such a helpful tool!"
7,7,5,2021-01-12T06:07:45.000Z,ILJ627,Super helpful and easy to use!,"I’ve been using ate for the past week with a group of friends in an effort to take better care of our bodies this year and practice more mindfulness with our eating.  The benefits are already so evident.  Having to actually document what, when, and how much you are eating really makes me think twice before eating too much or eating things that aren’t as good for me, which are 2 big goals for me.  Also, because my friends and I follow each other on the app, it’s actually EXCITING to take a picture of my home-cooked, healthy meals or any other instances where I’m making good food choices!  I have also loved tracking how eating made me feel, which is one of the questions the app asks you after your meal.  Tracking my meals is quick and easy, which is important to me, and I’m going to keep using ate!  Highly recommend if you’re like me and struggle sometimes with being mindful with your eating!"
8,8,5,2021-03-05T17:41:19.000Z,Little5er00,Best app I’ve ever used,"After decades of trying to understand and heal my GI issues, I finally decided I needed to get better at keeping a food journal and tracking how different foods make me feel. A Google search brought up Ate— since it was free and so well reviewed, I downloaded it immediately. I’ve been hooked ever since."
9,9,5,2020-04-03T15:43:17.000Z,Crb1717,Fantastic and amazing!!!,"This is only my second day using the app but it has brought me such peace and joy.  Taking photos of my meals felt strange to me at first but what I realized is that it really promotes mindfulness and reflection.  You can make notes that go along with the picture, creating a new kind of ritual practice that slows down your meal nicely and easily.  I like all the tracking in terms of hunger level, satisfaction, etc.  But perhaps my favorite thing of all are the “experiments” you get to try.  The one I chose to start with is to take 2 deep breaths before eating.  Even that simple act allows me to connect to my body and spirit so that I can listen to my physical and emotional needs.  My lifelong struggle with stress eating has been exasperated due to the COVID-19 situation.  I didn’t want to spiral back down into the overeating so I found this app. I couldn’t be happier, calmer, or feeling more grounded around food.  Thank you to the creators and developers!!!"
10,10,5,2019-05-04T10:22:30.000Z,foofaroo,Perfect for my needs,"I have downloaded every meal tracker app available on the App Store it seems, but nothing was exactly what I was looking for in till I found ate. I just need a simple place where I can write down or take a picture of what I’m eating, which is enough to keep me “on path” without the stress of calorie counting, trying to search a weird database for what I ate, entering the exact quantities of what I ate, or having to report to a health coach. The design of this app is pleasing, it’s easy to use, I like the questions they ask you after your meal so you can reflect on whether you made a good choice or not and why. I’m grateful to the makers of this app for understanding that not everybody wants to spend their entire life counting calories, even if we still want to be healthy. Thank you! I am strongly considering a subscription, but the free version has everything that I really need, so don’t let that scare you off from downloading it :)"
11,11,5,2019-05-25T04:46:53.000Z,this is marshall,The only food tracking app I have consistently used with success,This app is a game changer and I’m so happy I found it. I have struggled with binge eating and an unhealthy relationship with food for the better part of my life. The app is like a picture food journal that lets me track what I eat and the emotions that go along with it. In turn my entire perspective on eating has changed and I have developed a healthy and mindful eating pattern. If you are struggling with disordered eating this is the app you’re looking for. Even if you’re just trying to loose weight and be mindful of what you eat THIS IS THE APP YOU'RE LOOKING FOR. I have tried other food tracking apps and they don’t compare to this one. It’s super helpful too that they give you a day “recap” where you can see what you ate and what you were feeling/why you ate at the time. This will help anyone’s fitness journey. 😊
12,12,5,2019-06-02T14:12:02.000Z,jennah rae,Total Game Changer! 👍🏽👍🏽,"This app has become a cherished part of my every meal. It helps me to be mindful of the food choices I make by gently reminding to put as much thought in my choice of food as I would my choice of clothing for the day. I am so proud of myself when I hit that “On Path” button, it’s motivation in itself to make healthier choices. But even when I do go “Off Path”, this app obliterates the usual shame and guilt I would normally feel and helps me treat myself better."
13,13,5,2020-08-25T18:02:27.000Z,MarcelainC,Best app I’ve used,I have used numerous apps of this kind and I’ve determined that I cannot stand counting calories. It’s draining and it gives me bad anxiety. I honestly believe that counting calories can trigger eating disorders for some.
14,14,5,2020-10-25T13:40:14.000Z,Mountain Life Mom,Simple in all the right ways,"I heard about this app from a nutrition coach who uses it with some of her clients. I struggle to use food diaries because I am on the go constantly at work, frequently eating two meals at the office, often with colleagues around, and often I can’t prepare them. So the idea that I can stop, write down a bunch of stuff, look up its nutritional values, etc, has never worked. Enter Ate. You can snap a picture of your food with two clicks (one to open the app, one to shoot), and it’s already at an appropriate angle to capture your plate so it’s very discreet too. Then click once more for whether it’s on or off your “path” and you’re done. You can write in things you forgot and I really like the simple questions you can answer to add detail. I haven’t used all the features yet but I am starting with being able to capture 100% of my food each day, which is a great success."
15,15,5,2020-08-30T11:20:33.000Z,DogsRfun45678,It’s ALL about mindful eating.,"I’ve been using the app for about a week now.  Formerly I was using My Fitness Pal and sometimes WW.  The thing I like about the Ate app is that it totally makes you think about what you’re putting into your mouth.  You’re mindful in a way I never was with those other apps.  It also makes me feel totally in control of what I’m eating and makes me feel powerful.  I like that I’m not tied to a calorie number.  When I was tied to a number, I’d find myself eating things just because I had calories “left” in the day.  Now, I’m more likely to focus on whether I’m actually hungry or not.   That’s sort of the key and the hardest thing for most of us that struggle with weight.  If we could just stop eating as soon as we aren’t hungry anymore, then no one would be overweight.   That thought is life changing but very difficult to actually do when a donut is staring you in the face!"
16,16,5,2020-07-01T16:54:53.000Z,Happy Plate,Motivating!,"I have only been using this app for one week, but I love it so far!This app is so motivational! I have set a path to focus on eating small healthy meals throughout the day- choosing a variety of veggies,fruits and healthy protein! I love how easy it is to snap a picture to log my eating. I can easily see what and how often I ate throughout the day. Stopping to take a photo before I eat something really makes me more thoughtful about what I put in my body. I have also loved plating  my food to make a “pretty” picture - instead of snacking out of a bag, I take the time to plate my snacks now! It’s actually fun! I love the questions that are asked after eating- I have really focused now on eating at a table not on the couch or in the car.  I rarely eat with my phone or while watching TV, I enjoy my food and listen to my body more when I feel satisfied- rather than stuffed or the bowl is empty!"
17,17,5,2019-09-26T15:56:06.000Z,Ihatethisgame;(,THANK YOU 🙌,I used to use myfitness pal like it was my job. I developed a horrible eating disorder as I constantly was concerned about exactly how many calories I put in my body and terrified if I couldn’t track it. This app is a lifesaver.
18,18,4,2020-01-22T18:02:33.000Z,Ornery-Rutabaga,Love the simplicity!,"I have wished for a long time for an app that would give me a way to track my food without listing individual ingredients or requiring calorie counts before meals could be logged. I am so glad to have found the Ate app! The design is brilliant and as easy as it gets. I appreciate the questions to answer after each meal, especially the two, “Why did you eat?” and “How did it make you feel?” That has been an interesting exercise for me to think about after eating, and helpful for changing some of my habits. I also appreciate how easy it is to scroll back through the past days/weeks to look over what I was eating and be able to see how my meals are changing over time. I find it incredibly motivating. I have tried multiple apps for food tracking, and always gradually dropped off from using them. But, with the simplicity of this one, I expect to be using it years from now."
19,19,4,2020-07-16T17:37:37.000Z,brinnydrew,Almost Perfect Food Journal!,"It’s a really fantastic app, there’s a lot I like about it - for example it uses data from your camera roll to date your food inputs if you upload photos that way, but you can still easily change the date and time of meal inputs manually if need be. I also like the “recap” function for seeing my daily progress all in one place. LOVE that it tracks my fasts between days too."
20,20,5,2018-01-05T15:00:50.000Z,MdlnJam,Down 17lbs and counting,"This app is amazing. I’m someone who has tried EVERY diet and fitness app out there and nothing has been as effective as this app. I’ve lost 17lbs since I started using the app a little over a month ago and I’m still losing. The best part is you can customize your goals for you, you aren’t forced to eat or not eat any foods. I’m still eating whatever I want, but the mindfulness questions for every meal are helping me realize what foods make me feel good. If I get off track of the path I created for myself, it isn’t the end of the world and I don’t binge on ice cream like I would with other diets. I just try to be more mindful during the next meal. Mindfulness really is key to being able to make smart choices in any situation, and I’m so grateful for this app! THANK YOU FOR YOUATE, DEVELOPERS! It really works!"
21,21,5,2018-09-13T18:10:16.000Z,NMessina,Love this visual food diary app!,"This app is a fantastic way for you to keep track of what you’re eating in the most non-judgmental way possible. No calorie counting, no need to give excessive amount of information concerning the ingredients of what you’re eating, just a simple picture and you’re done. The on/off path feature is a great way to hold yourself accountable without shame. Once you take a picture you can click on it and fill out information of where you’re eating and how you’re feeling, among other questions. Only thing I would ask for is that you can add more words in this section. Sometimes I eat when I’m anxious but it doesn’t mean I’m stressed. But it’s a minor thing. I truly love this app and I really appreciate how mindful it’s made me when it comes to my meals."
22,22,5,2019-03-15T18:55:21.000Z,Giselle J.O.Y.,Awesome! LOVE this app!,"I’ve always hated logging what I eat because it’s too tedious, time consuming & detailed. But YouAte makes it so quick & easy. All you have to do is snap a quick pic. Even if you don’t enter it that moment you can go back whenever, import the pic & it will automatically enter the time you took the pic. I love the reflection questions as well that help you think more about why and how you’re eating. It also has a pie graph to show you how much of your eating is for what reasons & it keeps great stats on how much time you go between meals. The layout is simple and attractive. This app makes food journaling/logging/tracking so much fun! You can even share it with friends to keep each other accountable & encourage friends in eating better! LOVE that! Everyone should be using this app!"
23,23,5,2019-04-30T20:29:26.000Z,Bill Merchant,Aid to mindful eating,"I’ve tried zillions of diets and apps over the years, losing weight fast or slow, but usually gaining it back. I’m convinced that the only way to achieve and maintain a healthy weight is by being mindful of what you’re eating, how much you’re eating, and when you’re eating."
24,24,5,2019-05-02T18:07:55.000Z,Sawyer008,Easy App,"This app is working for me. I really needed a break from the journaling world, but didn’t want to just stop paying attention to what I was eating. This app is the perfect answer. If you know how to snap a pic, then you can use this app. I love the freedom I feel when I prepare my meal and don’t have to break down every. Single. Ingredient."
25,25,5,2020-05-13T12:27:11.000Z,kelynpeanut,Perfect Balance,"I’ve tried every diet on the planet. I used to think it was fun tracking my macros. In the end it’s nothing but a obsession & for  WHAT? Possibly losing a couple pounds, weighing & measuring everything only to eat dinner at a friends house & blow the whole thing. Let’s face it that’s no fun. So I tried keto no thanks, next OMAD with no restrictions that was the best so far however I found myself overeating & hungry by mid afternoon & obsessing over dinner. I’m one of those people who like to try different ways to eat and I have a love- hate relationship with tracking it. I found this app & I'm still intermittent fasting using a more intuitive approach & making my first afternoon meal smaller then I can have a normal size dinner & I’m not starving. Taking pictures is perfect because I can get a visual which honestly is more than sufficient to see how I’m doing. This app is Awesome!!"
26,26,5,2019-09-30T23:27:45.000Z,LotusGirl59,Finally!,"I really love this app. I needed a way to watch and be aware of my eating that didn’t make me feel restricted, guilty, controlled or so seriously eating disordered that I became paralyzed and consumed by fear. I know what to do, but totally resist being “ told” or managed by someone else. This app lets me choose MY path and focus on what I know I want to work on. There is no frowny face or judgement when I wobble... just a little jog in my path. Photographing my meals instead of entering what I ate one by one on a list totally works for me and gives me a visual way to see if I ate enough color during the day. There is no target other than on path or off,  and a percentage that I can improve on tomorrow. When I’m at a loss for what to eat, I’ve got a whole gallery of previous meals I can refer to. Thanks for making my food life easier!"
27,27,5,2019-07-19T01:12:22.000Z,snailmaill,ate (8) out of five stars 😉,"This is one of my all-time favorite apps. Instead of tracking calories, taking pictures has made it so much easier to think about why and how I am eating. It makes me more likely to eat because I’m hungry, than eat because I have calories left for the day. The creators of ate have obviously put so much thought into designing this app, and it shows! I love looking back at pictures of what I ate in previous days (and I like making my plates look pretty too!). The graphs of how you have been eating are so helpful, and they have every kind of graph that I could want to see. I talked my mother into doing it with me, and it’s been a blast to see what she’s eating from her point of view. Thank you so much for this app, developers! I would highly recommend it. 🍏"
28,28,5,2021-04-21T17:46:33.000Z,C.Nordic,Great app!,"I am enjoying being able to see the daily recap, *in living color* photos of what all I eat in a day, and how it fits into my goal of eating more veggies, and thus just more healthy eating. The mindful eating concept is especially so important for those of us still working remotely, and who have a well stocked kitchen just a few steps away :) Making wiser choices, and being aware of timing as well, are so important!"
29,29,5,2020-07-14T04:13:58.000Z,brightaide,Great for binge eaters,I love this app! I had fitness pal and other calorie counting apps but I will always forget to record what I ate. Taking the pic before each meal it’s so much easier to remember. Not only that it helps me to see how much I’ve been eating I love that I can scroll and see if I had sugar that week and it gets you to the root of your problem. So every time you snap a pic you can add tags of how that meal made you feel and the app creates pie graph of why you eat. I also like that it gives you the time in between each meal perfect if this is important for your type of diet like a fasting diet. So there is no way to track calories and I don’t mind bucease for me now portion control is what i need so this works great I want to upgrade but i don’t know if is it worth it. But i love it so far
30,30,5,2017-11-25T14:50:26.000Z,Frenchfrai,Painless (and fun!) awareness,"I downloaded this app instead of going to calorie counting or a fad diet (both of which I was considering). It’s been wonderful! I can easily snap a photo of my meals and there’s a fun and encouraging component to getting to capture my choices. It makes me want to make BETTER choices. You get to retroactively log why you ate, where you ate and how you felt which has given me an overall better awareness of my eating habits and I’ve since been able to cut back eating when I’m bored and not hungry. It’s helps promote self compassion because you can always get back on path if you choose an off path meal or snack. Lastly, I get to see my stats week to week, like how “on path” I’ve been towards the goals I got to set and how much time I usually go between meals."
31,31,5,2018-04-28T07:07:25.000Z,Hurrah!,So lovely and effortless.,"First off, no calorie counting! That’s the main reason I appreciate this app. In my experience, counting calories doesn’t work. I forget all about what a “meal” is and don’t think about what I want. But with this app, I get to be simple, crate meals I will enjoy and even make them presentable since I know I’m going to take a photo for my journal. Also, it really has a beautiful interface! I love the color scheme. What’s nice is the app encourages you to decide for yourself whether your “on path” or “off path” and to evaluate you reasons for eating each meal, how you feel, and how the food was. Just a simple and helpful way to watch what you eat without obsessing over calories. I am glad they made YouAte! Thanks you guys!"
32,32,5,2018-07-22T16:58:00.000Z,rose m w,Healing my relationship with foid,This app is a fantastic way to set healthy food goals and have accountability without counting calories or becoming obsessive with weight. Ive had some emotional and mental issues surrounding weight and eating and this app is allowing me to track my food for my nutritionist without negatively impacting my sense of self worth. It also really has helped me stop judging when I go “off path”. It takes away a lot if the shame about eating unhealthy food bc I can see it as being “off path” instead of “I am bad for eating this”.
