,id,rating,date_time,user_name,title,body
236,236,5,2019-09-22T20:35:24.000Z,TS9876543210,Wonderful App!,"I’m a working mom, real life and managing everything plus trying to eat right is challenging. The Ate app makes mindful eating fun and as stress free as you can be. I love it! Just by taking photos and making a short reflection, it is such a refreshing way to feel like I’m moving in the right direction. In fact, based on my scale, I am doing just that! Thanks Ate!!"
237,237,5,2021-02-01T00:58:17.000Z,thomastomczak,Great app!,"Very easy to use and a great way to see and analyze what you consume during the day. I became more aware of what and when I eat. I was not trying to lose any weight, but I feel much lighter now. Also love the ability to add people to your group and see what others eat ( picked up a few really awesome snack ideas). Strongly recommend!"
238,238,5,2020-04-01T09:11:07.000Z,amymar13,No stress-beautiful-learning about myself.,"I have used many other apps to track my food none have taught me as much as this one.  Having to take a picture tracks my time, my feelings, where I am, who I’m with etc.  a few days in and super, super helpful.  I’m on the free version. I’m hoping a paid version will graph it for me.  💕"
239,239,4,2020-02-12T03:50:56.000Z,Tessa Monét,Love this app,"The Ate app is extremely practical and useful for users like me who are trying to keep track of their eating habits. I like the lil reminders it gives me and I feel better using it daily. I only wish I could use some of the other privileges without having to pay, that’s my only complaint. It would be nicer if I could have access to some of the options..."
240,240,5,2017-07-03T21:23:18.000Z,Bizeller97,"LOVE, Perfect & Simple APP!",This is perfect for food journaling... I love that you can add notes to each meal too. I have been working on trying to become healthier a bit at a time and this is really really helping me so far. I was writing everything down but it is so much quicker and convenient to use phone and helps to see pictures of my meals.
241,241,4,2017-07-08T03:25:57.000Z,Mimisweb,Simple and helpful,"I had heard for some time that taking a photo of every meal helps you stay on track.  So far, I have found this to be true. There's something about having to stop and look at what you are about to eat that makes it impossible to eat mindlessly. This app meets my needs. If you are looking for a food photo diary app without a lot of unnecessary bells and whistles, this is it."
242,242,5,2017-08-31T15:00:52.000Z,Lalafoilalal,Game changer for gestational diabetes,"I have gestational diabetes and I use this app to make notes on what I've eaten and what my blood sugars were. I love that I can see exactly when my last meal was, how long I've gone in in between meals, overnight fasting, and what I ate all without the hassle of logging calories. I can make notes on exactly what I want to remember about a meal. This app is amazing!"
243,243,5,2018-09-15T23:03:31.000Z,Peg in CO,I was so tired of writing everything out!,"With YouAte, I’ve switched my method from listing every food to photographing every meal and snack. It has been very freeing! I am now more concerned with how and why I’m eating. And when I do get “off track,” YouAte shows me that I can get right back ON track and not ruin my whole day. Simple, meaningful way to begin mindful eating."
244,244,5,2021-06-22T01:20:53.000Z,Julestm,The most amazing app if you struggle with emotional eating,I can’t say how much I love this app. It keeps me encouraged to stay on my healthy eating journey and to keep going when I’m not perfect. I love that I can track social and emotional eating over time and have better self awareness without guilt. Pair this with Food Freedom Forever and it’s the perfect food addict’s recovery course.
245,245,5,2020-10-27T20:13:31.000Z,Angel~Raven,so far so good! just one suggestion,this app has really been helping be accountable and there's none of that toxic calorie counting I've experienced before.
246,246,5,2020-01-03T07:39:47.000Z,Lia Rolin,Must get,"I have tried many other apps like this but all of them shove expensive premium memberships in you face from the beginning, personally I don’t want to spend a lot of money to stay fit so I find it so convenient. On top of that even without premium it still works a charm. Would recommend! ❤️"
247,247,5,2020-07-13T22:21:35.000Z,Dr. Llama,Encourages useful reflection,Sometimes I just want to keep track of what I eat without committing to calorie counting. This app lets me keep track so simply and it helps me to see trends based on my own reflections on what I eat. It’s been surprisingly useful. (I downloaded and deleted the app about a year ago. I’m glad I gave it another try.)
248,248,5,2021-04-14T23:14:15.000Z,Love-Ariel,Tracking without judgment,"I have been waiting for this app for years. Traditional food tracking apps have always triggered really restrictive and disordered eating for me. This app asks only that you log the meal itself, how it made you feel, and whether what you ate is in alignment with your goals. No calorie counting or guilt trips."
249,249,5,2021-04-09T05:01:50.000Z,Terraeileen1993,Gives me mindful eatting without all the fuss of tracking,"I tracked for years and my goals have shifted to make life less complicated. I still have the accountability of writing down everything I eat without so much effort being out into the details, which at this point I just don’t need!"
250,250,5,2017-09-04T01:20:29.000Z,Kaymariecollegestudent,Very easy to use!,"I love this app and how easy it is to use! I don't feel like I waste any time in my day logging my meals like I would if I were tracking calories or macros. This is an excellent way to stay on track with healthy eating! It's helpful that it shows the hours between meals and overnight fasts too. Overall a great app, and free too!"
251,251,5,2018-12-31T01:07:56.000Z,Rexton49783,Loving this,"I can say that in the few days I’ve used the app, I’ve been choosing to make better food choices.  It’s truly made me stop and think about how I’m feeling when I’m eating off path. Or wanting to eat off path.  I’ve come to see how tied my emotions are to my food choices. I would highly recommend this app 🤗❤️"
252,252,5,2019-02-24T04:08:59.000Z,allyyyycatttt,Awesome!,"So far I am truly loving this app! I just got it today but I love the set up! Easy to navigate and esthetically pleasing. It’s so different from the (many) other apps I’ve used! I especially like that it helps the user to be very intentional about the food choices being made and the reasoning to those choices. So far, I’m a fan!"
253,253,5,2020-11-07T02:16:16.000Z,mhxkyxkb,Ate App,"I absolutely love the app. It is simple, quick and easy to navigate through. The ability to see the pictures of the food I eat and see the time line next to it has opened my eyes. As well as answering the questions- they never get old, they only get more real which helps in changing!"
254,254,5,2019-08-31T19:44:46.000Z,catexgirl,"Simple, beautiful and effective.",I love the simplicity of this app. I mainly use it to track that I am eating only when I’m hungry and for this it’s been perfect. There’s so many other cool things about it I love that it asks how my meal was and I can kind of journal I ate too much for it was just right. Builds a great sense of continuity and in achieving your goals. Great job!
255,255,5,2020-11-26T05:06:09.000Z,Txcowgirljp,Just what I needed to create healthy habits,I have been wanting to hold myself more accountable and Ate helps me so much! I love that it is just a photo or text log with no nutritional info.  I also love the questions you can answer. It has helped raise my awareness about my eating habits. I am even thinking of going premium! Thanks for a great app!
256,256,5,2020-07-06T18:58:00.000Z,Little miss repo,"Easy, flexible, and data driven",Better than other apps for recording food because:
257,257,5,2020-05-20T19:44:11.000Z,Madwoman4Christ,Great App!,"I am very pleased with this app. I used to keep a food diary and it is great, however I prefer the visual food journal better. I have a better visualization of my food intake and the app makes me make better choices. I wish that it came with a weight tracking graph as well, it would add more incentive. All in all, it is a wonderful app❤️"
258,258,5,2020-01-21T18:06:51.000Z,pdrmom,EASIEST APP OUT THERE,"I got to a place where I wanted to keep track of what I was eating, but no longer needed to know every single detail about the breakdown. I was so frustrated that every other app seemed to take so long to enter info. I am eating 6 small meals a day, so that just wasn’t going to work long term. I love this app! I think you will too!"
259,259,5,2019-11-26T22:27:39.000Z,Juneau12,Easy and private,"The Ate app is very user-friendly and makes it convenient to track meals.  I like the “how it made you feel” buttons, which allow me to practice mindful eating and be more self aware.  I also appreciate the commitment to privacy, with the option to share info with chosen friends."
260,260,5,2017-07-19T17:31:40.000Z,jtousley,Exactly what I was searching for!,"I love how easy this was to set up. Already logged my first meal in minutes after finding App.  I want to remember meals visually and keep short, concise notes on what I like and don't, and if it matches my plan for a whole food diet lifestyle.  I will repost my review after spending some time using the App!"
261,261,5,2018-01-21T17:44:34.000Z,Dgrucci,Really helps!,I tried similar apps but this one gets it right. I was originally sent on a quest for a visual food journal by the 4 hour body diet.  I end up looking forward to my little self-accountability check-ins. And I get a kick out out of quickly staging shots of what I’m about to eat. It’s making my weight loss efforts more fun and successful.
262,262,5,2018-03-01T12:54:25.000Z,JPBehavior,Love it,"Enjoying using this as a visual food journal. I haven’t found another food journal that doesn’t seem cumbersome. I don’t have time to enter in a million ingredients but by just snapping a pic of my meal I can easy see, portion size, if it was a healthy choice etc. I am definitely more aware of the things I am putting into my body."
263,263,5,2019-01-04T13:24:09.000Z,MKatherineE,Great!,"I wanted to keep a food journal without all the calorie counting and weight management, but let me record how I was feeling when I ate something; this app is just that! If you’re looking for something to help with mindful eating, or to keep track of your emotional eating, or just a general food diary, I highly recommend this one!"
264,264,5,2019-02-28T15:08:54.000Z,Amy Whipps,Mental Health meets Food Tracking,I have been looking for app that will help me be mindful about food while keeping a healthy relationship with food. This app is what I’ve been looking for. You can totally tell the intentionality that went into creating it and how it promotes a healthy mindfulness with food. Thank you creators!!! Brilliant! Absolutely brilliantly!
265,265,5,2019-05-06T17:10:28.000Z,melmargo,The Best,I have been searching for a truly kind and nonjudgmental app for food tracking for years. So far I haven’t gotten any pop up messages urging me to be successful by purchasing products within the app. That was the worst for me in other apps. I look forward to using this moving forward.
266,266,5,2019-06-07T23:11:42.000Z,unknown:):),Great helpful app!!,"This app honestly helped me so much in the way I felt about food and my eating disorder. I was able to see what I was eating and write how I felt about eating it. I’ve realized that while I continued to use the app the less I really needed it, however I do still use it just to keep my attitude up about the foods I am eating :):)"
267,267,5,2020-09-13T18:49:09.000Z,my best life!,Love this app!,I’ve been counting calories on different apps for years and I hate it! This is much easier to track what I eat every day without counting. I also had some family members join and we’re having fun cheering each other on & keeping each other accountable!
268,268,5,2019-06-14T12:57:35.000Z,jpete07,Genius!,"I’ve been looking for an app like this for years! It makes food journaling so easy, but more importantly helps you track why you eat. If you are someone who has been trying to regain a healthy relationship with food, then this app is for you. Thank you for developing the app I always wanted!"
269,269,4,2019-12-10T03:17:04.000Z,waterlove101,Great and easy to use,It’s so easy to use and helps keep you on track to be healthy in a non obsessive way and natural way. I wish that if you ate something off track that it would look scarier lol like with red or something. I love that it calculates fasting time!
270,270,5,2018-07-20T19:44:11.000Z,ShaneGrace,Amazing and perfect for me,"Love the quickness of entry, the notion of simply being on path or off path as a great accountability factor to do better or make better choices before hand since you know you’re going to have to log it."
271,271,5,2018-08-27T17:24:00.000Z,krzygrl06,Perfect Match for Me,I knew that I wanted something to hold me accountable and encourage me to stick to my diet without having to track calories since that wasn't the point. This app has been perfect!! I have caught myself thinking twice in some cases about what I'm about to eat because I know I have to take a picture of it.
272,272,5,2018-10-07T21:46:09.000Z,heatherhauck,Easy to use,This app is so easy to use latterly takes seconds to record your food. Just snap a picture and your done. It also is free we all love free and if you want a little extra use out of it there yearly fee is so reasonable. definitely recommend this app and it lets you share your meals if you need
273,273,4,2019-01-21T03:11:38.000Z,Princegirl19,Loved it until...,Great app for food journaling!  Very helpful for me.  It was working great for 3 weeks and then the data percentages stopped showing up on my profile. I have done everything I can think of and also contacted the developer.  The developer responded quickly and honestly tried to help.  No resolution yet.  It’s a bummer to start over but I will. 🙃 Happy Journaling 😎
274,274,5,2021-01-26T00:37:41.000Z,Tcaporale7,A great way to stay on track...,I have been using the Ate app for a few weeks now. I am enrolled in a Trim Healthy Mama coaching class and this has made my life so much easier! I am able to stay on track with the timing of all my meals.  It’s super easy to use and has truly helped me to successfully stay on plan. Love it!
275,275,5,2021-01-22T03:48:10.000Z,bebekathleen,Super sincere team behind this app,I LOVE Ate! It makes me feel happy and gives me clarity with my eating. The overall design of Ate is organized and fresh. This system will without out a doubt allow you to enjoy eating all while you discover your relationship with eating. I highly recommend.
276,276,5,2021-04-09T22:18:14.000Z,MichelleKudva,Very useful app,"This is so easy to use, it’s fun and so effective. I recently had to change my diet for health reasons to several small meals per day. I am actually enjoying the journey and all the dietary changes I have to make with this app!  It’s completely worth the money, don’t hesitate to get this one."
277,277,5,2019-11-15T20:41:56.000Z,Awesomez!,Food journalizing at its finest!,This is a wonderful app! It allows you to keep track of what you are eating and you can even invite friends and see what they are eating as well. It is very simple to use and an amazing tool to have if you are trying to keep track of your goals!
278,278,5,2019-07-20T02:05:38.000Z,Eat paste,Easy to use,I like being able to just take a picture instead of add every different food in a list which can be tedious sometimes and take up a lot of time as well.  Water tracking is helpful too!  I like the weekly snap shots.   Helps keep me honest with myself.
279,279,5,2019-07-11T11:06:33.000Z,aandreolla,Ridiculously helpful,"It was always so easy for me to plug in numbers on an app and pretend it “fit my diet” or was healthy. But taking a picture of my meals forced me to realize what I was actually putting into my body, and the app makes me truly recognize if it is healthy or not. Definitely eye-opening and very helpful."
280,280,5,2017-07-03T02:29:53.000Z,Keis,Simple & quick,"Easy to use app if you are a visual person, this app will work for you"
281,281,5,2018-08-11T00:21:45.000Z,gabbicatherine,Love!,"I haven’t been using this app for too long, but I can say that it does exactly what I need. My biggest problem is boredom eating, and just making the commitment to record all my meals with this app has held me more accountable and made me more aware. This is a great way for people to track their habits without counting calories."
282,282,5,2018-11-09T12:46:43.000Z,MLSchweit,Just What I Needed,"I wasn’t sure what I was looking for when I went looking for a new food journal.  I’m so happy I stumbled onto this one. YouAte is just what I needed. An easy to use (and share) app for logging what I’m eating for the nutritionist that I’m working with. No weighing, measuring or obsessing about calories and nutrients. No wasting my time converting complex reports into a simplified form for her. This app works very well for both of us."
283,283,5,2019-01-07T18:41:11.000Z,momchap,Exactly what I needed!,What a positive app!!! It is so user friendly and so easy to Personalize. The pictures give me a visual and if I forget a picture or meal - its easy to add it in. I can easily see how my day goes and  why/when I eat. I love that this helps with a lifestyle change and not a diet - and its based on encouragement. 😊 THANK YOU!
284,284,5,2021-04-30T02:08:00.000Z,cake4breakfast,I love this app!!,I love this app!!! Makes it so easy to see if you're on track with your diet! Feature request: would be great to have a monthly calendar where you get a dot if you're on track for 100% of the day!!! That would make this app the perfect accountability companion!!!! 🤩🤩🤩
285,285,5,2021-03-27T00:28:47.000Z,Frydae,Love it,I only wish it would pull out my phone and take the picture since I forget until well into the meal.  After several days I still love this app. The photos help me to remember just what I ate for figuring Macro later. They are also time-stamped which is great for my glucose monitoring.
286,286,5,2021-02-05T04:06:29.000Z,noreeal,Simple & Effective,"I love it! This is an effective, easy-to-use app for anyone who wants to keep track of food without calorie counting."
287,287,4,2021-03-02T12:42:38.000Z,ghamara,Best out there,This is the best app out there for picture logging. I do think there is room for improvement. I wish the camera box was a separate option to bring up. That way you might be able to see more of your day immediately when you open and not have to scroll up.
288,288,5,2020-10-26T12:46:20.000Z,Martamohan,Easy to use,"Easy to use, after a few days easier to remember to take pictures. Love that I can also enter text should I forget a meal. Love the questions, quick, easy and to the point. Would love to track caps. But can always write on notes if wanted"
289,289,5,2019-11-20T18:35:53.000Z,Riley Fuzzle,Easy,"This app is super easy to use.  Plus it is all about where and why I eat; do I cook,eat prepackaged; and what I eat.  No stressful calculating calories.  Plus I can link my journal directly to my Ayurveda counselor.  And...I can take a photo or type in the menu so no taking pictures of my food when I am in public!"
290,290,5,2017-11-13T03:04:15.000Z,Family man99,Great app!,"I wanted to track what I’m eating, but I cook it all from scratch. That means that counting calories takes a really long time - calculating all that is not worth the effort. I wanted a simple log that would still help keep me on track. YouAte is exactly that! Intuitive to use, and the reminders are a nice feature. Thanks!"
291,291,4,2017-12-09T02:58:05.000Z,smwet,Amazing!,I love YouAte! It has made my life so much easier and I feel better about the food I am eating. I’ve lost 8 lbs since I’ve started using youate it’s helping me focus on the quality of food I am eating. I just wish there was an area to log my water. I’m horrible about getting my water in so having a spot that addresses that would help tremendously! Otherwise amazing app!
292,292,5,2021-02-17T21:32:28.000Z,DeniseLou82,It Really Helps!!,"I have tried other food tracking apps, and this is the least judgmental and most helpful app I’ve used! I am 5 days in and am already way more mindful about what I am eating, am becoming more aware of my hunger cues and eating healthier! I would highly recommend this app!!"
293,293,5,2021-01-23T13:13:06.000Z,HelenTinkelson,Great idea!,"This is the closest I’ve found to a mindful eating or intuitive eating tracker. Simple to capture what I ate and simple insight-provoking questions after. A few more tweaks, such as being able to add a question or two of my own and adding the location tracker, and this app is perfect!"
294,294,5,2020-06-13T20:11:47.000Z,nooooooooooooops,Best food tracking up,"I love this app so much. It allows me to track my food quickly, with no judgement and truly reflect to make a difference in my eating. I also love that I can follow friends - it’s so helpful to see what we’re all doing. The best part is the ease of use and the simplicity of logging."
295,295,5,2019-08-23T03:00:46.000Z,Pookster05,This app is the best!,"I love the concept and ease of this app. I have used other apps that were calorie trackers. This one is far superior due to its simplicity and urge towards intuitive eating. I love how it’s basic: on path/off path, and it goes from there. Thanks for helping me stay on track with my weight loss goals."
296,296,4,2019-09-24T16:53:28.000Z,willwalk4wine,Accountability is key!,"I need to lose weight.  I’ve tried “everything.”  I know keeping track of what I eat is key, but I am so, so tired of counting (Points, calories, carbs, macros, etc.).  This app allows me to be accountable to myself just by snapping a picture.  It helps, it really does.  I lost two pounds my first week and am pretty confident this is something I can stick with!"
297,297,5,2021-04-17T05:21:11.000Z,NJoue789,Very Easy to Use!,I don’t write reviews on apps but I love this one. So easy to take a picture. It is helping me develop a healthy relationship with food. Rather than tediously tracking calories all you need is a quick picture and a friend to keep you accountable. 5 stars!
298,298,5,2020-11-14T23:57:50.000Z,Ranakdevi,So much easier!,"I am really enjoying this app. I know that keepingA food journal is absolutely essential for me in order to reach my food goals. However, its been so hard to keep up the habit with the other apps I’ve tried like my fitness pal and weight watchers. Ate makes is so much easier!"
299,299,5,2020-11-13T00:45:18.000Z,Munoz2806,Awesome Awesome App,"I don’t rate apps. However, this one deserves an excellent rating. Just taking a picture, not counting calories or measuring has made me so much more aware of what and why I’m eating. Even the “on track” challenges are an extra incentive. So easy and the little bells and whistles are a nice addition. Thank you!!!"
300,300,5,2019-02-13T19:49:51.000Z,TheReasonsAreRight,This is the one,"This is the app you haven’t tried yet. This app has shame-free accountability, great data and is so quick to use, you can track on the go. The other apps you tried quickly stopped being effective because it’s not this one."
301,301,5,2019-03-04T03:32:34.000Z,momo4671,Love this app!,This app is so great! It has helped me keep track of and stick to my eating plan. I love that it keeps track of how long it has been since you ate last. I also love the fact that I can keep track of what percentage I have been staying on path. I would highly recommend this!!
302,302,5,2019-05-16T14:57:15.000Z,Td4k9,Excellent App!,It’s been an amazing app to help with food tracking and helping you stay aware how often you’re eating. And it helps you stop and ask yourself if you really want the food if you have to chart it lol. It’s so easy to use even if you aren’t super tech savvy. I’ve loved using it so far.
303,303,5,2020-03-05T00:57:55.000Z,RocketGirl3,So Simple!,"A quick and easy way to keep track of meals, mood and circumstances when eating, and water drink intake, plus customizable questions and answers to add to your daily journal. You can keep it super simple, or more complex. I did add the features to track more which works best for me."
304,304,5,2019-10-13T17:51:58.000Z,florenciaescmed,Best app for being mindful without restricting.,"I LOVE this app. As someone who was a calorie counting addiction, I can’t stress it enough how awesome this app is. You get visual cues of your intake and can answer questions about your meals. It’s helped me eat intuitively rather than count every single thing. A great tool for anyone struggling with binge eating too."
305,305,5,2019-07-21T19:08:17.000Z,viviagcrc,So far so good,"The good thing this app provides, is the possibility to track your food without any judgement and calories involve... when you are an emotional eater, you need more of a visual clue of what affects you or how or when you made some choices, to better understand how you can address that."
306,306,5,2020-12-21T00:44:34.000Z,AmyJW22,Brilliant idea for an app,"In a visual and digital world, where people take pictures of their food all the time to showcase a meal, restaurant or their cooking skills, this app is a brilliant way to utilize the technology of today to track one’s eating habits, feelings and patterns. I just got it yesterday, but so far, I’m very impressed."
