,id,rating,date_time,user_name,title,body
73,73,5,2020-02-28T02:38:36.000Z,Jennaberri,Helping with emotional eating,"So, I’m struggling with emotional eating. Just stopping and reflecting on my feelings about my meals through the “feelings” pop up, which asks questions like where you were, who with, restaurant and hunger level. Just seeing what I’m eating and understanding the feelings that food gives (or not) is helping my underlying issues with why I’m eating outside of hunger. It’s also helping me healthily transition away from calorie counting and just looking at how much food I’m consuming and how often. It’s been a week and I love it. I feel so much more in tune with my emotions and less prone to eat because of stress."
74,74,5,2019-11-19T21:59:08.000Z,Medicine is Food,Great app for tracking,"The app works best with people in your group to share and discuss options. The interface with your friends could be improved, where a comment could be shared or recipe by text or by url, on the same page as the picture.  However, I love the fact that it is not about calories.  If calories in vs calories out was truly that simple, than it would be that simple to change a lifestyle just as simple.  People are catching on that other factors play a bigger role and research is supporting these finds.  Ate is ahead of most trackers at this time, at the forefront of modern dietary thinking.  Great work!"
75,75,5,2021-01-27T00:39:59.000Z,Lisadunston,Ate is a keeper!,"I think I’m probably in the same boat as everyone else as far as trying tons and tons of other food diaries and not enjoying them. Counting calories is such a tedious and daunting task. I hate feeling bad about what I eat. This app is designed to remind us that we are human and food is meant to be enjoyed and remembered. My favorite feature of the app is the notes/Q&A within your food logs. The Q&A doesn’t ask for calories, nutritional facts or anything of the sort. It just simply wants to know what did you eat and how did it make you feel. Definitely recommending this app to friends and colleagues! Thank you, Ate!"
76,76,4,2021-07-28T07:35:21.000Z,mcscots13.il,Enjoying ATE,"I am really enjoying the ATE app. I am utilizing it to track my food consumption so my dietian can help me with maintaining my current weight. With the friends option she is able to see what I am eating, and can now help me see why I might be loosing weight and what we can add to maintain a healthy weight."
77,77,5,2020-07-07T18:45:46.000Z,ChrisItaly,Easy Breezy!,I’ve struggled with my weight most of my life. I tried all kinds of diets and programs throughout the years. What I LOVE about this app is that I can food journal without the soul-crushing experience of having to add quantities and calories and search for foods online and measure and weigh everything!! That always sucked all the joy out of eating for me! Having a visual record of what I ate is a game-changer (and I’m middle-aged so I’ve played ALL the games before 😁). It has made me more mindful and it has simplified everything. I’m down about 5 pounds in just a few days. I just really love the way this works for me! 😃😍😁
78,78,5,2021-07-25T14:35:30.000Z,excited about food,Ate!,"This is a great app. It is easy to use offline which is a plus for me. I like how it gives different experiments to work on and challenge you. These experiments are explained and help you think in a unique way. After you eat you are given questions about why, where, whom, and the such you ate. This is a great way to track your mode, your reasons for eating and helps you become aware of your habits. I’m very pleased with Ate. The best part is that you don’t have to have the premium access to exceed. Thank you for all your hard work by making this app so user friendly."
79,79,5,2019-07-23T19:20:48.000Z,bethnomdeguerre,Great for mindful eating,"Like others, I have done several programs in an attempt to eat healthfully and control my weight."
80,80,5,2018-01-01T08:47:46.000Z,euterpe42,Awesome app!,"I am so happy this app exists! I’ve been trying to eat healthier, and wanted a way to track my food without stressing myself out over calories and macronutrients and all the other data food-tracking apps collate. YouAte is perfect: when I snap a pic, it makes me remember what I’m actually eating, the short reflection questions help me consider why I am choosing a particular food (and if there was a better choice I could have made), and the “path” set-up is guilt-free and allows me to evaluate what’s on track for me. It’s the best way to mindfully track food without tracking calories."
81,81,5,2018-07-20T20:48:08.000Z,charcharblancNC,Finally an app that gets it!,"I stumbled upon the Ate app while looking for something simple to help me keep track of what I eat. I do like “the other” popular app but find that tracking calories hasn’t helped me. The Ate app is great for figuring out the WHY behind eating. Eating is good! Eat to live and live to eat - but do so in a way to be healthy and happy. We are all taking pictures of our food anyway, why not do it to better ourselves? It’s simple, and I think about whether I’d rather report back with picture of a donut that I ate, or a spinach omelette that fed my soul and nourished me. Well done!"
82,82,5,2021-02-02T21:20:55.000Z,GloriaG,Great for changing behavior,"A month with this app and I improved my eating behavior and dropped some pounds. Like many food apps it serves to “correct” you just through the act of tracking (“Do I really want to log that?”) Unlike other food tracking apps I didn’t feel a sense of “failure” if I blew past some calorie (or carb, or whatever) goal. It was also nice and easy to do a picture, and I found on days I did really well I felt a sense of satisfaction looking back on the day in review and seeing all that healthy food. This helped to reinforce positive behavior as opposed to eliminate “bad.” Good app!"
83,83,4,2021-02-20T18:45:03.000Z,Mairelys A.,Useful!,"I’ve been using the app for about a month now, and it’s been helpful as I navigate my health goals. It’s helped me identify patterns in in the kinds of foods I’m eating and how much time I’m waiting in between, which is key as I work on balancing my blood sugar. I appreciate that I can share my food diary with an accountability partner. I would however suggest modifying the on track and off track feature to allow a little life nuance. Ex: If I have great nutrients on my plate, but a larger portion of carbs than what I’m aiming for, and waited way too long in between meals, I would be unsure which option to chose, and am unsure if I can opt out if that feature."
84,84,5,2019-06-24T21:04:05.000Z,Fruteria24,"Chill, but super effective food tracking app","I was looking for a food journal app, but tired of tracking calories or quantities. Really happy to find YouAte! As someone who thrives on accountability, I can see what my friends are eating and they can see mine (actual pictures of meals). I also love that the meal photos don’t automatically save to your phone. It’s the perfect way to visually see what you eat, but not have to spend valuable minutes of the day tracking (which was never sustainable for me). Seeing photos of what you are is a really powerful tool. Definitely motivates me."
85,85,5,2020-08-16T17:40:28.000Z,Happy Sea Shell!,Wonderful program that works!,I was impressed with how much info Heather's assist. gathered so 2 perfect coaches could be chosen specifically for me. Met an hour with my mindset coach - she's great - told her my issue and after discussing she said text her anytime I needed support before our next meeting. Love that. My food coach had unique suggestions right off the bat that made a difference! I've dropped 5 lbs in the first week and was not hungry!
86,86,5,2021-06-01T02:44:01.000Z,El Rey Del Mondo,Camera Visually based is the best feature,"I have read some of the critical reviews about trying to bypass the camera feature. I wonder how it would be easier If you have tried to sit down and type in after every meal , snack , water , coffees and so on Vs snapping quick shot, then to quick questionnaire about how you felt, where you ate, how you ate and so forth . Previously I tried and couldn’t. Now I am doing it with great ease and accuracy"
87,87,5,2020-12-31T18:55:33.000Z,katielw,Dev Request - Great app but can we fix the camera permissions limits?,"Love the concept of this and the latest additions! I also love that it works with my Apple Watch. I would use it all the time, but I hate leaving on camera privileges for apps (I trust you guys but just think it’s a good privacy habit in general). If the app let you use it even when the camera permissions were off (say you wanted to do a text entry or just upload photos from your gallery or turn camera permission on sometimes), it would be perfect. Thanks in advance for the consideration!"
88,88,5,2019-09-15T18:49:56.000Z,EmSuz32,So usable,"I love so much about this app. I love that there are so many options provided for what “on track” might look like for any individual; It’s not just a weight loss app, and it’s not tied to a particular fad diet; it is meant to help a person reach their food goals, whatever they are. I also like the little arrow that nudges me back in track. I’ve used a lot of food tracking apps, and this feels the healthiest and the most sustainable. I’d love to see a report included that lets you look at a glance at how on track you’ve been over over several days or weeks."
89,89,5,2020-09-10T16:41:19.000Z,CaylaAdams,Mindful Eating,"I really like this app!! I’m not a fan of calorie counters, but I’m realizing I need to be more intentional about what I’m eating. The goal of “happy and healthy” is perfect, and deciding whether something is “on path” or “off path” towards that goal is completely up to the user. It makes me be reflective, without feeling ashamed or stressed about the exact calorie count. I’m also a big fan of all the statistics it gives me— I feel like I already have a better understanding of my eating habits and have made some important changes that I hope to maintain with this app."
90,90,5,2018-01-04T16:58:23.000Z,maybematilda,Easy and helpful,"I have used calorie counting apps/sites off and on for years. They are absolutely soul-crushing for me. Too time-consuming to use, and they inevitably lead me towards obsessive and disordered eating. I love that this app helps me keep track of what I’m eating and make healthier choices without reducing it to meticulous number tracking. I’m not hugely consistent with using it yet, but I’m improving. I feel better when I use this regularly. Thanks for providing a simple way to help me feel better and choose wisely, without making it all about numbers."
91,91,5,2019-01-10T18:57:53.000Z,TBOKC,Simple!,My doc asked me to provide her with a food diary. I just don’t keep track well so I searched for a simple app to track what I was eating. Nothing was simple!  They all wanted vast info such as macros and carbs and calories. Then I found YouAte. I just snap a picture of my food (or enter a description if I forgot before I started shoveling)!  I just share my day with my doctor and it sends an index picture of my meals to her. The app keeps me on track because I know I don’t want to take a picture of food I should not be eating or food I’m eating due to stress or boredom.
92,92,4,2019-02-10T16:54:41.000Z,Kayakchick,Easy Tracking,"I love, love, love this tracking app. I am not focused on calories so much as I am on listening to my hunger cues and making healthier choices. This app is perfect. I can snap a picture and be done if I’m in a hurry then add notes later when I have time and feel the need. It lets me instantly know how well I’m doing at staying on track. If I forgot to take a pic, I can just put in the text of what I ate. This couldn’t be any easier. The one thing I would change is under How did you fee, I would add a full button. There’s a difference between satisfied, full, and stuffed. Or maybe make it customizable."
93,93,4,2019-03-05T02:39:12.000Z,girls got goals,Fantastic and so easy!,"This is a fantastic app, quick and easy to track what I’m eating and drinking throughout my day without adding each ingredient or scanning everything. I love the ease of quick taking a picture and being able to go back and take note of my food choices."
94,94,5,2019-07-11T11:34:42.000Z,Jcrofo,Love love love,"I love taking photos of my food anyways (especially for my insta) so this was the perfect app for me to track my daily intake. I love that it’s simple, straightforward and there’s not pressure to count calories - am I on path or my goals or not? If I ever forget to upload my photos, I can always go back later. Super simple yet effective. How did I only just find this app????? I also love all the bright fun colors and progress charts and that you can share with friends. After I finish my review, I’m going to upload a photo of my breakfast to my app - smoothie bowl anyone?"
95,95,4,2019-08-07T12:22:26.000Z,KateWV10,It’s working for me,"I’m not really in to calorie counting or dieting in general, but I am trying to get rid of my baby weight so I gave this a chance. I’ve only been using for a week and I am down 2 lbs., which doesn’t seem like much but hey it’s a start in the right direction. This app makes me more mindful of my eating choices and I really think it’s helping me stay on track. I like that it’s so simple and easy to use. I like that my friend and I can motivate each other and chat through the app. My only negative feedback is that I wish there was a section to log fitness just so you can also stay accountable with that."
96,96,5,2019-08-24T05:24:13.000Z,Divya D.,So happy!,"“Ate” was an accidental discovery & what an amazing find... What a wonderful way to food-journal, make notes about my feelings & eating habits, and stay self-motivates, without the self-judgement I often feel from forget food-journaling apps! :) I feel like “Ate” address my total well-being, not just calorie-counting, macros, & exercise, but also my emotions, eating habits, and goals on a much deeper level. And I love that it’s photo-based; Makes tracking everything so much easier cause it’s all visual! A great app for those who want better balance in life & health, not just weight loss. :)"
97,97,4,2021-01-27T16:15:55.000Z,MairienL,Learned to work around it,"When I first started this app I was taking photos and adding them before I ate as the plate look full and one can see what I was eating but I found this is not really accurate. When I look at the time my last ate, it would be off about 30 ish minutes depending on how long I knew it took me to eat. I like being as accurate as I can be on these apps so I can use it to my advantage. So, the solution: I take the photo before I eat and once I take my last bite I will import it with the current time. The new problem? Sometimes I will forget to import the photo later..."
98,98,5,2020-07-06T14:40:20.000Z,wawertz1968,Fantastic App !,I absolutely love this app because I like to put my food into my Cronometer app but I don’t want to do it immediately because I’m busy with other things so I can take a video diary of what I eat and then at the end of my day put it all into my other Cronometer app and really helped track my nutrition for health and wellness it’s so easy it’s so quick and it really gives you an accurate picture of how much you’re eating in the quality your food is right in front of your eyes and don’t forget mindlessly what you’re eating each day
99,99,5,2020-01-01T16:35:06.000Z,MSU4ever,My favorite food diary app!,"If you’re like me, typing every morsel in a food tracking app gets old very quickly. Journaling your food in this app is quick and easy – just take a pic and tap the on- or off-path button. You can also add more details if you choose, such as why you ate and how it made you feel afterwards, which really supports accountability. You can easily see the history of your food choices, which is very helpful. Aesthetically pleasing and straightforward UI/UX. Thank you for developing and continually updating this free, simple, and fun app!"
100,100,5,2017-08-16T20:18:36.000Z,DreahSam,Efficient. Simple & Easy!,Honestly this app is GREAT.
101,101,5,2017-10-04T10:40:33.000Z,Shicks090,MAKES YOU WANT TO IMPROVE!!,"This easy to use app is addictive!!! Just by taking a picture or entering what “you ate” and being honest as to whether it was on “your path” it shows your progress.  It asks simple questions like were you hungry, where were you when you ate, how you felt after.  It really makes you think."
102,102,5,2018-09-17T17:09:43.000Z,Kishma20,Simple and efficient.,"I love this app! It’s a perfect food diary that helps keep me accountable. I don’t have to write anything down, just snap a pic when I’m eating and choose the path. You can even click on the picture and answer a few questions about your meal. Seeing it all laid out before you really helps to put things into perspective and makes me conscious of what I’ve already eaten. If you need all the bells and whistles, you’re in the wrong place. If you want a simple, user-friendly and fun food diary, you should get it!"
103,103,5,2018-11-12T18:40:00.000Z,rebsrondo,A picture is worth 1000 words,I have food journaled in the past and always slack off when it comes to counting calories. It takes a good amount of effort and once you miss a few meals it’s hard to get back on track. Snapping a photo is easy. I’m able to review all of my choices quickly and know whether I’m on track or off track. I love that you can take a photo and it doesn’t store on your device. It only stores on the app. I always seem to be low on memory so that is a great feature.
104,104,5,2019-03-12T18:45:32.000Z,Noelle932,Everything’s included,"Most apps that look helpful have a “bait and switch” technique where they show all of the features in the App Store, but then once you download the app you learn that you can only put in two meals a day, or set up only one notification, or the camera feature is a paid option. Not with this app! It’s easy to use, everything’s included, it doesn’t decide for you what is healthy or unhealthy, and the accountability of tracking what I eat has done wonders for my diet choices. I love this app!"
105,105,4,2019-04-09T19:25:02.000Z,ComeThrough,Love it!!,"This is kinda exactly what I needed! When tracking includes calories, it really hurts the way I eat. This is great for just remembering to think about it a little without making me feel pressured or guilty or anything."
106,106,5,2020-12-26T14:10:17.000Z,iowaskies,Great app!!,"Quick and easy way to make a food journal-snap a photo and go! This app has been great letting me see when I stay on track with my healthy eating and when I don’t. The percentage reminder of how often I stay on track motivates me to make better food choices. I can set a goal to work towards and it helps me feel successful. I also really like that it has an added layer to let me connect why, where, and how I’m feeling when I eat. It’s also customizable so if I’m feeling something not listed, I can add it to my choices."
107,107,5,2020-12-01T16:43:15.000Z,sporple,Accountability without calorie counting,"The way this app is structured has made it super easy for me to keep myself accountable to my goals while enjoying food and avoiding calorie counting which I know is detrimental to my mental health. Doesn’t shame you when you go off path, and let’s you choose what’s on or off your path for the day which lets me decide ice cream is fine and on path when I’ve been eating salad all week. Love that this app encourages sustainable changes to your diet rather than crash dieting and restrictive eating/exercise regimens."
108,108,5,2020-08-26T02:32:34.000Z,Rubyk14,This is what I’ve been looking for,"I wanted to start keeping track of my food choices, but calorie counting felt so overwhelming that I would give up two days in. This app has been amazingly powerful even though all I’m essentially doing is recording what I eat, why I eat it, and how it makes me feel. It’s quick and easy, so I don’t mind sticking to it. I’ve already lost weight after using it for a week and a half because it’s made me think twice about some of my bad eating habits. I really love this app! It’s so helpful!"
109,109,5,2021-01-13T01:19:15.000Z,Marykatie,Great app and simple!,"I just wanted a simple way to track what I was eating, because that’s the best way for me to be honest with myself! All the other apps I looked into were very complicated and seem to be designed for people who want to make a profession out of tracking their food, and I just wanted a simple log. This app does have a lot of great options, but one of them is the option to just very simply track what you eat and whether it was on trrack for you or off track. Simple and very helpful!"
110,110,5,2017-08-25T08:29:24.000Z,ANGIEL806,I absolutely love it!! :),Ate is a straight to the point app. That focuses on keeping you on track/path and since a picture is worth a thousand words it works.
111,111,5,2018-06-29T14:49:34.000Z,2TwinTowers,It's a Snap with this App,I've been using this app for 3 months and I love it! It's literally a snap of what you're eating pick the path for the food and you're done!
112,112,5,2018-10-18T18:02:09.000Z,Chickeditor,Love it!,"I have done calorie counting & weight watchers. This by far is so much better. No obsession over every calorie, micro managing or guesstimate when you go out to eat. Even if I over do it on a meal I get right back on it with my next meal. I am also visual person  and seeing what I ate over seeing it as a text is so much more impressionable for me."
113,113,5,2019-05-17T19:55:38.000Z,IcedTeaPlease,Ate is great!,"I’m really enjoying this app. I’ve noticed I hold myself more accountable for what I’m eating, especially when it comes to snacks. And I’m getting a better sense of what foods make me feel full and satisfied for longest. It’s nice to recognize how often I’m treating myself as well as when I’m skimping or being lazy. Plus keeping in touch with my friends is an awesome aspect, as some of us live states away from one another. We already enjoy trading recipes and sharing new places to eat, but Ate takes it to whole other level!"
114,114,5,2019-09-19T14:58:48.000Z,Ziasophia,Best food logging app for intuitive eating!,"This app allows you to choose whether you are making the right choices for yourself and your personal goals. All of the questions about the food are editable. I don’t care to count calories or macro nutrients. I do care to track my hunger, and my own feelings before and after I eat. I also care to track the different colors I incorporate into each meal. This app allows for all different choices. It is fully customizable, and even the free version is fully developed. I love this app!!"
115,115,5,2019-08-21T07:37:01.000Z,Jennyfher's Surface Pro 4,Easy to use! Love it.,"Finally a simple food diary app. Other apps are too complicated. Photos are such an easy way to track what you eat (love that photos don’t automatically save to my phone’s camera roll) plus you can write notes underneath & also keep track of how you feel afterwards. You can choose which “steps you will take” to reach your specific goal & the app provides you with tips and a little research for each different “step”, which is something I love. Thank you developers!"
116,116,5,2020-08-05T11:44:44.000Z,Cary Anne Fitzgerald,Empowering the Eaters!,"I am a foodie for sure but as I get older, my body can’t handle the splurges like it used to.  I find through this app, I can feel accountable for what I eat...make my choice in what I am trying to accomplish with diet choices and have a documented review of what works & what does not.  Right now, I am just finding my way back on after time off & it’s so helpful.  I am looking forward to using some of the challenges presented here- like portion control or more mindful eating.  Thanks for the empowerment 💛"
117,117,5,2021-04-09T01:56:58.000Z,AFloodLover,On Task,I learned about the Ate app from my daughter who’s an eating psychology coach. I’ve wanted to rework some of my eating habits and she suggested I give this a try. I’m really loving it and am finding that the act of photographing everything is helping to keep me on task! It’s very easy to use and I love that my daughter and I (she lives across the country from me)can see each other’s meals throughout the day. And love that we can write little comments to each other. I’m very happy to be using Ate to help me stay on track!
118,118,5,2021-01-17T18:26:57.000Z,bri mazzi,WOW!,"As someone who deals with disordered eating, this is EXACTLY what I needed."
119,119,5,2021-01-12T07:01:05.000Z,SpeckleRider,Exactly what I needed,"I am not at all good about being aware of what or how much I eat. This is a very simple, easy to use app that helps me to keep track of what I eat and also helps me remember to eat snacks to keep my metabolism going. I like that it doesn’t ask me to count calories or even have me eat anything specific at all- it’s all up to me to eat what works for me at the time. It also encourages me to eat in a way that I can take a little pride in. I’m sure I’m going to lose weight with it."
