,id,rating,date_time,user_name,title,body
291,291,5,2013-12-11T19:44:59.000Z,Eringatang,Love the recipe option,"This app allows you to store recipes with a total number of servings (or grams). For example, you can save a muffin recipe that makes 12 muffins by entering all the ingredients. Then, when you eat just 1 muffin, it does the math for you to figure out how many carbs you ate based on the total recipe. You can also save you favorite dine-out food as recipes, such as to-go salads --just enter all the ingredients. You can even take a picture of your recipe and save that (though not sure how useful that is). You can copy meals from one day to the next. It has many different ways to enter food (grams, cups, oz, number of (almonds, for example)). It is very useful and has made gestational diabetes not overwhleming. Blood glucose very easy to track.  It took a day to figure out how to use all of the features. They only thing I have not figured out how to do is enter carb goals for all meals, but I am sure I will soon. Very much worth the $9.99."
292,292,3,2014-12-28T18:40:52.000Z,davefwood,"Good App, Laughable Database","The app has lots of useful, customizable features. You can adjust the blood glucose range for various times of the day, so you can create incremental goals and work toward them. You can adjust the proportions of protein/carbs/fats. And their are lots of charts and trackers, some of which are more useful than others."
293,293,5,2015-06-06T10:09:35.000Z,kellylesa,Almost perfect!,"This is, in my opinion, the absolute best food/fitness tracking app if you are also a diabetic needing to track carb intake and BG readings. Many other trackers are available in MND as well, with the option to create some custom ones. I wanted an app with the ability to track BG readings and carb intake (for sliding scale purposes). However, I'm also trying to be more active and eat healthier, hoping to lose about ten pounds. Many of the better health/fitness apps do not have a way to record diabetic related readings, meaning you have to have several different apps and logs going at once, never quite getting a view of the big picture. With this app, you can see everything without having to duplicate your logs in multiple apps. I have absolutely loved this app for the few weeks I've had it."
294,294,5,2016-02-24T13:20:35.000Z,snatitnaf,My Net Diary D is indispensable and easy to use,The entry options are very intuitive and easy to do now with just a few characters to search or to copy previous entries. Very easy to manage. I wish it communicated with my Fitbit.
295,295,5,2016-04-14T00:52:12.000Z,wendyb413,Love MyNetDiary,I am a Type 2 diabetic since 2007. I have never had good control of my diabetes. I went for a check up in early March and my doctor wanted to significantly increase my insulin intake. That was on a Friday. I sulked all weekend about the medication increase. My doctor also wanted me to log my blood sugars for the next few weeks so we could get a better idea of when my high sugar readings were.  I tried writing them in a log book but would forget to write them down or not have my book with me when not at home. I decided to search the apps on my phone and find one that I could use. MyNetDiary is the first one that came up and it was so easy to use. It has helped me keep 80% of my sugars in the green for the last 6 weeks and helped me keep up with my calorie and carb intake. I love how it logs my steps and helps me keep up with my exercise and how many calories I burn in a day.  My daughter started using it to help her lose her baby weight and has lost 15 lbs in 5 weeks and looks great and feels great! I highly recommend MyNetDiary for both diabetics and non-diabetics.
296,296,5,2016-05-04T00:18:15.000Z,20932120123,Adjustable,"This app can be as complex or simple as you want. Keeps me on track and keeps me doing the right things. Have had no issues with food entries but the scanner database seems limited. For most things a word search works fine. Seems to have a lot of flexibility. Buy it, I was hesitant at first but ask yourself how much your meds cost? Isn't your health worth it? Other cheeper apps out there may work but I like this ones interface."
297,297,4,2016-05-22T14:59:59.000Z,Tanken forever,I have used this app along with mynetdiary for well over five years now!,"I find this a very good app for tracking my blood stat levels.  Also I have been using the diet tracking to track what I eat and all the sugars, carbs, and trace minerals.   I have created custom ""foods"" so that I can easily input my MEDS and SUP (supplements). The app is very flexible.  I have also used the integration with my Whitings device and found that useful to see workout (steps), blood pressure, and weight.  There are many table and graphs to look at the stats.  I share my stats with my doctors, and it helps with giving a clearer picture of my diabetes and my progress, or problems when they arise. I use this app on my desktop, iPad, and iPhone, all the instances see the same data almost instantly. I think the use of this app has been a big contributor to my being able to have the doctor reduce my blood pressure MEDS and blood sugar MEDS. Great job developers for creating a usable, stable and well maintained and updated app."
298,298,5,2016-09-07T03:36:03.000Z,K3uk,Lost 40 lbs in 5 months !,"This app started my weight loss when I first used its barcode feature to ""grade"" items I intended to purchase in the grocery store . I initially established a plan to by only products the app gives a A- to , or higher . Sticking to this plan, and entering in the food items I ate each day (with the suggested calorie per day for my goal),  saw some very encouraging weight loss within only a few days .  The initial weight loss then encouraged me to begin to exercise,  and after 5 months I have lost 40 pounds . Within the past few weeks the rate of weight loss has slowed , but it is still going down. The app tells me how many ounces I should lose each day based on the amount of exercise I enter in each day and the food items I track . That part does not seem very accurate since currently it predicts I will lose a pound per day but in reality I am now losing about  a pound per week. It has been the best app of all those on my phone ."
299,299,5,2017-08-10T12:44:06.000Z,Carolcerc,Love it!,Great!
300,300,5,2013-04-06T20:58:24.000Z,laraM,Love my net diary,"Love my net diary - I have tried out a number of calorie counters and found it to be the best. Best range of foods, easiest to enter and can either enter on my iPhone or on the web site at work. Can add common recipes or combinations of foods that I regularly have. Also like that most foods can measure in grams as means it is much more accurate than trying to measure or estimate volumes. I have a good food weigher at home and a simple small weighing device I take in my purse for when on the go. I freeze 100cal veggie sides like creamed spinach in the freezer so they go with my protein meals.  Read awhile ago that they were doing a diabetics app and while I don't have diabetes, I do have PCOS and insulin resistance and I'm trying to eat low GI. This allows me to measure the effects of different foods and motivate me to keep my blood sugar low while I try to give up chocolate."
301,301,1,2013-08-13T21:18:10.000Z,Jbp3191,Caution Pro version is not complete app,"My father has type 2, so I'm looking for an app that will let  him monitor his food, medications, and insulin and send the reports to his physician.   I thought I found it in MyNetDiary,  The app allows input of these areas of concern supplemented by a food item dbf to get your exact foods eaten. The dbf is not complete it, but to be fair that is a huge task. They do allow for manual input and even scanning the labels to send in for I assume a more complete dbf.  My objection and larger concern is the summery of the data which is what one really want to send to their doctor. The Pro app at a high $9.95 gives you the impression of a full featured app with reports available. However once you discover their website and find out they want to sell the reports for a monthly service fee only accessible through their website in what they term the maximum  version/service  you realize the scam. I am appalled that these people would take advantage of people with diabetes in this manner. Because of their sneaky business practices I do not recommend  this app."
302,302,5,2013-12-22T06:36:05.000Z,Ariannaslight,So much more than just a diabetes app!,"Wow. I've used lots of heath and fitness apps with varying degrees of usefulness and nothing compares to this app. The food diary alone is worth the cost of the whole app but add in the charts, ability to track various health items,  email your weekly synopsis to yourself or your doctor, keep track of exercise, nutrients, steps. The daily analysis is one if my fav things. I love how it keeps you abreast of your progress toward your weight loss goal  and the little thumbs ups and downs are good motivators of things you don't usually think about in your diet.  It's totally helped me to stay on track. I check my food diary information before I eat something and definitely alter what I eat based on the info the app provides.   I like the idea of the food score. I haven't ever utilized that but an planning on reading up on it some more."
303,303,4,2014-09-14T15:05:44.000Z,Perrybucsdad,Good but could be better.,"This app is great for helping you track your nutritional info, diabetic info and losing weight.  Since they charge you a monthly fee to use most of the features, I really think it should be free with the very basic tools you get with it for $4.00."
304,304,5,2015-03-02T20:01:16.000Z,Locutious,MyNetDiary D is it!,I've been using MyNetDiary for about 4 years and have come to expect a steady flow of improvements and ehancements from this great development group.  We now have the perfect marriage of applications.  Now I can track the relationship between my diet and my diabetes with one easy to use tracking tool.  Life just got a whole lot simpler.  Thanks to the team!  One request though.  In Tracker I am only able to enter whole numbers for Hemoglobin A1C.  Need at least one decimal place to be meaningful.  Thanks and keep up the good work!
305,305,5,2015-12-11T19:38:02.000Z,Evilmonkee,Love Love This App!,"I was already keeping a very detailed written logbook for months before finding MND.  I wish I had heard/found it sooner though as it would have made my life way easier, even though the habit of writing things out was good.  Helped me to get my A1C down from a 9 to a 5.2 and lose over 120lbs from ~290 to 167.   By just changing my diet and later adding some light exercise, I was able to get off insulin completely.  Keeping track of my glucose and meals is still such a daily routine that I continue to use this app every day and I love how it integrates with my Withings smart scale and OneTouch Verio glucose monitor via Apple's Health app. They seam to have thought of everything when providing the tools to making quick and easy entries. You also can't beat their support team, who are were very quick and responsive to some issues I was having.  A++"
306,306,5,2016-02-21T14:41:03.000Z,WTFRMR,Perfect tool for the newly diagnosed!,"I was diagnosed with Type 2 Diabetes 9 days ago, and like may other newbies, my head was spinning with how many things I now need to keep track of to document my progress. I read the reviews and downloaded this App. It makes order out of chaos. Getting started is very easy: enter height, weight, age, diabetes 1 or 2. It gives recommended daily calorie intake and all other components such as Carbs, sugar, protien... It tracks all information that is available to it, making it an all in one data storage spot. For me: managing my diet would have been impossible without it. It has an extensive food item data base, so when you select an item, all the dietary information comes up and is stored for that meal. For folks like me that never counted anything besides helpings before, this App has been infinitely helpful, to get me started on the right track."
307,307,5,2016-04-28T20:27:40.000Z,SanjayWithNoNickName,Well thought out app,"I've been using the Diabetes version of MyNetDiary for several months now, after using the regular version off and on for a few years. Early this year I got diagnosed with pre-diabetes, and slightly high LDL cholesterol, so I took it upon myself to figure out what I could do to prevent going worse with these conditions. I used MyNetDiary to track everything ate, and also tracked my daily fasting blood sugar and my other regular metrics like weight, BP, pulse etc."
308,308,5,2016-05-21T12:05:45.000Z,18yr Diabetic - Type 2,Taking control made easy,"I was diagnosed very early at age 24. Always have battled with weight and diabetes management. Feeling really blessed that technology has finally caught up for tracking not only blood sugar readings but also the factors affecting them - diet and exercise!!!  I loathe keeping food journals 😡 and always have. This app makes it second nature and fun simply by using bar codes. Even better, if something isn't yet in the database, you improve the app by gathering all the data (took 20 seconds at the very, very most 😄😄😄) and sending it in to be added for everyone using the app!!  I can't wait to see what the next few months will bring and how impressed my diabetes care team will be with the detailed information I'll be able to provide them going forward!!!"
309,309,5,2016-08-08T22:58:22.000Z,Conman 12,Best App investment ever!,A must buy for any Diabetic serious about taking control of their treatment. It's well worth the $9.99 I paid. Don't even bother with the free apps.
310,310,5,2014-09-27T12:52:08.000Z,Mommie Sense,Lifesaver for newly diagnosed diabetic,"I accidentally bought the diet version which focuses on just calories, but realized my mistake and purchased the D version. I set my own carb limits and modified the nutrient settings to match my needs which I really liked. Predefined food listing is very good and I have added lots if my favorite brands using the barcode and nutrition scanner which is easy to use. If I know I will be eating out or will have limited food choices I can enter food ahead of time to balance out my nutrient needs for the day. I love feeling in control instead if the food controlling me. The charts are fun to reassure me I am on track. Feeling full of energy, blood sugar in range and lost 27lbs in 10 weeks."
311,311,2,2015-05-31T15:25:07.000Z,Echoes14,Diabetes Tracker bait-and-switch,"I've been living with Type 1 Diabetes for nearly 30 years. I've recently discovered that tying tracking apps to my phone keeps me motivated to keep better records, thus controlling my diabetes better. MyNetDiary Diabetes had rave reviews, and having some experience with their food tracking, I decided to purchase the app."
312,312,5,2015-07-07T00:58:41.000Z,Tom Kepler,Great app for a newly diagnosed diabetic,"I was diagnosed with type 2 diabetes a few months ago and began digging around for a good app for tracking my situation. After trying a few that were just fine (each with some fundamental flaw or shortcoming), I tried MyNetDiary. Works great, has a huge food database (I really like the barcode scanner), and it remembers values from one entry to the next (so, for example, you don't have to respecify the time on every element of a meal). There's no one feature that stands out as amazing (except, like I mentioned, maybe the barcode scanner) -- it's just a well-thought-out app with lots of features which all seem to work correctly and quickly. Good stuff!"
313,313,4,2016-01-30T19:11:52.000Z,HannahLooney,Ketogenic dieters friend.,"There are so many food/fitness tracking apps out there and in my opinion they all are lacking in one way or another. As a woman with PCOS who eats a clean ketogenic diet.. I think this app is the best in the market. There are still preset things such as food ratings that give foods a grade (A,B,B+ etc..) based off a high carb low fat rating system.. But if that could be changed because you are using the diabetic settings (to rate food choices based off a LCHF way of eating ) that would take this app to a 10 star in my book.. This pairs with my UP3 jawbone and I can send my food logs to my Dr.. I am very pleased with this app. And so grateful for the excellent and friendly support staff who I can contact through Facebook messenger!"
314,314,5,2016-03-10T00:26:42.000Z,cguandique,What a way to keep up on macros,"Excited I got this app. It tracks your breakfast, lunch and dinner. Input what you've eaten based as oz, grams, etc.. It has the option to barcode items which makes things a lot easier for me. I approve on the grading scale, so when you barcode capture, it'll grade your items. You can track your BG number and amount of insulin; it'll chart out so you'll see a trend in your BG numbers. It records your water intake, which I'm pretty into. Get this app, I approve. The only thing I dislike is that your Fitbit does not connect. You'd have to upgrade to premium for that and I just don't want to do that.  Overall, amazing app for track and record."
315,315,2,2016-07-08T14:51:09.000Z,kiwatate,"Ok, a nice app but...","1. I use this app a lot and generally like it. However, I do not like apps that rely on the internet in order to add or retrieve previously added data. There are times when I am not in either Wi-fi or cell phone coverage."
316,316,5,2016-08-21T11:54:05.000Z,Koi Kicks,New to me update,"I don't have copious amounts to write about this app like some others have so kindly taken the time to write but so far I like the features and, like all personal tracking apps, you get out of it what you put into it.  So far I am having to 'click' a lot but I am sure as I get more familiar with it things will be better.  I do not regret purchasing this app at all..."
317,317,4,2016-10-14T03:23:50.000Z,StephenLGale,Diabetes Tracker from MyNetDiary,"So far this app has helped my health greatly. It's easy to use, mostly, and gives my Doctors real information they can use. If it has a down side, from my perspective, it's food scanner is not sensitive enough, quick enough and has to many name brand foods it does not recognize. It also does not give a convenient way for home cooked meals to be accurately logged ."
318,318,5,2017-01-02T18:24:36.000Z,kf201,Just what I need,"I couldn't be happier with this app. For health reasons, my wife and I have adopted a whole foods plant-based diet. I am easily able to track my progress and it is great to see. Everything is better and this helps me stay motivated and committed. I strongly recommend both the diet and this app. They're a winning combination!"
319,319,2,2017-03-10T15:45:45.000Z,mom2lo,"Helpful, but missing critical features","I purchased this app to manage my gestational diabetes during pregnancy. It's been great but the features it lacks makes me want to look for another solution. It allows me to create Blood Glucose reminders, but doesn't give the same option for my twice-daily Insulin injections. Also, I've found the food database to be straight up AWFUL. My Fitness Pal had a much more comprehensive database that's actually *accurate* compared to this app. Additionally, I'm shocked the food database has basically ZERO entries for meals *without the bun/bread* -- which is something diabetics typically avoid. So I've had to look up nutritional facts from MFP and manually enter the nutrition info from that dang Wendy's cheeseburger minus the bun so this app accurately reflects my calories and carbs. Very frustrating!! If MFP offered blood glucose and insulin entries I'd ditch this app in a hot second. Such a disappointment!"
320,320,5,2012-08-25T15:41:46.000Z,MsSRyder,Changed my life,"I was diagnosed with diabetes two years ago and have been struggling to keep my sugars under control. I downloaded MyNetDiary a few months ago to track foods I eat. With that, I've lost on average 1 pound a week. I downloaded MyNetDiary Pro and loved it even more. now, with the new diabetes version, tracking my sugar is easy and I finally have my numbers under control. It is so simple and is actually motivating. I encourage anyone who wants to lose weight to download the Pro version, and diabetics to download the D version. I just wish I could sync all my devices without having to pay a premium."
321,321,3,2013-02-05T18:42:18.000Z,MountainMan65,"Keeps all your info together, but could be better","I started out using Lose It, but switched to this app to track insulin and blood sugar. For people with diabetes, losing weight can throw everything off.  This app does not have as many foods in its database as Lose It, which was a little disappointing, and the barcode scanner does not work as well. It also doesn't sync with my Withings scale for free like Lose It does. You have to pay extra for that. You pay extra for the diabetes management tools. I wish it would calculate insulin for those who count carbs. It will show you total carbs, but then you have to do the math yourself to figure out the number of units you need to take. Overall, I like this app and would buy it again."
322,322,4,2013-03-10T06:40:11.000Z,Bonecrushboy,All in one,"I reviewed so many apps, I couldn't keep them straight! This is the best for tracking BS, food, and everything else you would need to get healthy. I was recently diagnosed type 2 and have jumped straight to insulin. The app helps me track how many units I am on while I increase to the right dose, it Keeps all of my numbers in one place and is easy to use. The only thing I wish was better is the database for scanning food. It has the scanner, but no database. Maybe they can use part of the fee I paid for the app to buy a database rather than slowly building one. Overall, I have everything I need right here and even pulled it out at my doctors office to give her accurate information. Really great!"
323,323,5,2013-05-01T09:40:45.000Z,Cickes,Well Done,"Literally I never write reviews. This app is extremely compelling, so here I am. I have been using this app religiously for 5 months and I have lost 30lbs. My need for Metformin has dropped under Dr. supervision from 500mg twice daily to once daily while maintaining a 5.8 A1C. My Doctor has high hopes that he can completely eliminate the Metformin.  For the record I have zero self control so I find it amazing that just keeping a log of my lifestyle (calories & exercise) has facilitated this change. My only complaint is the app congratulates you for 3 days of record keeping. This gets a little old when you have been doing it for 5 months."
324,324,1,2014-02-12T18:20:11.000Z,Bernard 77,Insufficient Data Base,"I have used MyNetDiary for years, but it was very expensive, well over $100/yr. The data base for standard MyNetDiary is fairly extensive. Then I found this Diabetes version in the App Store and thought it could be of great help."
325,325,5,2015-12-07T20:19:45.000Z,Brenda9995,Greatest App Ever!,"I am so grateful that I found this app. My diabetes was getting out of control and had to make some changes fast. This app made it so easy for me to focus on what I ate and not on figuring out calories and ratios. It is easy to use. This particular app also helped me monitor my fasting glucose levels. In 3 months, my A1C was back to 5.3 and I had lost over 40 pounds. 3 years later it is still off and A1C is down to 5.0. Sometimes, I used their massive records of foods and at other times, I created my own. With their built in scanner, it is easy to scan a barcode and they will enter it for you. Kudos to you!"
326,326,4,2016-02-03T00:25:38.000Z,Grace full,"Excellent. The best, easiest food, calorie, nutrition, glucose...tracker!!!","Using MyNetDiary since it was born. We've grown together. With each update or new version, I was certain they'd ruin it cause how do u improve upon perfection?"
327,327,5,2016-05-08T18:59:47.000Z,CapricornsUnite,Superb app for users w diabetes,I checked out over 20 apps before finding this puppy and I'm glad I kept looking!
328,328,5,2017-01-14T12:53:41.000Z,AngelKM,A must if your a type 1 diabetic,"After being a type one diabetic for more than 30 years, I've tried every possible way to keep track of my blood glucose numbers and what I eat and also how I'm feeling at the time I test my blood sugars that's a big factor as most type one diabetic's well know, so far nothing even compares to this program even my Endo loves it because every week she gets an email directly from the app giving her all the details she needs. keep up the great work, one improvements make the D version work on iPad that would make it much easier to see"
329,329,4,2017-04-20T13:15:23.000Z,BigDee87,Life Saver,"This app literally saves my life. It helps me keep track of everything. I would never remember the time I ate and when to test if I didn't log everything in this app. It also helps me keep track of my levels over an extended period of time. Helps reduce the anxiety of trying to have everything under control. I can't even remember how much I paid for this app, but I'd pay it again and again if I had to."
330,330,5,2012-07-23T14:31:25.000Z,PzzDude,Medications?,"Overall this is a fantastic app based on about 1 hour of looking and entering information.  I went into medications and set up all 7 medications I currently take and was given an opportunity to document my use of the medications.  Now, when I choose medications, it takes me to the setup screen only and there is no place to access the medications I set up previously.  Also, the help screen for the medications setup returns a ""This page cannot be found"" error. I hope you can fix these two problems quickly as this is the app I have been looking for !!!!!"
