,id,rating,date_time,user_name,title,body
442,442,5,2015-09-21T12:37:33.000Z,DonkMon,My Review/Rave,"I was recently diagnosed with type 2 diabetes and hypertension. The diet I was placed on combined with the testing and medications was a bit daunting. Using My Net Diary Diabetes version has made the change in lifestyle much less overwhelming. The constantly updated list of specific foods by brand makes calorie counting easy, accurate, and frankly... Enjoyable."
443,443,3,2015-11-05T16:21:09.000Z,jayserna,Good not Great,"I will say this is a nice app and good at what it does. But missing several easy fixes. First it needs a insulin calculator. You have all the data, just calculate it. Secondly, app needs to read more than workouts on Apple health. My blood glucose, weight, and all body measurements are on health from my scale. Go get it.   Once the app can do this then I will give it 5 stars for sure. But currently needs to use other apps to get easy things done."
444,444,5,2016-01-02T07:30:55.000Z,BipolarWoman,My Best Friend,Love at first entry! I have a terrible short term memory problem. This keeps me on top of all my meds and times.
445,445,4,2016-02-27T03:00:36.000Z,Boxer Music Store,My net diary D,"Love this app!  As a diabetic this is very easy to use!  I would love to see the ease of use of this app work with the max program.  I find it easier to input food and diabetic info (bg, insulin doses, and food) into the diabetic app  than the max app. The max app does offer more more tracking and reports.  Hope an update will allow info to flow between the web max program to the diabetic app."
446,446,4,2016-06-20T23:20:44.000Z,4me2do,Just a few wishes,"The app is great to summarize carbs and get daily views of carbs, insulin, blood sugars and even calories for weight lose. I only wish it would bring I the steps/calories from my Fitbit versus reading how many steps my phone has been on and I wish it read the blood sugars from my accu-check connect. That would make life that much easier! Great work though."
447,447,5,2016-07-02T09:53:49.000Z,Sissy2121,Highly Recommended,"Probably the best app for monitoring your blood sugar. Very easy, precise, and has thousands of foods in its database. Has really helped me keep track of my health. I do feel like it's just a bit pricey compared to other apps but that doesn't make me change the rating of five stars. Highly recommend."
448,448,5,2016-08-17T13:18:05.000Z,Choirboy,Habitually Helpful,This is one of the best apps to track food  and blood sugars.
449,449,5,2016-10-06T12:35:46.000Z,GodB4U,Great app,I have been using MyNetDiary for several years. It has always had great food database. The barcode scanning feature is awesome. The newest update with the redesigned lock it makes the app more fun. I am a registered dietitian and I frequently recommend the app in any of its forms for clients of mine. Nice job with the latest update.
450,450,5,2013-08-03T17:29:21.000Z,wedg1967,Life Changing App,"This app has become my go to app! My wife and I use it and are extremely satisfied! Love it and the fact that it is helping us change our lives. I had open heart surgery 2 months ago, after suffering a heart attack, so a like change was necessary. This app is doing just that. Thanks!"
451,451,4,2015-04-19T09:59:17.000Z,The Kitchen Witch,Perfect tool for recording and maintaining blood glucose.,"Used in combination with MyNetDiary, I've been able to not only record my glucose readings, but also lower them, gain control and even lose weight and become more active."
452,452,5,2015-06-19T19:18:41.000Z,MBO51,Good for new Type 2 Diabetic,It has enabled me to look at my food intake and understand how it affects my diabetes. Tracking food and medications has also enabled me to begin losing wait. The food database is excellent and has led to many surprises about how many calories are in some of these innocuous seeming foods. That has led to better choices.
453,453,5,2015-12-04T01:51:28.000Z,Dazedteacher,Great app.,This app helps me to keep count of all my calories I eat in a day. I love the fact you can scan in information from prepackaged items! I am still learning how to operate all the items this app has to offer! I believe it is one of the best investments in my health I've made.... Now to talk my family into joining!🤗
454,454,5,2016-02-03T11:37:13.000Z,$$$ $aver,Great App,"I used this app when I was in a pre-diabetic stage, and it helped me to track not only my sugar levels, but my calories as well. Using it allowed me to see where and how I needed to cut down, and on what."
455,455,5,2016-04-28T11:06:37.000Z,rainstorm17,Thanks for making it easier to track!,"I've been a die hard Diabetes Pilot user for 7 years but this app is the first to make logging, tracking, planning and over all planning simple and easier!!!!! This app has a great user interface and is a great example of ease of use. Thank you"
456,456,4,2016-08-02T02:09:27.000Z,dlm51,"Good app, very helpful","I'm 65 with type 2. I've been using this app for 11 weeks and I've lost 20 lbs, my A1C dropped to 6.2 and my Dr took me off insulin. I did a little research on diabetic diets and what not to eat. THE WHITE STUFF. And this app really helps with the tracking, food grading, blood glucose monitoring. My only issue is not being able to connect my Fitbit to this app to accurately monitor my exercising"
457,457,5,2016-12-04T13:40:36.000Z,Alching52,BEST DIET TOOL & HEALTH TRACKER AVAILABLE,"Used it for the past two years and it keeps me on track, lost 40+lbs. Will continue using it when I reach my goal! I also use it to track my glucose levels and blood pressure. My doctors are really impressed with how motivated this app has made me. Best advice: Be Honest, write everything that goes in your mouth. Good luck!!!"
458,458,5,2017-01-10T14:24:25.000Z,Mulliman1,Love this App!!,"I really enjoy using this app! It's much more of what I needed for minding my diabetes, exercise and food all in one. Very satisfied! I had to use 2 apps before and the exceed use trackers would sometimes pause while riding my bike or walking and then I wouldn't get the actual mileage and calories burned. So far so good!! 😀👍"
459,459,5,2017-01-27T06:58:47.000Z,JFM67,Great App,This app has really helped me to take control of my type 2 diabetes from when I was diagnosed back in April 2016 at around 550 and now I average around the high 90s to low 100s and I lost close to 50lbs and I'm off insulin.
460,460,5,2015-01-24T13:53:18.000Z,Zebraman69,The last two updates have really improved this app,Excellent app for tracking all the important information I must track to keep my Type 2 diabetes in excellent control. I been using this app since it first came out. It was ok to start now it is great. Easy to use.
461,461,5,2015-08-17T00:38:55.000Z,TrinityWarrior48,Great App!,I've used this app daily to track my nutrition & calorie intake & weekly to track my blood glucose levels. I've lost 23 pounds in three months by changing my lifestyle & reducing carbs & sugars and exercising regularly. This app allows me to track all of those metrics & more. Excellent food database & food check scanner. Great job!
462,462,5,2015-10-17T20:33:57.000Z,Bassmanworking,The App for Diabetes Control,"If you need to get serious about controlling carbs, blood sugar and losing weight this is the app..."
463,463,5,2015-11-16T04:03:46.000Z,Braynix,Newly diagnosed,I recently was diagnosed with type 1 diabetes and was looking for help with carb counting. I am a thin guy who has never had to watch what I eat or drink so this was hard for me. Though my sugars are still a bit high due to finding a balance with insulin this app has helped tremendously with watching what I eat. Thank you
464,464,5,2016-02-04T06:52:40.000Z,Sauce Boss 6,This app has saved my life!,"I suffered a TIA stroke two years ago. This app has helped me loose 85 lbs since, stay on track with my insulin and blood sugar and learn more about me than anything I've tried to date. I would highly, highly recommend this app and it's running companion. They are so worth it!"
465,465,5,2016-03-17T11:50:13.000Z,Kimd123,Great and easy to use app,This app has helped me manage my diet and diabetes more than anything else. I am not very tech savvy so what I needed most was a program to help me track my meals and blood glucose levels that was easy to use and understand. This app provides all that and more. I highly recommend.
466,466,5,2016-05-16T19:48:42.000Z,Geezer69,Changed My Life !,"Have been a type II diabetic for 8 years and up until finding this app and the Dietary app, had trouble monitoring my diet and blood sugar. Only used these apps for 1 week but I already feel like I have both under control and am ready to take control of my life, thank you MyNetDiary !"
467,467,4,2016-10-25T13:39:11.000Z,Monkeyandfish,Useful,"The app is very useful. It helps me keep track of what I'm doing, therefore I am more conscious of what I'm doing. I like that the home screen can be customized so you only see what you want/need to see. I wish there were a couple more things I could do on it to prevent me from having to use other apps as well, but all in all, it's a great app."
468,468,5,2016-10-31T19:31:23.000Z,Jake12345676543123859,So far...,"So far I love it. Have only entered a few days...I guess I have some questions, like can I export a data to a spreadsheet?  I'm hoping this app can help me understand how the insulin works in my body with regard to timing and food choices...my doctor also likes it for food accountability...more later!"
469,469,5,2016-11-22T14:10:18.000Z,Michelle&boys,Great for diabetes and carb counting,"This app is great for the sheer number of things it does. It tracks foods pretty well, has a barcode scanner, tracks glucose and other labs like A1C, tracks weight and other measurements, and helps a lot with carb counting. It is about as good as My Fitness Pal, but has additional features for diabetics. Worth the money!"
470,470,5,2013-02-13T21:36:55.000Z,Hardtack3,Helpful,Really gives you an accurate overview health wise on either a daily or monthly outlook. I only wished it would show you your HcA1 count after 3 months on the Blood Glucose chart. It also helps you excess the changes you need to improve for better health and weight loss.
471,471,5,2013-03-12T11:25:54.000Z,Kandoril,Great App!,"This app has it all for me. One place to manage and record everything I need to keep track of. Blood glucose, medications, weight, blood pressure, diet, and even water intake!  I am strongly considering buying the 'maximum' membership plan online so I can print out charts to show my doctor when the time comes."
472,472,5,2013-10-11T12:39:03.000Z,Billboy47,Well Pleased,This is an excellent program for type2 diabetics like myself. The feedback on diet helps me with controlling the disease. I lost 3 lbs the first week just by using the feedback to modify my diet and am getting more consistent blood sugar readings. Also able to send info to my physician very easily.  Highly recommend this app to fellow diabetics.
473,473,5,2014-04-26T12:02:23.000Z,Jimlad69,Great App for weight loss and tracking diabetes,"The best way to lose weight (for me at least), is to keep track of what I eat.  This makes you think twice before going for that <enter your weakness here!>."
474,474,5,2014-09-01T17:28:46.000Z,SONIA KASTNER,Great for Ketogenic Diet (eg atkins),I don't have diabetes but the app is perfect for counting Net Carbs and calories.  Great barcode database and easy to enter foods.  The search tool for foods could be a bit better (results are pretty random) and I'd like to see more items saved to the favorites list. But overall it's a great tool for kickstarting a new lifestyle!
475,475,5,2015-02-10T15:32:29.000Z,Provandmusic,To away the guesswork. Easy to use!,This app is hands-down the best and most useful application I have ever had on my iPhone. I would have paid five times as much for these amazing features. If you are someone who is serious about your health or newly diagnosed with diabetes this is the app for you.
476,476,5,2015-09-04T17:15:25.000Z,Unclemo305,Almost there,"For a newly diagnosed diabetic, this app has been the biggest aid to me so far. It lets me know or log all of my information for easy reference at the doctors. My only issue is that a few functions seem cryptic and the help feature isn't much assistance. Other than that, I love it."
477,477,5,2015-11-16T00:25:59.000Z,Cuttin' da ropes,Amazing!,"I needed this app and I'm so glad I found it. It lets me monitor weight loss, blood pressure, blood sugar, and most of all carbs and sugars in my food that effect blood sugar. The reports that are available for printing to take to my physician can be detailed or general and are so easy to access/create. It has truly been a life saver!"
478,478,5,2015-12-12T23:13:15.000Z,Flipper374,Excellent App!,"As a recently diagnosed type 2 diabetic this app has proven to be exactly what I needed to track my daily dietary intake, medications, etc. It has become the most valuable app on my phone. Seamless online tracking transfers to my phone and updates instantly. Thank you for this wonderful tool!"
479,479,4,2016-12-05T13:17:37.000Z,Vet_MBA,Helped me fight diabetes,"This app is great for tracking exercise, food, blood sugar and blood pressure. The food can be a little frustrating though because when you put in a general food it brings up hundreds of brand names instead of just generic food values. It's still worth it though. I love looking at the graphs and seeing my improvements."
480,480,5,2012-08-25T17:40:26.000Z,Christopher Luter,Excellent but get me a full blown iPad interface,"Product has been an immense help with my diet and testing, I've dropped almost 50 points on my average test making me and my doctor happy."
481,481,5,2012-09-26T18:04:46.000Z,Rs123456,The best I have found.,"I have tried several diabetes apps and this is the one I currently use. Aside from the diabetes-specific features, it is the best food-logging and diet app - especially since you can enter food in grams which is surprisingly not true of other popular apps."
482,482,4,2012-12-31T11:59:46.000Z,Malakudo,Great app for mobility,"This is a great app if you new to track your calories and nutrients on the go. The online version is not as good though. Anyways, the meals database is huge and you can add your own meals and foods. I submitted a couple of suggestions to their team and they were pretty responsive. I'd say this is one of the best nutrition tracking apps available out there."
483,483,4,2013-04-13T14:12:14.000Z,SuePearce59,Love it !,I like this app a lot. It is easy to use and gives me plenty of data.
484,484,5,2014-04-20T14:55:43.000Z,mikekglass,"Great app, two minor gripes.","I love this app, but I have three small complaints."
485,485,5,2016-01-18T14:46:19.000Z,Anduial,Great for beginners or more experienced patients,Track everything one could need and more. Being able to calculate calories burned for any number of activities encourages parties toon in yet more activities. The ability to sync with a meter would really top it off!
486,486,2,2016-04-24T22:39:30.000Z,lewbulldog,Disappointed,"Bought this app because it would let me track my blood glucose as well as my food. It also promised to provide reports & charts I could provide to my physician. Turns out you have to get a ""max"" account to get those features, & that is around $60 per year. Feels like a bait & switch to me. The food database is not as good as my fitness pal. The only real positive is that it does give a good nutrition summary. I'm sorry I paid $10 for this."
487,487,5,2016-05-15T14:15:40.000Z,PS.Marathoner,Young skinny fat diabetic,"I've been using this for 3 years to track my blood sugar and food. It's powerful in that it has lots of food data to utilize, I've only had to enter in a handful of products. It's helped me stay off diabetic medication by tracking my meals and watching my blood sugar."
488,488,5,2016-07-02T06:42:18.000Z,Jacobshaner,Best App Ever!,"I can't stress how intuitive and helpful this is-- worth every penny for the full version. I can track my glucose, measurements, Ha1c, BP, and it calculates daily, weekly, monthly reports to email my doctors of everything! This is a must for anyone who's serious about tracking food, sugar, exercise, etc !"
489,489,5,2016-12-31T15:33:52.000Z,Cecheese,I New diabetic's dream monitor,Just recently diagnosed with diabetes and in 6 weeks have lost 10 lbs watching carbs and calories.  The BG chart enables constant watch to keep it normal.  I've shown it to all the diabetes coaches and nurses and they now pass it on too.  It keeps you honest grocery shopping with bar scan too.
490,490,4,2012-10-10T10:37:23.000Z,Don Pedro Pagina,Very Good in All Aspects,I have been using this app after using other ones. This one gives the complete package. The food database seems geared towards eating out or buying pre cooked meals. Entering homemade meals takes some patience. Everything else is complete. Much easier than using separate apps for glucose  and diet tracking.
491,491,2,2013-03-08T06:12:35.000Z,AbhiWazer,"Good app, but not worth $10","Does quite a few things but seems like holding lot of features to get you sign up for monthly fee, ridicules. Food database is really poor. Reports and charts are jokes. Hardly any customization allowed. Some free app do better job on this. Only thing I likes it's ease of entering data which is important for doing things again and again. If I get a chance I will ask for refund and use some other app."
492,492,5,2015-03-07T14:37:31.000Z,SRAM7777,Excellent App,I am using this App for monitoring my diabetes for over a year and the updated version along with previous versions were excellent. The weekly overview in the latest version is one of the best features which I am liking it. Keep it up with the good work.
493,493,5,2015-08-21T15:45:16.000Z,Cclr0224,Pretty awesome,"This app is surprisingly extremely helpful for tracking food and blood sugars for my type 1 diabetes. Also, I like how I can list my insulin doses and the charts it creates for weight, blood sugars, and insulin. So far I haven't had any issues with this app! Overall, I'm very impressed."
494,494,5,2015-11-11T16:49:23.000Z,MadoneRidr,Great Tool,"Have used this off & on about 5 years.  Simple to use and nice to have available anytime.  When any uncertainty of portion, I always 'round up' (cheat and you only hurt yourself).  Great reality check and motivational app.  I have told many friends about it.   Highly recommend."
495,495,5,2016-01-09T16:47:12.000Z,Mikeky11,Life-changing app,Dramatic but true if one is serious about managing diabetes. Some quirks but support has been responsive and integration with website  is excellent. 20 lbs lighter and diabetes under control so has been life changing for me.
496,496,4,2016-01-25T01:09:49.000Z,Michgallo,Helpful,I was diagnosed with type 2 diabetes three weeks ago and this app has been incredibly helpful.  This has been a major life change but this app has made it a little easier.  Iran into a couple of problems when scanning a barcode but other than that it is useful.
497,497,5,2016-08-12T12:51:15.000Z,NanaPamB,Big Help!,I really like this app. Many choices as to what you can log! I love the alerts and reminders as well as the diabetic tips it gives you. It works with the health app on my IPhone and with my Apple Watch. It was expensive but so far has been worth it.
498,498,4,2016-12-31T14:37:03.000Z,MMacygin,Excellent tracking app,"This application is the cornerstone of my diabetes tracking. Weight, diet, activities, along with blood glucose level tracking covers all the bases. I also appreciate the integration with other apps and tracking devices. My only negative is the cost of the annual subscription. I wish it were less."
499,499,2,2017-04-09T11:25:00.000Z,Masugah,Just ok,This app has a nice design and customization I love. There are a few missing features that give me pause.
500,500,5,2012-09-09T18:46:16.000Z,Secular Herby,Feel ripped off,"The app itself is great, and I wish I could give it 5 stars.  But My Glucose readings are not seen on my online account, and I can not print out reports unless I upgrade to a monthly payment account.  MyNetDiary should charge much less than the $9.99 for the app."
501,501,5,2013-08-11T20:51:57.000Z,Poser112211,Best app,"This app has been the best thing I have downloaded, I have changed my way of eating and this app has helped me do it. I don't put any food in my body until I check it out on here first!  So far I have lost 27lbs and wouldn't give up this app up for anything !!  Great app!!"
502,502,5,2013-09-07T15:46:19.000Z,Sagelily,Near perfect!,"Such a great - and helpful - app!! Meal/calorie tracking is so easy and offers so much more than Lose It, which I used briefly before I found this one. Love the charts on here and ability to enter measurements! All in all, this is the best of these types of apps that I've found!"
503,503,5,2013-09-14T13:20:54.000Z,hansonscott1,Great app,I have been using mynetdiary D since June. It has helped me stay on course with my eating and watching my blood glucose levels. Entering all my food is very easy and being able to watch my carb intake makes all the difference.
504,504,5,2013-10-13T13:34:59.000Z,Watup Gee,Easy to use,"I've been using the app to keep carb intake in check. Because of minor dietary changes, I've actually lost weight and am eating healthier.  There's no guilt when I snack because I know exactly how many carbs I'm consuming before hand."
505,505,5,2015-05-11T00:27:17.000Z,bwtrits,Fun to use!!,"This App takes the ""scarey"" out of taking my blood glucose level and blood pressure because then I get to record them in this cool App.  I know, weird, but ya do what you've got to do!!  This App is very well designed and runs great!!  Does more than I'll ever need but it's nice to have to use!  Love this App!!"
506,506,5,2015-12-11T14:42:53.000Z,Plant 9 from outer space,Great Ap!!,I have used this Ap for about two years now to help me count carbs. My diabetes is the best it's ever been. Great A1cs and I've lost 60 pounds! This is the easiest way I've found to keep track of my dietary needs and control my diabetes. Thank you! I tell folks about your Ap all the time!
507,507,5,2016-01-04T16:58:27.000Z,Big D phx,Thank You!  Great App!!,"I am newly diagnosed Diabetic. As an avid iPhone user it is my go to for useful apps to help me out. I was so happy to find MyNetDiary. It has helped me track, not only my diabetes, but my diet and medications. The daily analysis and tip and hints for my activity and diet have taught me a lot."
508,508,5,2016-05-07T13:37:44.000Z,SMCrane,Hands down the best I've found,"I've used this for years.  Each improvement gets better.  I love the ability to mix in exercise, food, and other measurements like blood glucose, etc.  I love tracking data and this app is the best."
509,509,5,2017-02-20T22:10:11.000Z,Jsp8,Mynet Diary,This is the most complete and easy complete diet tracking app. And it has a vast number of food items in its database already and if you need to add a new one it is super easy. This is one Outstanding diet diary tracking app. IMO the best tracker as it even tracks your exercise calories spent.
510,510,4,2012-11-09T13:25:59.000Z,Saymayon,Great,"I like this app a lot. It is nice and easy to use. I'd like to see my Glucose average for a period of time and if it was near the first screen, that would be convenient. I see the average for the day, but was hoping for maybe an average of my choice (2 week, 1 month, etc.)."
511,511,4,2016-01-24T04:32:42.000Z,Riverfly,Almost a 5,"Everything you want in tracking blood sugar, insulin and everything else. Well thought out and complete. Customer service was fast and thorough but the food database is bazaar with restaurant and processed food but basic foods are hard to find. Clean up that and it would be perfect."
512,512,5,2016-02-16T12:10:00.000Z,First Break,Very useful app,"I have found this app to be indispensable in tracking all aspects of my daily health numbers. This app hasit all...food intake, exercise, glucose, blood work, and several other tracking tools. Should be the only tool you need to monitor your health."
513,513,5,2016-03-08T04:42:36.000Z,Mommabear23,Glad I got the diabetes version,"Wow. Glad I moved up to this version.  It allows me to do a very low carb, high fat keto diet and get my blood sugar back down. The Pro version put up a fight about the ketogenic diet parameters, and of course no BS tracking."
514,514,5,2016-04-19T19:02:18.000Z,ZunieAZ,Good Health,"MyNetDiary has very informative tips and articles. After you learn how to use the app, like track what you eat, measurements, and liquids, you  are motivated to improve your life. I like, that you can input your own recipes to keep track of calories/carbohydrates!"
515,515,1,2016-04-29T04:09:21.000Z,"The nickname ""Metalsmith"" is taken, because it's MINE!",Oh?,"Long time later: still doesn't work. They've quit answering my e-mail query's. They've got my money, I've got a program that turns itself off if I do anything!  Touch the screen---Zap! Program shuts down. Too bad there are no negative"
516,516,5,2016-07-04T20:05:25.000Z,Chris_Scm,Saving my life!,This app is literally saving my life. I have lost 70 pounds and have got my diabetes under control in a little under a year. I have gone from a HgbA1C of 11 to a 4.9!!! I am off all my insulin now. I give the credit to this marvelous app and it's note taking abilities. Bravo!!!
