,id,rating,date_time,user_name,title,body
0,0,5,2017-06-22T16:11:40.000Z,rikki1700,Use it and lose it,"Cataloging everything that passes your lips can be very tedious and all the times I tried writing it down I never seemed to be where my log was.  With this app and our age of technology, I'm never far from my phone.   I love that it interfaces with Fitbit and other apps.  Yes the food library is a bit limited but the app provides ways to help them help us.  It also allows you to put in your favorite recipe and account for things you'll never find in another place on the planet.   It conveniently lets you scan the upc and in most cases, the dietary data is provided.  When it doesn't, it's easy as pie to take a pic within the app of the front of pkg and of the nutritional data and they update the system as we collectively provide data.   You can keep track of anything you want in this app and it's especially helpful to see trends.   It's always a good thing to raise one's awareness and through the use of this app I've been able to significantly lower my A1C, lose 20 pounds over the last year and increase my awareness of what I'm doing to and for my body and health.  The spreadsheet is miraculous to review with your doctor and see trends that support your health.  My doctor commented, while I showed her the graph on her screen at the Ofc that she wished all her patients were willing to use technology to help themselves.  It inspires me to see the guy descend the slope each time I'm able to show another pound gone.   Yay for this app!"
1,1,5,2019-01-18T22:39:05.000Z,Nandav,Great app for Diabetes tracking,"This app is similar to MyNetDiary with added features such as tracking blood sugar and other medications.  It also syncs with other devices to track steps and exercise.  I also like the note-taking function.  I am using the Max version that I believe is worth the price.  Besides diabetes, I have other medical conditions and I find this helpful for everything.  Being able to log medications ensures that I don’t forget a dose or double-dose.  My doctor appreciated that I could show her my blood sugar results over a period of time."
2,2,5,2020-09-23T18:41:38.000Z,Rose Gardens,Good but reports need work,"Tracking is excellent. The paid version is great with xtra details for Diabetics.  However, the reports need the ability to customize. Printing is too small to read. I may be missing something, but you can’t change orientation, or get rid of the food grade column which is useless to my Doctor. The emailed report works, but the customized PDF daily can’t connect to the website and gives an error to Wait one minute and try again. They won’t process to print. This feature was working up to a few days ago. Emails to the support team have gone unanswered. Reports are the most important part of the app for me and my doctor. If this is not important to you, its a great app.  If support is given in this paid version, I will revisit my review."
3,3,5,2017-08-24T07:28:31.000Z,DaveSonoma,My indispensable tool,"MyNetDiary was my essential logging and guidance tool when I had to lose weight and get my diet into balance. Logging is a pain, even with a great tool, but for me it was the key to honest portions and steady progress. I could see my results in a wide variety of charts. In the long weight loss slog, an improving chart result was an encouraging boost."
4,4,5,2018-12-05T00:30:57.000Z,A searcher,I've Been Waiting Years For This App!!!,"Have been using 3 apps for years to track nutrition, diabetes & meds. Yippee!  One app to do it all. App takes into account all aspects of DM management. Was very impressed with d-carb count which make a significant difference in managing diet & meds. Daily summery of blood sugars, insulin & other meds, nutrients, H2o, activity, ability to set parameters for nutrients & blood sugars specific to the needs of the individual is much appreciated. Food database still on the small side but will enlarge as people use it I'm sure. I stumbled on this app by accident & consider it a very happy accident. Can't wait to show it to my DM & dietary educators. As a retired RN & having worked with many diabetics as well as now being diabetic myself  I can really appreciate this app. Good job guys!!!"
5,5,5,2018-12-11T11:36:22.000Z,tryin to do it right,Excellent!!!,"I’m a diabetic and track my blood sugars. I have tried several programs and had to input notes. With MyNetDiary it tracks blood sugars for you.  Charts for a quick reference of where you have been and how your doing. I especially like how you can check the rating of food, the breakdown of nutrients, fat content etc. It will show you the overall nutrients for the day. What your overages are ie fat, cholesterol, sodium and also where you have come up short ie potassium, vitamins etc. it will give you guidelines and information how to lower calories to help you attain your goal if losing or maintaining weight. I lost 50 pounds the last year, with a personal trainer, a nutritionist and MyNetDiary. My A1C went from 6.7 to 6.1. I came off of several medications that I have been on for years. Yes I still struggle with eating correctly but with MyNetDiary it keeps me accountable to myself."
6,6,5,2019-06-21T07:04:03.000Z,S.Lue,Life saver in many ways.,"Have a chronic illness is stressful enough.. living your entire life being a professional patient is HARD... but I’m extremely thankful for this app! Last year we finally found I have reactive hypoglycemia. It’s been a lot of trial and error, but being able to track and journal (and correlate blood sugars!) has not only been extremely helpful for myself, but also my doctors."
7,7,4,2019-03-12T18:05:14.000Z,owndao,What was free is now subscription,"It is infuriating to see features that were free become subscription only. $9 a month???? Ill write my own tracker on a spreadsheet. Then I can track and graph “tracked” items like I’ve asked for for years. Very disappointing to see simple tracking of nutrients now costing money. This is a trend in many money hungry vendors today, charge a fee for obtaining the app and then demand absurd amounts of money for features that were free and cost the developer nothing. I can understand needing fees to pay for subscription services in order to provide certain features that cost the developer to supply but charging for previously free services that cost the developer nothing because they are services that once included for one item cost nothing for 100 of the same."
8,8,5,2021-02-11T18:57:02.000Z,"""@&&$)((;//-realylovethisgame",Love this app! Worth every penny!!,"This app tracks everything! You don’t need any other app! One stop health app!!!!! I am a type 2 diabetic and I follow ketogenic diet. The app tracks my medications, My supplements, my blood sugar, my blood pressure, my oxygen, my steps,  my water intake,As well as giving me an amazing macros pie chart to look at. It lets me set my daily goals by carbs rather than calorie while letting me still watch my calories. I just love this thing! You have continued to make it better and better as I’ve used it and I am so excited to tell everybody to sign up here! I have told my whole family that they should have this app. So helpful for when you have medication and a forgetful mind to be able to track your medication & know exactly what time you took it! Wow,  you guys just keep getting better and better!!!"
9,9,5,2018-08-27T16:20:13.000Z,parkermv,Great app!,"***update from original post below. It’s been well over a year and this is still, by far, the best app for a Type 1 diabetic like myself. The only thing I could  hope they’d add is a Bolus advisor for folks like myself for whom a pump just isn’t an option.  ***"
10,10,5,2017-07-18T17:11:22.000Z,Limabuwa,Very Helpful,"I have used this app for a few months now and I really like it. I don't have diabetes but I have many relatives who do, so I check my blood sugar regularly just to keep an eye on things. I was trying to keep track of everything in a spreadsheet but this app makes it so much simpler. It's very easy to use. Entering glucose numbers and food is super simple. I like being able to create recipes for things I eat regularly. I've never paid more than a couple of dollars for an app before, but I would say this app was definitely worth the money. I also like that it links to the Fitbit app."
11,11,4,2017-07-18T17:28:46.000Z,mike-soba,All my stats in one place,"I had written a critical review previously (which I don't see).  However, after a few emails back and forth with the developer and using the app, I have a more positive response."
12,12,5,2017-07-20T13:57:19.000Z,johndig,Great system,This does everything they say and more. I use the diabetes add in and it tracks the most important things I need to know. Support is 5 star if there's a problem or question they will get back to you in record time. Getting and printing reports takes a little getting use to but it's nothing anyone cannot learn. Keep to the and you will lose.
13,13,5,2017-09-23T04:59:22.000Z,Vikwest,Great Tracking App,"Being diabetic, I keep track of my glucose readings daily. This app does that for me and makes it easy to see how I'm doing in the chart area. I enter all food and medicine, vitamins daily, and track all exercise. There is a chart for all so you can see your progress. It also shows a fat, carb, and protein sliding bar showing how much of each your body gets, and then the overage. It's great to watch my carb count. At the end of the week, you can print a complete report of all the food you eat and exercise. It's easy to enter everything you want to track. I really love this app."
14,14,3,2018-04-24T02:58:14.000Z,BillLenz,Long time user - do not like new interface,"New interface is clunky, too complex.  Too easy to enter data and accidentally delete it.  Reminders and buggy.  Keeps adding 24 hours to target times causing reminders not to trigger.  I am using my iPhone alarm to set reminders to test BGL after meals.  Labels used to sort current to to the top and usual near it.  Now there are a lot more labels but not sorted usefully so find what you want is a pain."
15,15,5,2018-05-17T17:20:44.000Z,blessingsbracegirtle,"Best app for Type 1, great support","I started using this over two years ago when I was diagnosed and it is what I use most on my phone from the time I get up and check my fasting BG and take my basal dose, through logging food, activity and ten or more BG readings a day to when I last check my BG before bed."
16,16,4,2018-06-15T12:22:30.000Z,JTinSC,App has glitches,"I use My Net Diary to track my blood sugar and insulin. But since the latest updates, the program has several major glitches. The most critical problem is that important nutrition data is not being calculated in the meal totals. The data is shown in the full description of the food, but the numbers are not loading to the meal screen. The problem is erratic and doesn’t happen with all foods. But as a result, my insulin doses have been off."
17,17,5,2018-09-10T14:33:19.000Z,HawaiianBunny,Think and thin,I have been using this app for about 2+ years and love it.  I can track all my diabetic insulin and carbs meds and exercise. I can go back days and months to see what works and what failed. I used this app for my Keto diet and lost 25# and tracked everything I ate plus added new recipes or foods. I could track my HCG and my insulin and meds. At one point I would print out my daily calories and take them to my dietitian to prove what I was eating and how to manage my insulin. I only had to pay extra for the print out but I paid only for the month I used it.  I can’t say enough good things about this app it has been with me for thick and thin. Lol you
18,18,5,2021-01-18T15:09:56.000Z,Toni by design,I love this app,This app is the best. I tried the others; however this one is easy to do. I've been doing it for six days and haven't missed logging what I eat and my glucose readings. It is helping me understand my personal relationship between certain foods and my glucose numbers.   I say cool beans!!!
19,19,5,2020-06-29T00:35:01.000Z,LizBre,The best app for managing the keto lifestyle!,"I tried 5 other top rated apps, this is by far the best one. With this app I can track my blood glucose, carbs, net carbs, protein, fat and a ton of vitamins and minerals; not to mention height, weight, body mass index, personal macro targets, water exercise, steps, meals, recipes, and custom and database listed foods. I especially like how you can use the bar scan feature to scan foods in the supermarket or at home to add to favorites and recipes. This app works great on my phone and my iPad. I rarely ever purchase annual fee based apps, but this one is Easy to use and well worth the annual fee."
20,20,5,2018-06-03T22:33:05.000Z,Frinklez,OMG! ❤️ it!,"I literally just got out of hospital because I was feeling HORRIBLE for a long time.  Unmanaged Diabetes.  It can KILL you.  It was killing me.  I already have health problems, but my blood had become too acidic, etc.  Dont be a fool, you have to manage your blood sugar levels track your foods etc.  I was following a high protein, low carb diet, but wasn’t consistent and I literally was destroying my body.  DIABETICS DONT EAT LOW FAT and HIGH PROTEIN!  Check out how to eat...it’s not what you think and this app keeps you on track!  They thought of everything!"
21,21,4,2018-07-18T22:51:35.000Z,"Timmy,,,,,",Great App,Love it! I love the store scanner app. It really helps you  make healthier choices. I thought I was making healthy choices this whole time. Not! Also like that you can scan your food in. The only problem is syncing my fit pro to this app. Not wanting to pay extra fee for this. It should just sync. Thanks to whoever made this app it is the best one I found that is so easy to use and cost efficient. Thanks for making my life easier. All the apps I visited are really ridiculous on how much they want to charge and they don’t work properly.
22,22,5,2018-09-05T11:37:13.000Z,gettysburger,Love this app for everything,"I have had this app for a while but never committed to it. Read an article about amputations from Invokana and decided to get serious. In eight days I am down four pounds and my morning number today was 102, the lowest in two years. My favorite thing about it is the food checker. I can go to the store and scan different products to compare their grade. Brilliant. I still get to eat yummy things but I can choose the healthiest from the bunch. Love love love this."
23,23,5,2018-12-03T02:53:14.000Z,RVC-FR,It's a great app!,"I've used this app for many years now and it has improved a lot. The truth is that the app is comprehensive and the sharing with Health App is nice. It also is able to import some data from the Health App like bp, and place that data on a chart. I like a lot the charts it shows where you can see your progress (or lack thereof). The widget allows for quick logging of blood glucose and a daily average. Highly recommended if you want to log and keep tabs on your progress. I wished it had the option to  track ketones in the urine."
24,24,5,2019-05-19T01:26:09.000Z,Black mountain gal,I love this app,I have diabetes an this is my go to support and weight loss tool. Sometimes I wonder away but always come back to it.
25,25,5,2020-03-22T21:03:23.000Z,manjer,Good diabetic app,"I really liked this app before, but the latest updates have made it even nicer to work with. I find I can't eat nearly as many carbs as it allows and still keep my blood sugar where it should be, but this can be adjusted in the settings. I wanted to combine this app data with fitbit and had to also purchase the max application; that didn't seem right to me, but maybe it was my misunderstanding. The app does allow you to track everything you need to and the reports can be tailored to most any of my needs."
26,26,5,2020-05-09T14:33:15.000Z,nickname: indy,Excellent,My Net Diary has helped me in tracking everything I eat and exercise to loose 20 pounds so far & helped me get my blood sugars down from over 200 into the 120 range. It has also helped me increased my water intake to a gallon a day. It’s been a big help. It’s important that you enter everything throughout the day so you can see that you are on track for were you want to be. My apple watch works w/ My Net Diary to track my steps & exercise. I paid for the full version. For me its worth it to accomplish my goal to a more healthier me.
27,27,5,2021-07-27T12:21:28.000Z,Great Grandma 3 Times,My Diabetic Tracker w/ Blood Glucose Tracker is Awesome,"I was diagnosed with Diabetes Feb 27, 2014. I  was 66 years old & there is no way I could even begin to properly keep track of my disease without this program. It tracks my glucose, my food, my exercise, my measurements, everything important to a Diabetic person. I'm always inputting information into my phone but I can't imagine how more difficult & more dangerous Diabetes would be to my life if I didn't have it.   The articles, tips & support help are awesome too. I totally recommend this program."
28,28,5,2021-02-23T17:42:37.000Z,Spartacus (Get Some),REALLY awesome.,"This wonderful app took the fear out of not knowing how to balance my diet by having complications with counting calories etc. Very well put together app, what a lifesaver. I hope this app always stay up-to-date and supported, it really makes a great difference for those of us that are looking to better our health due to health issues or not."
29,29,5,2020-07-28T21:57:38.000Z,PLW_CNF,Excellent for Diabetics!,"I absolutely love this app!!!  It is easy to log food and get full nutritional information.  This app is easy to read and has more integration of information, so if you need any information for doctors; you can create detailed reports."
30,30,5,2017-10-01T07:44:18.000Z,Tygerlilee,Like it,"I switched from another blood glucose tracking app and I like this one much better.  It's really easy to use and I like how intuitive the food logging is.  I wish it worked with my YUNMAI scale.  I don't want to have to buy another one to have it give body fat percentage, bone density, hydration etc that this scale already does for me.  Am planning on getting an iPhone watch hope to upgrade to max membership and that the watch works with it."
31,31,5,2018-10-29T16:44:26.000Z,ABirdVergara,I love this app,"When I was diagnosed with gestational diabetes I panicked! There was so many things I had no clue what they meant. This app helped me not only keep track of food intake, portion control and blood glucose readings but to understand what was better for my body. I love it! I recommend it to everyone! Even people who don’t have diabetes. It’s really helpful to go grocery shopping and scan the barcodes to understand what’s really inside foods!"
32,32,4,2018-11-11T19:54:34.000Z,TAI-JT,So far so good,Just started using the app to keep track of my blood sugar (pre diabetic) it's really helped me pay more attention to what I'm eating. Sometimes I may think it's something that's good for me to eat but it turns out it's not as good as I thought.  My blood sugar was all over the place but it's now staying fairly steady.
33,33,4,2018-12-04T23:29:06.000Z,biking1,Good but doesn't have a great food list.,"This is a good app especially for diabetics. Love the interface with Apple health and fitness apps. My only complaint is lack of library of fresh non processed or non branded food. Other apps are better in terms of having a larger selection of food items. However, I prefer this app for its interface with apps that bring food and exercise data in one place. Charts and dashboard are unreadable due things being printed over other reports."
34,34,5,2018-12-22T15:00:41.000Z,balldeagle,Great program,"I greatly depend on this program for records of my diabetic progress. This program is well thought out, and is very versatile, without a lot of unnecessary hocus-pocus. The developers continue to refine and improve this program. They are responsive to suggestion is to enhance the effectiveness of daily use. I would unconditionally recommend this program to any one who is serious about documenting their diabetic information."
35,35,5,2019-01-15T04:22:50.000Z,LutheranDad,Great for Diabetes,"T2D now on insulin.  The Diabetes app is great because it tracks multiple BGs, as well as insulin, a1c, etc.  It makes setting up recipes easy.  Note that the home recipes in my fitness pal aren’t available in the database this uses, because you can’t depend on the carbs being correct.  For a T1D and some T2Ds, that’s life threatening, so you have to set up each recipe yourself.  For example, 1 cup steel cut oats, 4 cups water, then weigh so you can calculate the carbs based on weight..."
36,36,5,2019-03-22T04:02:04.000Z,123itisMe,Saving a life one bite at a time.,"Finally an app that is so useful and easy to use and is literally saving my life. This app along with new technology like the freestyle libre sensor has helped get my A-1 C from a 17.5 down to 6.9. I may even be able to save my feet. I do not know of very many apps where the users can actually claim the app is improving their health and possibly extending their life. If you were diabetic, this app is a must have."
37,37,5,2019-05-16T18:15:58.000Z,Prairie poet,it does the job,I particularly like the versatility of that it offers me when making out recipes for dishes that I already like none of the other apps that I've looked at gave me the flexibility that this one does.
38,38,4,2021-07-30T13:39:38.000Z,Jmhfla,Great for foods not so for medications,"To begin, this is an excellent app for managing food intake. I am using this app to lower A1C and loose weight. It’s important to record everything, but so far it’s worth the effort recording food, exercise, and water intake as I am reaching my goals. By the way the app sets a realistic goal to reach the weight loss you want to achieve.... very good. I only wish when recording meditations you could repeat previous entries. Thanks for a well thought out app. Won’t let you print a report?"
39,39,5,2021-04-14T10:31:39.000Z,dds113,"Top notch, best easiest food diary","It’s not a struggle to log your food! It’s extremely interactive. Easy to scan your food and make changes, watch the apple and bicycle, watch videos and get helpful tips. They also send to your email a weekly update and breakdown of nutrients exercise weight loss blood glucose ( BG)  water intake. They have reminders to drink water or take BG if you would like and so much more. Worth the premium price 10 x over."
40,40,5,2017-06-18T14:23:13.000Z,sarahsanantonio,Very complete app,"I use the food log, as well as the exercise log and the medication log.  The food log has a very large database.  You will find most foods in there, especially if you eat a lot of processed and packaged foods.  It is a bit more difficult if you cook for yourself.  The medication log has been helpful to see if I've forgotten to take meds.  I don't have diabetes, but the diabetes tracker looks useful."
41,41,5,2017-07-25T14:55:23.000Z,Suzie1943,Useful for tracking almost everything.,"MyNetDiary has been very useful for all food related issues, weight, exercise. Fairly easy to use.  Only problem I ever have is for recipes which are healthier or made healthier with ingredient switches. Have to go to separate app to figure out nutritional values. But all in all, this app has worked well for me. Couple years later, it still works."
42,42,5,2017-07-26T13:40:45.000Z,GoKat4ever,Great application for weight loss and diabetes,"As a person with diabetes, I have tried a lot of different applications to help me manage my diabetes. None come close to My Netdiary.   My A1C is steadily going down."
43,43,5,2017-08-01T13:57:27.000Z,Wisconsin Lisa,Great aid for diabetics and anyone else,"MyNetDiary is a thorough, intuitive app that could be helpful for anyone that is attempting to get a handle on what they are eating, and when. Or anyone who wants to track various things such as medications, or water intake, or certain exercises. But it's especially helpful for any diabetic that is determined to get BG under control, helping you to see patterns and weak spots. Good luck out there!"
44,44,5,2017-09-12T13:29:28.000Z,SchilperoortJ,Super for diabetics,"I am a Health and fitness teacher and am always looking for examples of apps to show my students.  This was one of the best, working with the apple health app the students often take the apps I show them home to their parents.  The student becomes the teacher, the family learns and the student achieves higher order thinking.  It's a win, win!"
45,45,2,2017-11-28T17:37:06.000Z,Darlasu70,Nice app limited food info,"I love these features:  iOS friendly, tracking my blood glucose, exercise, food, vitamins and medications."
46,46,5,2018-12-12T02:34:07.000Z,santarosa707,Review after 8 days of use,"Great app for tracking diabetic lifestyle change. Like how it’s shows the relationship between exercise and diet. Like the various educational links. Like the ability to plan daily menus around what I like to eat and still have control on sodium intake. It took me a couple of days to get use to the app. Above all, It makes me conscious of the food I eat."
47,47,5,2019-01-09T23:32:02.000Z,Roundsout,Excellent App,"I am a diabetic and I use the app to watch how I eat, track my blood sugar, and lose/maintain weight.  The app has been very helpful.  The charts are very helpful and valuable to my physicians.  I’ve been using the app for almost two years now and with their improvements, I will likely be using it for the next two years or more."
