,id,rating,date_time,user_name,title,body
607,607,5,2016-10-04T16:03:51.000Z,quechy,I use it everyday,"There are many apps that help you chart activities, blood glucose,etc. but I find this is the best app to monitor you diet. It gives you the analysis and it has be pretty accurate. Great app."
608,608,5,2016-10-07T12:42:08.000Z,RichieRich98,MyNetDiary D,"Great for diabetes and food consumption tracking. Can also track blood pressure, heart rate, medications and many others. This app keeps getting better as the developer actively supports this app. Kudos to the developers!"
609,609,5,2016-11-07T15:10:07.000Z,Sherlayne,Life-saving!,"So easy to use; all you have to do is stay focused! (Yeah, that's the tough part.) It's the only app out there that conveniently tracks glucose readings along with nutrition, water and exercise. I highly recommend MyNetDiary."
610,610,5,2012-10-11T14:58:18.000Z,Grannysquare,Best ever,"This is the best ap purchase I've ever made. I use it daily, all day long. Entering foods is super simple. I love how I can track everything in one place and see trends with my blood sugar. It links my Fitbit info too. Love love love it."
611,611,4,2012-10-29T02:46:59.000Z,clholmes55,Great Tracker,User friendly app that tracks everything.  Most foods are included in database. Barcode scanner does not work as well as other applications & adding recipes is more difficult but am overall pleased.
612,612,5,2013-03-21T21:19:51.000Z,tommyg777,Works well!,I like the graphs that it is able to present. It is easy to enter data and I like the idea of entering glucose and several other data items.
613,613,4,2013-08-07T01:33:31.000Z,Cousins Camphouse,New Diabetic,"I was newly diagnosed with Type 2 diabetes this summer. This app has been invaluable in helping me track my glucose levels & my food intake. Fast, easy, & transfers data between my iPad & iPhone so I can take it with me wherever I go. Love it & highly recommend it."
614,614,5,2014-01-10T23:59:23.000Z,Rheannin,Love this App,I just got diagnosed with diabetes and this app has enabled me to get on track within days. It is so easy to use and tracks everything you need. Highly recommended.
615,615,5,2015-07-19T21:09:55.000Z,Mylilhaybuddy,Excellent App!,Does everything I need it to do. Would highly recommend this to other diabetics or anyone wanting to track their progress.
616,616,5,2016-01-30T14:51:41.000Z,Timecopsgirl,Love the app!,I love the app and have been using it for years (on and off). I only wish they had more 'unusual' types of foods already calculated it. I'm a gluten free vegan and my food choices are not always there.
617,617,5,2016-04-19T14:01:25.000Z,geektothecorenj,Great App for Diabetics,I downloaded this app from the hospital I was in after being diagnosed with type 2. It has helped a lot and now with diet allows me to understand what i consume to manage my diabetes. Great app!!
618,618,4,2016-08-02T22:02:12.000Z,DWGDAD,Very helpful,"As a recently diagnosed type 2 diabetic, this app has helped me as I try to learn how to eat better, lose weight and be healthier."
619,619,5,2017-01-02T23:19:37.000Z,ndls at large,Great manual data entry,"It is very easy to enter data or modify existing data.  Cues for food intake work very well.  Insulin and bg entry is easy as well.  Data export is ok if you want preformatted spreadsheets, but raw data is very hard to get."
620,620,5,2012-12-07T10:37:53.000Z,Ishmiael,Well done app.,I was diagnosed a few weeks ago and this is already helping me. It's great to have your diabetes and diet information in one user friendly app at your finger tips.
621,621,4,2013-02-16T14:48:27.000Z,jauchenbach,Impressive but lacks a lot of barcodes to scan,I really enjoy this app. One of the few to combine diabetes and weight loss. But I do wish it had more foods in the database. And whenever I try to scan a barcode it is not in the system.
622,622,5,2015-02-05T12:28:19.000Z,Ppeenngguuiinn,GRATEFUL!,My A1C went from 9.6 down to 6.8 in 3 months because I could see how foods effected my blood glucose. This app literally showed me what I foods worked with me and which foods were killing me. I am forever grateful for this app.
623,623,2,2015-04-10T15:03:22.000Z,Dann12262010,Thanks...,This app is much improved. It's still stuck in calories which I don't count. I got one whole day logged in before I hit the app's inability to receive my custom selections. I don't eat out. I don't eat prepackaged foods.
624,624,5,2015-08-23T14:09:04.000Z,John3902,Fixed most problems with the latest version,"Excellent app. Does everything I expect, and does it well. Food database a little sparse, but improving."
625,625,5,2015-10-12T14:54:14.000Z,Artsie1,Put back Fitbit connection please!!!,I was in love with this app until it no longer synced with Fitbit. Months later now and still missing the Fitbit sync. Please put the sync back!
626,626,4,2015-11-14T16:53:44.000Z,Sammy 235,Great app!!,"This app helps me in so many ways.  I'm able to keep track of everything.. Sugar levels, food intake exercise, you name it all in one place.  It's like a one stop shopping center for diabetes.  Thank you for creating such a great app!"
627,627,5,2015-12-15T03:44:01.000Z,swot girl,Brilliant!!,"Having just received the news that I was diabetic was completely overwhelming, but this app has helped organize me and help me get a handle on all the things I need to remember. This app is a literal lifesaver!"
628,628,5,2016-05-07T20:31:33.000Z,Lkt997,Great app!,Easy to use. Some of food names don't always make sense to me. Mfp has way more food listings. I like this one because I can record my glucose readings and food intake all in one place.
629,629,5,2016-06-25T11:00:27.000Z,Nurse can,Tracking tool,It has been effective for me as a tracking tool for food exercise and water log that's handy and easy to use. Creates mindfulness.  Thanks
630,630,4,2012-08-02T18:50:29.000Z,SnoopyDJR,Very Comprehensive,Being able to track so many things in one spot is very attractive in this App. Thumps up to the dev team. Only comment is on the reporting aspect. Needs work in my opinion. Like everything else it'll get better.
631,631,5,2013-02-03T19:10:39.000Z,Gmoney 913,Invaluable!,I'm diabetic & 6 months post kidney transplant.  I've been using this app since before my transplant and it's been so helpful in keeping track of my changing dietary requirements!  I'm addicted to it!
632,632,5,2013-10-10T04:07:15.000Z,Joguss,Keeps me informed,This app was suggested to me by my nutritionist. The app helps me track and provide information on how I am doing with my goals. I would recommend this app to others.
633,633,3,2015-11-10T12:41:00.000Z,BCarruth62,"Good food app, needs work on diabetes","As far as the food part goes I love the ability to scan in my food and see where I stand on my nutrition. The diabetes part needs work though, would rather see a BG daily graph instead of the sugars being put into time slots."
634,634,4,2015-11-10T14:57:14.000Z,Tnthomy,Money well spent,"Honestly, it is expensive. But it's money worth. I lost 25 lbs with the help of this app. Track all my health facts and print the report (which I'd love to select the reported details a bit better). All around, it's not perfect but close to."
635,635,5,2015-12-29T03:14:06.000Z,Cde1126,Net Diary,The app that all type 2s should have to help keep records on just about everything their health.  The app does the job very well.  Helps to keep properly maintaining records for following my health.
636,636,5,2016-07-04T12:04:04.000Z,SandyL23,Really useful!,So glad I found this app - SHOCKED at the nutrients of my fav foods!   The diary-log reminder notices really help - I have lost 18 lbs do far.  Nice feature to be able to add custom foods & the barcode reader is really quick to add foods.
637,637,5,2016-08-22T13:48:56.000Z,pt511,Great app,"This is the best app of its kind that I have come across. You can pick and choose how to use the info, stats and it's easy to use. And accurate.  A must have food tracker app!"
638,638,5,2016-11-08T01:20:58.000Z,PRECIOUSONE2,Phenomenal,"Absolutely love this app. Takes all the guess work out of it. I love that it also tracks my water, exercise and blood sugar readings. It really helps to keep me on track!"
639,639,5,2017-05-25T11:34:57.000Z,ML Landscaping,Keeps you honest,"It's nice to have an ap that keeps you honest, gives good tips and covers all your basis.  I particularly like how easy it is too look up food and enter recipes"
640,640,4,2013-02-07T18:57:29.000Z,reiko ortega,Minus one star for not having IPad app.,"Best diabetes tracker I have used thus far. Easy to keep track of food, exercise, insulin, etc. I just wish they would make an iPad app since I switch back and forth between my phone and iPad."
641,641,3,2013-03-26T14:42:26.000Z,Bobby Lange,Great Help,awesome app but the only problem is just about barcode you scan is not recognized but when you search the same food it's in the database 70% of the time so that needs to be updated also I honestly do not think its worth $9.99 way to high a price for this
642,642,5,2013-12-15T13:33:18.000Z,Bearetteone,My net diary,"Great. It manages my diet and I can easily keep track of not only calories but also carbs, sodium, cholesterol, sugar etc. I've been using it for about 6 weeks and have lost over 15 lbs!"
643,643,1,2014-04-14T05:55:35.000Z,DLPM2,Disappointed with Charts,"I upgraded to the Pro version, thinking I'd get some decent charting for my blood sugar levels and a way to email a report. If it's there, I'm not seeing it. I checked out their website and it doesn't seem to offer any diabetic reporting. Pointless to enter all the data if it can't be used to produce a high-low-average sugar chart to help me see trends and adjust my medications."
644,644,5,2015-03-13T15:14:45.000Z,Boston Fan,Excellent,If your diabetic this is the program for you. Don't look any further. This is the perfect program to control your blood sugar and loose the weight you need.
645,645,5,2016-03-06T15:13:19.000Z,Largish,Has Everything,"Has everything a newly diagnosed diabetic should use to keep track. I use it all day, everyday. It also can sync with a Fitbit."
646,646,5,2016-03-12T18:37:40.000Z,Attomickitten,Thank you,I started using this tracker when I was diagnosed pre diabetic.  In 4 weeks my body feels better for helping me track my caloric intake and carbs.  I have lost over 20 lbs.
647,647,5,2016-05-27T11:59:13.000Z,Teachergirl64,Best money I've ever spent!,"After struggling for years to balance eating for IBD and diabetes (polar opposite diets), I found this app and it allowed me to gain control. I've lost almost 20 pounds and my a1c has gone from 8.4 to 6.4."
648,648,5,2017-01-01T16:03:00.000Z,Apumilia,A Must Have For Diabetics,Used for several months now.  This app is the easiest tool I've ever used to maintain my weight and blood sugar levels. I highly recommend it.
649,649,5,2017-01-30T14:37:37.000Z,Texasponyclub,RAtracker,Love this app. I have problems keeping my weight up and this helps me to track my Whole Foods intake to make sure I'm getting my calories. Love the blood pressure tracker and diabetes tracker
650,650,5,2013-09-07T14:39:39.000Z,emriab,Thank You for This App!,"I love this app!  Perfect tool for managing your health on a daily basis and tracking progress.  For the first time, I am seeing real results due to better information."
651,651,5,2015-06-06T16:42:22.000Z,SteveMorrow,First App review,"I have been a diabetic (insulin dependent), for 15+ yrs. have fought A1C all those yrs (readings range 8.3 - 7.3). This App gave me the missing link for full control and weight loss as a plus. Now have all readings below 7.0."
652,652,4,2016-01-25T20:35:32.000Z,Gavins_bat_girl,What?!,"This is one of the best apps out there. However, it has since stopped syncing with Runkeeper. If this is a ploy to get me to spend another $2 to get THEIR activity tracker, no thanks. I'll update when this is fixed."
653,653,5,2016-04-19T17:43:09.000Z,HannahBoo22,My net diary,"Great product. Continuous improvement on the app with increased features. It works well with my fitness,  diabetes, and calorie intake. I have recommended to multiple people I know."
654,654,5,2016-04-19T22:08:02.000Z,PatchworkHeart,Love it!,"This app is wonderful! It's easy to use and contains the information I need to track my glucose levels, as well as my calorie intake. I highly recommend it!"
655,655,5,2016-05-06T12:08:55.000Z,Medic72jen,"Intuitive, easy to use and fits in well with my life!",Having one place to keep track of pretty much everything concerning my health is great!
656,656,5,2016-05-23T16:00:07.000Z,Koi-ish,Worth your time worth your investment,Intuitive great user interface. Easy to log. Vast array of charts. Allows you to be as detailed as you want. Everything related to health.
657,657,5,2016-08-18T23:57:37.000Z,KD48,Comprehensive,Very comprehensive as far as macro & micro nutrient tracking. Entry is easy and pretty quick. I have tried others but this one seems to meet my needs the best.
658,658,5,2016-09-08T13:49:25.000Z,JMCU2,Luv it,"If you want to lose weight, MyNetDiary is a must app to have. It is so easy to enter data and keep up with your progress. I have lost 32 pounds so far with 15 more to go."
659,659,5,2017-01-02T23:59:00.000Z,dk921,Love this app,Easy to use and helps me stay on track. I needed a way to keep track of my blood sugar and exercise --- I like having an app that covers so much.
660,660,5,2012-08-14T16:57:42.000Z,Tcrosby,Great,So far this is a great app. It has everything I am suppose to monitor. I have not been to the website but I hope there is a printable record I can take to the dr office.
661,661,5,2015-01-25T01:36:56.000Z,Cmppals,Upgrade review,I agree with first review. Would like to see carb amount upon opening item. Like the food score number system over letter grade. Overall great app!
662,662,5,2016-01-05T04:06:33.000Z,Deuce ah,My Net Diary Review,This app is very user friendly and easy to use. It is wonderful to be able to have both dietary and diabetic management in the same app. Very happy. Thank you!
663,663,5,2016-02-17T14:06:37.000Z,Dianga,Very comprehensive app,"Glad to have at last found an attractive, easy to use app that tracks food and blood glucose - very helpful for diabetes management!"
664,664,5,2016-02-23T11:24:39.000Z,WM7654,MyNetDiary,"I like everything about this app. I would like to see a simple chart that shows date, time, blood glucose readings and amount of insulin taken."
665,665,5,2016-05-06T20:33:27.000Z,Simply36Me,Love the Grading,Very helpful to grade the food knowing what is good to eat what's not good to eat… Somethings kind of shocked me on the rating they got which was a surprise because it added more choices in my diet
666,666,3,2016-07-13T14:24:11.000Z,Zst1999,Database of foods is not very complete,"Database of foods is lacking a lot. While I love the ease of tracking carbs with this app, it isn't much use without thorough options. I will be returning to my fitness pal because their food choices are very well done. Sorry I spent money on this app."
667,667,5,2016-07-30T19:07:35.000Z,ddketch,Great help,I found this app at the suggestion of my brother.  It tracks everything I need to do daily.  Now I would be lost without it
668,668,1,2016-11-26T23:08:02.000Z,FranKaj,Can't enter blood glucose readings!,"I have recently been diagnosed with type 2 diabetes. I bought this app with the expectation that I could monitor my blood glucose levels, but although there are charts for blood glucose readings. How in the hell does one enter their blood glucose levels? The main page allows one to enter exercise, meals, steps, water intake, and you can even monitor custom setting. BUT NOT BLOOD GLUCOSE LEVELS."
669,669,5,2017-01-21T13:31:28.000Z,Will Glasgow,Best diabetic App,"After having tried several helps for keeping track of all the different aspects of diabetes, this is by far the best."
670,670,5,2012-11-08T00:27:56.000Z,Sylvainsatori,Health,Great app does what it claims. Very handy at keeping track of your diabetes. Very easy to use. More food options and restaurants needed. Allow to sync with workout apps
671,671,5,2014-05-01T14:29:30.000Z,Keennon,Very fine program,This is great for diabetes. Well-organized. Huge numbers of foods already entered and very effective implementation of bar-code recognition. Recommended.
672,672,5,2015-04-18T13:03:08.000Z,JenJayTyler,Awesome app,"I love this app. I can track my meds, blood sugar and food log. I can now see my trends and make better decisions about my diabetes and more easily with my doctor."
673,673,5,2015-10-02T02:33:08.000Z,Carl_U,Fantastic guide/teacher,I'm a newly diagnosed type 2 diabetic and this app has been an incredible tool. I learn more every day as I use it and I'm on track to manage my diabetes.
674,674,4,2015-11-12T12:09:05.000Z,Becki P,Very Useful,"Great app. As a newly diagnosed Type 2 Diabetic, I needed help keeping track of everything. This app works well. The charting and reports need to be tweaked a bit... but overall this is a very useful app. I highly recommend it."
675,675,5,2016-04-08T16:06:22.000Z,JerDav67,Fantastic!,First app I have found that will provide all the functions of a daily nutrition log with BG tracking. Also love the email reports.
676,676,3,2016-04-20T03:20:47.000Z,StrongGal,Absolutely depend on it but...,Helped me get my carbs and other nutrients under control. Only problem is the Report which displays many nutrients in % of daily target instead of Unit Weights (i.e. grams). Result is inaccurate tracking of key nutrients like Calcium. What good is a great app if the results displayed are inaccurate?
677,677,4,2016-04-27T12:30:59.000Z,sdwillster,Great app,"This app has really helped me lose weight and get serious about managing my prediabetes. It has a big food database and is easy to use. Together with glucose monitoring, it will help you better understand what foods trigger your highs and lows."
678,678,3,2017-01-04T13:28:19.000Z,Zenmaster6473,2 year review,Overall it's a good app. What I do like is the ease of use. What's lacking is the ability to print reports that may be taken to doctor. Would also like to see a quicker way to enter basic food items into diet quicker.
679,679,5,2017-02-17T00:21:02.000Z,Giffsbje,Helpful,"Very helpful app, one place for everything. I can hand my phone to my doctor and with a swipe she can see it all!"
680,680,5,2013-01-10T12:28:00.000Z,D-lo 99,Great app!,I have been using this app for a couple of months and it has had a very positive impact on my lifestyle and BG control; it's great and I wish I had found it sooner!
681,681,4,2014-02-07T20:05:14.000Z,BruceCamp,Very at good at what it's supposed to do,"Very good for keeping track of sugar, diet and exercise. Wish it would allow me to group my meds together that I take together, so I don't have to put them in individually."
682,682,5,2014-05-01T14:32:26.000Z,Emnmnmnnmnm,Fantastic Ap!,This ap really helped me during my pregnancy! I was diagnosed with gestational diabetes and this ap made it easy to track my food and glucose readings! Highly recommend!!!
683,683,4,2015-01-22T15:40:52.000Z,Ljt75063,Disregard previous review,Works only with portrait view. Problem overlay only exists if you try to start with landscape view. App only works with portrait. Not a problem if you're aware of it. :)
684,684,5,2015-11-10T15:57:06.000Z,SJK Long Island,Love,Couldn't live without. Keeps track of everything (glucose calories exercise) and helps get you to goal weight.
685,685,5,2016-05-01T11:32:36.000Z,Purrs girl,Fantastic product,This is a great app! It is very user friendly and easy to master. I love the scan capabilities to find food. If you are diabetic this is the app for you!
686,686,5,2016-06-25T19:30:28.000Z,Llb47,User,"As a newly diagnosed diabetic in last yr, I have found this app invaluable. Makes it so easy to track food, carbs, exercise, weight etc."
687,687,5,2017-01-02T13:05:16.000Z,Jaylamb1,Excellent,"This app has been key to me losing 40 lbs and keeping it off, consistently tracking my caloric intake, controlling my blood glucose, and keeping diabetes in check."
688,688,5,2017-01-02T14:40:35.000Z,Sky-guy 17,Grandma Kathy,"Tracking is much easier, with lots of categories so I can watch for signals that my health is out of level. I like that it tracks medications"
689,689,5,2017-01-05T13:46:58.000Z,RowdyMule,Great app,Great app that gives you an easy-to-use and easy-to-understand way to quickly enter your stats and monitor your wellness goals.
690,690,5,2014-07-13T00:34:21.000Z,Willeman221,Knocks spots off GlucoseBuddy,I used GlucoseBuddy  for 3 years. This app is just so much better for me. Having said that - don't neglect to check out GB - it may be right for you.
691,691,5,2015-03-07T03:09:59.000Z,Vsmith1814,Mynetdiary,This is a great App. The updates work and they constantly improve the App. It has greatly helped in controlling my diabetes and weight loss program
692,692,5,2015-05-23T13:54:42.000Z,Presence Fan,Extremely helpful and throughout,I am newly diagnosed diabetic and wanted an app to log in my info. I also count calories. This app is well with the money WITHOUT a doubt !!!!!
693,693,5,2015-09-09T13:11:51.000Z,savannahjoy89,Terrific App!,Type 2 diabetic no meds and keeping it that way. This app gives me everything I need to monitor my health and keep me on track.
694,694,4,2016-01-27T02:24:58.000Z,Honest Reviewer in AZ,Awesome App for tracking nutrition,"Great app for tracking calories, carbs, & weight management. The only tiny thing I'd like to see is the ability to have this app sync with my Withings app (wirelessly tracks my weight, bmi, blood pressure, & physical activity).  :)"
695,695,5,2016-05-09T14:37:03.000Z,Bbkenn,It's an essential part of my day!,"Great app, has most foods, love the analysis to see what I've done right or what I need to improve on. I highly recommend it."
696,696,5,2016-05-09T18:00:44.000Z,Carole R C,Love it,Have tried other apps and always come back to this one. Love how there are so many options all in one app.
697,697,5,2016-06-08T11:46:18.000Z,Capt.Ack,Happy customer,"This app has been amazing, I've been using it for about two weeks now and I am 100% satisfied."
698,698,5,2016-06-30T14:07:10.000Z,Vitof,Really overs the bases!,I have used this app for some time and it really has been great. I log in 4 times a day for food and glucose readings. I has kept me on task!
699,699,5,2017-01-02T15:01:29.000Z,ecmatheny,Well worth the cost,Fabulous app for tracking weight and diabetes data. Food diary database is excellent.  I tried others and I love this one!
700,700,5,2015-06-14T12:35:59.000Z,Clcans,Mynetdiary,This app almost couldn't be better. After they added sugar diabetes it fills almost every diet exercise and medical tracking needed.
701,701,4,2015-06-15T16:51:48.000Z,Nina1011,Love this app!! but....,Just about perfect. Only thing that could make it perfect would be the protein count for each meal (already gives total carbs for each meal and snack). All diabetics know protein need to accompany carbs :)
702,702,5,2015-06-29T01:47:39.000Z,roigearguy,What a great App!!!,"One of the easiest tracking tools I have found for exercises, meds, meals and numbers. And it syncs with health and other Apps. I'm sold on this one!!!"
703,703,5,2015-11-11T16:29:38.000Z,Dudetodo9,Very informative and helpful.,It helps me stay on track and points out where I need to make necessary adjustments
704,704,4,2016-03-17T15:09:19.000Z,Mountain Viewer,Very helpful so far,Still learning to use it. Support has been very responsive when I ran into issues resetting an old account. Seems very comprehensive.
705,705,5,2016-03-30T16:27:53.000Z,Jpbmed2004,Great app,I've lost 4lbs by using this app. Helps track my carbs and sugars well! Also being a diabetic it allows me to put my BG in also! Great for tracking
706,706,4,2016-04-28T20:40:22.000Z,AtomicCola,Very good app,Finding more useful features then originally expected.
707,707,5,2016-09-09T13:36:11.000Z,GA_willeman,The leader of the pack,This app does it all - and does it well. I've tried many. Stop wasting your time with the rest.
708,708,5,2016-12-03T09:24:11.000Z,Scotman999,MyNetDiary D,Use the Diabetic version to enter glucose level.
709,709,5,2017-01-02T12:19:50.000Z,wardswoods,I use this app everyday,I'm a type 2 diabetic and totally live by this app. It tracks everything and is very easy to use.
710,710,5,2012-07-31T11:12:58.000Z,Thom1948,Mynetdiary D,I have used three or four other programs and they were ok but none had all the features to help me!  Thanks!
711,711,4,2012-11-24T18:38:06.000Z,Celiac Suze,Great app,As much or as little information you want/need. User friendly. I like the chart and reports. I just updated to the Diabetes app from the free version I used for the last 2 years. Nice.
712,712,5,2012-12-30T03:26:18.000Z,Teacherray,Excellent,I have been using this app for several weeks and find it to be outstanding.
713,713,5,2013-08-31T02:14:39.000Z,DJ Death Walker & HsiWangMu,Great app,"Tracks carbs, weight, blood sugars, cals. I have entered my other meds and keep track of them as well.  It graphs charts and emails reports; so I can send a food diary to my nutritionist."
714,714,5,2013-10-05T10:28:45.000Z,2sweet22,Great App,"Great App, it helps me track my results, it's easy to do, very user friendly, nice for when doctor ask you for your results!"
715,715,4,2014-08-10T16:30:40.000Z,Robert654,Impressive,"This app works well, and I'm losing the weight I don't want. The new design doesn't allow for 1st screen entries, which is a pain. Other than that, good features and graphing capabilities."
